109260,00973283,n,10,small mostly marine warm-water carp-like schooling fishes; used as bait or aquarium fishes or in mosquito control,"2158,2188"
109322,00983529,n,10,small bottom-dwelling fish of warm seas having a compressed body and a long snout with a toothless mouth,"2158,2188"
109341,00986478,n,10,animal reproductive body consisting of an ovum or embryo together with nutritive and protective envelopes; esp. the thin-shelled reproductive body laid by e.g. female birds,2158
109369,00990967,n,10,a flexible rodlike structure that forms the supporting axis of the body in the lowest chordates and lowest vertebrates and in embryos of higher vertebrates,2233
109422,01001339,n,10,primitive eellike freshwater or anadromous cyclostome having round sucking mouth with a rasping tongue,"2158,2188"
109414,00999765,n,10,extinct small freshwater jawless fish usually having a heterocercal tail and an armored head; of the Silurian and Devonian,"2158,2188"
109474,01010616,n,10,small bottom-dwelling shark of warm shallow waters on both coasts of North and South America and from southeast Asia to Australia,"2158,2188"
109525,01020053,n,10,any sluggish bottom-dwelling ray of the order Torpediniformes having a rounded body and electric organs on each side of the head capable of emitting strong electric discharges,"2158,2188"
109534,01021763,n,10,large venomous ray with large barbed spines near the base of a thin whiplike tail capable of inflicting severe wounds,"2158,2188"
109546,01023803,n,10,extremely large pelagic tropical ray that feeds on plankton and small fishes; usually harmless but its size make it dangerous if harpooned,"2158,2188"
109648,01054270,n,10,South American species of scarlet finch with black head and wings and tail,"2158,2188"
109672,01058072,n,10,common North American finch with a white patch on the throat and black-and-white striped crown,"2158,2188"
109683,01059963,n,10,small North American bush-loving finches: New World buntings,"2158,2188"
109740,01068637,n,10,small fast-running Australian bird resembling a wren and frequenting brush or scrub,"2158,2188"
109788,01076984,n,10,any of numerous South and Central American birds with a curved bill and stiffened tail feathers that climb and feed like woodpeckers,"2158,2188"
109829,01084248,n,10,small songbird of northern America and Eurasia having a distinctive white rump,"2158,2188"
109868,01090783,n,10,flycatching warbler of eastern North America the male having bright orange on sides and wings and tail,"2158,2188"
109956,01104691,n,10,long-tailed black-and-white bird that utters a chattering call,"2158,2188"
109999,01111718,n,10,any of various small insectivorous birds of the northern hemisphere that climb about on trees,"2158,2188"
110010,01113660,n,10,bluish-gray nuthatch with black head and white breast; of eastern North America,"2158,2188"
110054,01120947,n,10,any of numerous Old World birds having a strong hooked bill that feed on smaller animals,"2158,2188"
110104,01129792,n,10,large hawk of the northern hemisphere that feeds chiefly on small rodents and is beneficial to farmers,"2158,2188"
110122,01132744,n,10,any of numerous large Old Wold hawks intermediate in some respects between typical hawks and typical eagles,"2158,2188"
110135,01135095,n,10,widespread from southern United States to Central America; rusty black with black-and-white breast and tail,"2158,2188"
110181,01142737,n,10,large black-and-white vulture of South and Central America have colorful wattles and wartlike protuberances on head and neck,"2158,2188"
110242,01154097,n,10,widely distributed brown or black North American salamander with vertical yellowish blotches,"2158,2188"
110261,01157133,n,10,small mostly terrestrial New World salamanders having neither lungs nor gills as adults,"2158,2188"
110263,01157601,n,10,mostly terrestrial salamanders that breathe through their thin moist skin; lay eggs in moist places on land; rarely enter water,"2158,2188"
110325,01168653,n,10,nocturnal burrowing toad of mesquite woodland and prairies of the United States southwest,"2158,2188"
110365,01175415,n,10,in some classifications the family of the genus Xenopus which is otherwise included in the family Pipidae,2158
110375,01177472,n,10,in former classifications a division of Amphibia comprising all pre-Jurassic and some later extinct large salamandriform amphibia,"2158,2188"
110374,01177210,n,10,"formerly a suborder of Stegocephalia; amphibia having vertebrae whose component elements are fused into a single piece: ""most vertebrates are stereospondylous""","2158,2188"
110446,01194280,n,10,only extant member of the order Rhynchocephalia of large spiny lizard-like diapsid reptiles of coastal islands off New Zealand,"2158,2188"
110502,01204757,n,10,type genus of Scincidae,"2158,2188"
110511,01206296,n,10,tropical New World lizard with a long tail and large rectangular scales on the belly and a long tail,"2158,2188"
110542,01211667,n,10,type and sole genus of Xenosauridae: slender-bodied Mexican lizards having the upper surface covered with tiny granules and tubercles,"2158,2188"
110595,01220775,n,10,extinct terrestrial reptiles having birdlike pelvises: armored dinosaurs (thyreophorans); bone-headed and horned dinosaurs (marginocephalians); duck-billed dinosaurs (euronithopods),"2158,2188"
110639,01228795,n,10,herbivorous or carnivorous dinosaur having a three-pronged pelvis like that of a crocodile,"2158,2188"
110640,01229021,n,10,gigantic herbivorous dinosaurs having huge bodies with long necks and small heads: Prosauropoda and Sauropoda (apatosaurus; diplodocus; titanosaurs),"2158,2188"
110696,01239235,n,10,authorities disagree over whether to classify the genus as bird or dinosaur,"2158,2188"
110720,01243583,n,10,extinct flying reptile of the Jurassic and Cretaceous having a birdlike beak and membranous wings supported by the very long fourth digit of each forelimb,"2158,2188"
110747,01249308,n,10,a genus of reptiles of the family Colubridae including ringneck snakes,"2158,2188"
110787,01255729,n,10,any of numerous nonvenomous longitudinally-striped viviparous North and Central American snakes,"2158,2188"
110823,01261395,n,10,burrows among roots of shrubs and beneath rocks in desert and rocky hillside areas and beach sand of western United States,"2158,2188"
110832,01262939,n,10,boa of grasslands and woodlands of western North America; looks and feels like rubber with tail and head of similar shape,"2158,2188"
110927,01287238,n,10,invertebrate having jointed limbs and a segmented body with an exoskeleton made of chitin,"2158,2202"
111050,01310180,n,10,the fleshy red crest on the head of the domestic fowl and other gallinaceous birds,"2188,2233"
111064,01312008,n,10,a genus of birds of the family Meleagrididae including the ocellated turkey,"2158,2188"
111112,01319448,n,10,black megapode of wooded regions of Australia and New Guinea,"2158,2188"
111098,01317266,n,10,large crested arboreal game bird of warm parts of the Americas having long legs and tails; highly esteemed as game and food,"2158,2188"
111162,01327285,n,10,crested ill-smelling South American bird whose young have claws on the first and second digits of the wings,"2158,2188"
111203,01333978,n,10,an order of birds including parrots and amazons and cockatoos and lorikeets and lories and macaws and parakeets,"2158,2188"
111264,01344125,n,10,Madagascan roller with terrestrial and crepuscular habits that feeds on e.g. insects and worms,"2158,2188"
111281,01346765,n,10,any of several crested Old World birds with a slender down-curving bill,"2158,2188"
111325,01353928,n,10,insectivorous bird of Australia and southeastern Asia having a wide frog-like mouth,"2158,2188"
111332,01355454,n,10,bird with strong claws and a stiff tail adapted for climbing and a hard chisel-like bill for boring into wood for insects,"2158,2188"
111379,01363157,n,10,small wild or domesticated web-footed broad-billed swimming bird usually having a depressed body and short legs,"2158,2188"
111436,01372429,n,10,web-footed long-necked typically gregarious migratory aquatic birds usually larger and less aquatic than ducks,"2158,2188"
111493,01390439,n,10,mammals of which the females have a pouch (the marsupium) containing the teats where the young are fed and carried,"2158,2188"
111521,01395486,n,10,arboreal wallabies of New Guinea and northern Australia having hind and forelegs of similar length,"2158,2188"
111552,01400450,n,10,rare doglike carnivorous marsupial of Tasmania having stripes on its back; probably extinct,"2158,2188"
111618,01411492,n,10,the hard protective layer covering the body of many invertebrates especially arthropods,2188
111641,01414924,n,10,"a part lying on the lower side or underneath an animal's body; ""the warbler has a white throat and underparts""; ""a woodland mouse with white underparts""",2233
111685,01421416,n,10,primitive multicellular marine animal whose porous body is supported by a fibrous skeletal framework; usually occurs in sessile colonies,"2158,2188"
111736,01430691,n,10,corals of esp. the Mediterranean having pink or red color used for ornaments and jewelry,"2158,2188"
111768,01436335,n,10,any of numerous relatively small elongated soft-bodied animals especially of the phyla Annelida and Chaetognatha and Nematoda and Nemertea and Platyhelminthes; also many insect larvae,"2158,2188"
111773,01437400,n,10,any of various worms living parasitically in intestines of vertebrates having a retractile proboscis covered with many hooked spines,"2158,2188"
111783,01439230,n,10,free-swimming mostly freshwater flatworms; popular in laboratory studies for the ability to regenerate lost parts,"2158,2188"
111871,01456572,n,10,any of numerous tropical marine snails that as adults have the outer lip of the aperture produced into a series of long curved spines,"2158,2188"
111911,01462908,n,10,minute conical gastropod superficially resembling a limpet but living and feeding on freshwater plants,"2158,2188"
111966,01472400,n,10,common edible European bivalve mollusk having a rounded shell with radiating ribs,"2158,2188"
112002,01478216,n,10,edible marine bivalve having a fluted fan-shaped shell that swim by expelling water from the shell in a series of snapping motions,"2158,2188"
112047,01485956,n,10,a conical calcareous fossil tapering to a point at one end and with a conical cavity at the other end containing (when unbroken) a small chambered phragmocone from the shell of any of numerous extinct cephalopods of the family Belemnitidae,"2158,2188,2800"
112085,01493410,n,10,large edible crab of North Pacific waters esp. along the coasts of Alaska and Japan,"2158,2202"
112135,01501586,n,10,shrimp-like crustaceans whose females carry eggs and young in a pouch between the legs,"2158,2202"
112194,01511795,n,10,any of numerous velvety-skinned wormlike carnivorous animals common in tropical forests having characteristics of both arthropods and annelid worms,"2158,2202"
112252,01522147,n,10,small white egret widely distributed in warm regions often found around grazing animals,"2158,2188"
112289,01528192,n,10,any of various small aquatic birds of the genus Gallinula distinguished from rails by a frontal shield and a resemblance to domestic hens,"2158,2188"
112337,01536853,n,10,migratory shorebirds of the plover family that turn over stones in searching for food,"2158,2188"
112391,01545646,n,10,New World curlew that breeds in northern North America,"2158,2188"
112449,01555496,n,10,gull-like seabird that flies along the surface of the water with an elongated lower mandible immersed to skim out food,"2158,2188"
112499,01563500,n,10,large long-winged warm-water seabird having a large bill with a distensible pouch for fish,"2158,2188"
112489,01561659,n,10,small compact-bodied almost completely aquatic bird that builds floating nests; similar to loons but smaller and with lobate rather than webbed feet,"2158,2188"
112551,01572048,n,10,long-winged oceanic bird that in flight skims close to the waves,"2158,2188"
112592,01579726,n,10,any of several whales inhabiting all oceans and having beaklike jaws with vestigial teeth in the upper jaw,"2158,2188"
112613,01583448,n,10,any of several long-snouted usually freshwater dolphins of South America and southern Asia,"2158,2188"
112600,01581293,n,10,any of several dolphins with rounded forehead and well-developed beak; chiefly of North Atlantic and Mediterranean,"2158,2188"
112666,01592730,n,10,either of two large northern marine mammals having ivory tusks and tough hide over thick blubber,"2158,2188"
112670,01593325,n,10,terrestrial carnivores; having toes separated to the base: dogs; cats; bears; badgers; raccoons,"2158,2188"
112760,01607775,n,10,old Scottish breed of small long-haired usually black terrier with erect tail and ears,"2158,2188,2656"
112795,01613382,n,10,breed of large spaniels developed in Ireland having a heavy coat of liver-colored curls and a topknot of long curls and a nearly hairless tail,"2158,2188,2656"
112839,01620479,n,10,small compact smooth-coated breed of Asiatic origin having a tightly curled tail and broad flat wrinkled muzzle,"2158,2188"
112845,01621450,n,10,breed of thick-coated medium-sized dogs with fluffy curled tails and distinctive blue-black tongues; believed to have originated in north China,"2158,2188"
112943,01637100,n,10,large feline of African and Asian forests usually having a tawny coat with black spots,"2158,2188"
113008,01647814,n,10,nocturnal mouselike mammal with forelimbs modified to form membranous wings and anatomical adaptations for echolocation by which they navigate,"2158,2188"
113035,01652476,n,10,any of numerous bats of northwest Africa or Philippines or Australia having a horseshoe-shaped leaf on the nose,"2158,2188"
113074,01658980,n,10,any of various tropical American bats of the family Desmodontidae that bite mammals and birds to feed on their blood,"2158,2188"
113114,01665222,n,10,the posterior part of the body of a vertebrate especially when elongated and extending beyond the trunk or main part of the body,"2188,2233"
113168,01675851,n,10,small beetle whose larvae are household pests feeding on woolen fabrics,"2158,2202,2401"
113183,01678304,n,10,any of various large usually brown North American leaf-eating beetles common in late spring; the larvae feed on roots of grasses etc.,"2158,2202"
113208,01682600,n,10,any of numerous aquatic beetles usually having a smooth oval body and flattened hind legs for swimming,"2158,2202"
113215,01683809,n,10,small weevil having a prolonged snout; destructive to e.g. grains and nuts,"2158,2202"
113271,01693115,n,10,insects having usually a single pair of functional wings (anterior pair) with the posterior pair reduced to small knobbed structures and mouth parts adapted for sucking or lapping or piercing,"2158,2202"
113355,01707421,n,10,minute two-winged mosquito-like fly lacking biting mouthparts; appear in dancing swarms esp. near water,"2158,2202"
113427,01719513,n,10,solitary wasp that digs nests in the soil and stocks them with paralyzed insects for the larvae,"2158,2202"
113461,01725308,n,10,any of various ants captured as larvae and enslaved by another species,"2158,2202"
113504,01732680,n,10,large wingless nocturnal grasshopper that burrows in loose soil along the United States Pacific coast,"2158,2202"
113573,01744498,n,10,predaceous aquatic insect that swims on its back and may inflict painful bites,"2158,2202"
113612,01751139,n,10,a strain accidentally imported into Florida from the Middle East then spread to California where it is a very serious pest feeding on almost all vegetable crops and poinsettias,"2158,2202"
113668,01760176,n,10,its distinctive song is heard during July and August,"2158,2202"
113687,01763162,n,10,large brightly marked tropical insect with a process like a snout that was formerly thought to emit light,"2158,2202"
113728,01770352,n,10,predatory insect of western North America having a long necklike prothorax,"2158,2202"
113763,01776005,n,10,any of numerous insects of the order Dermaptera having elongate bodies and slender many-jointed antennae and a pair of large pincers at the rear of the abdomen,"2158,2202"
113817,01785910,n,10,typically crepuscular or nocturnal insect having a stout body and feathery or hairlike antennae,"2158,2202"
113864,01794251,n,10,any of several small yellowish or buff-colored moths whose larvae eat organic matter e.g. woolens,"2158,2202"
113917,01803226,n,10,stocky creamy-white Asiatic moth found almost entirely under human care; the source of most of the silk of commerce,"2158,2202"
113967,01811851,n,10,a wormlike and often brightly colored and hairy or spiny larva of a butterfly or moth,"2158,2188"
114012,01820534,n,10,any starfish-like animal of the genera Euryale or Astrophyton or Gorgonocephalus having slender complexly branched interlacing arms radiating from a central disc,"2158,2188"
114040,01824980,n,10,a rudimentary splint-like metacarpal or metatarsal bone on either side of the cannon bone in the leg of a horse or related animal,2233
114052,01827389,n,10,common small rabbit of North America having grayish or brownish fur and a tail with a white underside; a host for Ixodes pacificus and Ixodes scapularis (Lyme disease ticks),"2158,2188"
114123,01840708,n,10,any of various small mouselike rodents of the family Cricetidae esp. of genus Microtus having a stout short-tailed body and inconspicuous ears and inhabiting fields or meadows,"2158,2188"
114167,01847914,n,10,relatively large rodents with sharp erectile bristles mingled with the fur,"2158,2188"
114223,01857835,n,10,large gray squirrel of far western areas of United States,"2158,2188"
114178,01849692,n,10,small New World burrowing mouselike rodents with fur-lined cheek pouches and hind limbs and tail adapted to leaping; adapted to desert conditions: pocket mice; kangaroo mice; kangaroo rats,"2158,2188"
114239,01860523,n,10,any of several rodents of North American prairies living in large complex burrows having a barking cry,"2158,2188"
114252,01862448,n,10,stocky coarse-furred burrowing rodent with a short bushy tail found throughout the northern hemisphere; hibernates in winter,"2158,2188"
114351,01878852,n,10,a fresh horse especially (formerly) to replace one killed or injured in battle,"2158,2188"
114362,01880033,n,10,a horse marked by stamina and trained to move at a fast running walk,"2158,2188"
114406,01885455,n,10,a horse harnessed behind others and nearest the wheels of a vehicle,"2158,2188"
114503,01901548,n,10,any of several breeds of Indian cattle especially a large American heat- and tick-resistant grayish humped breed evolved in the Gulf States by interbreeding Indian cattle and now used chiefly for crossbreeding,"2158,2188"
114574,01912207,n,10,wild sheep of mountainous regions of western North America having massive curled horns,"2158,2188"
114570,01911534,n,10,Asiatic wild sheep with exceptionally large horns; sometimes considered a variety of the argali (or Ovis ammon),"2158,2188"
114628,01920877,n,10,any of several antelopes of the genus Tragelaphus having striped markings resembling a harness,"2158,2188"
114654,01925014,n,10,cow-like creature with the glossy coat of a horse and the agility of a goat and the long horns of an antelope; characterized as a cow that lives the life of a goat,"2158,2188"
114707,01933580,n,10,wild or domesticated South American cud-chewing animal related to camels but smaller and lacking a hump,"2158,2188"
114763,01943232,n,10,sturdy carnivorous burrowing mammal with strong claws widely distributed in the northern hemisphere,"2158,2188"
114833,01954257,n,10,gigantic extinct terrestrial sloth-like mammal of the Pliocene and Pleistocene in America,"2158,2188"
114878,01961738,n,10,either of a pair of fins situated just behind the head in fishes that help control the direction of movement,2233
114919,01969053,n,10,the only surviving hominid; species to which modern man belongs; bipedal primate having language and ability to make and use complex tools; brain 1400 cc,"2158,2516"
114931,01971399,n,10,genus to which Australopithecus boisei was formerly assigned,"2158,2188"
114974,01979169,n,10,small slender African monkey having long hind limbs and tail and long hair around the face,"2158,2188"
114947,01973830,n,10,tiny (150 to 300 grams) extinct primate of 46 to 50 million years ago; fossils found in Algeria; considered by some authorities the leading candidate for the first anthropoid,"2158,2188"
115023,01986982,n,10,small arboreal monkey of tropical South America with long hair and bushy nonprehensile tail,"2158,2188"
115040,01989799,n,10,not used in all classifications; in some classifications considered coextensive with the Lemuroidea; in others includes both Lemuroidea and Tarsioidea,"2158,2188"
115113,02002591,n,10,raccoon-like omnivorous mammal of Mexico and the southwestern United States having a long bushy tail with black and white rings,"2158,2188"
115135,02006840,n,10,fish that live on the sea bottom especially commercially important gadoid fishes like cod and haddock or flatfish like flounder,"2158,2188"
115192,02016651,n,10,important food fish on both sides of the Atlantic; related to cod but usually smaller,"2158,2188"
115290,02034117,n,10,large silvery game fish of warm Atlantic coastal waters especially off Florida,"2158,2188"
115318,02038443,n,10,thin deep-water tropical fish 20 to 30 feet long having a red dorsal fin,"2158,2188"
115364,02049112,n,10,two species of elongate compressed scaleless large-eyed fishes that live in sand or mud,"2158,2188"
115378,02051265,n,10,any of several elongate long-snouted freshwater game and food fishes widely distributed in cooler parts of the northern hemisphere,"2158,2188"
115430,02060477,n,10,"a genus of fish of the family Serranidae, including soapfishes (sometimes placed in the family Grammistidae)","2158,2188"
115451,02063879,n,10,bluish warm-water marine food and game fish that follow schools of small fishes into shallow waters,"2158,2188"
115505,02072955,n,10,small family of marine fishes having covered gills,"2158,2188"
115516,02074667,n,10,any of various elongated tactile or prehensile flexible organs that occur on the head or near the mouth in many animals used for feeling or grasping or locomotion,2233
115621,02093002,n,10,any voracious marine fish of the genus Sphyraena having an elongated cylindrical body and large mouth with projecting lower jaw and long strong teeth,"2158,2188"
115669,02100613,n,10,mullet-like tropical marine fishes having pectoral fins with long threadlike rays,"2158,2188"
115719,02108752,n,10,small spiny-finned fish of coastal or brackish waters having a large head and elongated tapering body having the ventral fins modified as a sucker,"2158,2188"
115766,02117386,n,10,any of various scombroid fishes intermediate in size and characteristics between mackerels and tunas,"2158,2188"
115762,02116568,n,10,large pelagic tuna the source of most canned tuna; reaches 93 pounds and has long pectoral fins; found worldwide in tropical and temperate waters,"2158,2188"
115896,02139317,n,10,in some classifications restricted to the gurnards and subdivided into the subfamilies Triglinae (true sea robins) and Peristediinae (armored sea robins),"2158,2188"
115935,02146268,n,10,among the largest bony fish; pelagic fish having an oval compressed body with high dorsal and anal fins and caudal fin reduced to a rudder-like lobe; worldwide in warm waters,"2158,2188"
115970,02152199,n,10,very thin translucent flounder of the Atlantic coast of North America,"2158,2188"
116011,02157950,n,10,a masonry support that touches and directly receives thrust or pressure of an arch or bridge,
116027,02160659,n,10,(nautical) a portable ladder hung over the side of a vessel to give access to small boats alongside,1942
116056,02164835,n,10,a type of LCD screen used for some portable computers; there is a separate circuit for each pixel,1355
116087,02169490,n,10,a long plume (especially one of egret feathers) worn on a hat or a piece of jewelry in the shape of a plume,2474
116105,02172398,n,10,a device that provides reactive force when in motion relative to the surrounding air; can lift or control a plane in flight,1942
116149,02179361,n,10,a wrench with a V-shaped jaw and serrations on one side (resembles the open jaws of an alligator),"1787,2415"
116196,02186418,n,10,moving or still pictures in contrasting colors that appear three-dimensional when superimposed,2527
116253,02196107,n,10,a piece of ornamented cloth that protects the back of chair from hair oils,2875
116310,02205453,n,10,(architecture) a masonry construction (usually curved) for spanning an opening and supporting the weight above it,2446
116378,02216666,n,10,a short-handled device with a globe containing a sponge; used for sprinkling holy water,1565
116459,02228691,n,10,a pointed tool for marking surfaces or for punching small holes,2415
116468,02230206,n,10,an antiviral drug used in the treatment of AIDS; adverse side effects include liver damage and suppression of the bone marrow,2248
116527,02239083,n,10,close-fitting and woolen and covers all of the head but the face,2875
116507,02235391,n,10,"(computer science) a copy of a file or directory on a separate storage device; ""he made a backup in case the original was accidentally damaged or erased""",1355
116559,02243942,n,10,"a facility in which ball games are played (especially baseball games); ""take me out to the ballpark""",2638
116646,02257594,n,10,a trading card with a picture of a baseball player and information about his playing record,2637
116705,02265701,n,10,an area on a baseball diamond (on either side of home plate) marked by lines within which the batter must stand when at bat,2871
