 he is dead now""; ""I think they're asleep; anyhow, they're quiet""; ""I don't know what happened to it; anyway, it's gone""; ""anyway, there is another factor to consider""; ""I don't know how it started; in any case, there was a brief scuffle""; ""in any event, the government faced a serious protest""; ""but at any rate he got a knighthood for it""",
184263,00472844,a,10,"feeling or expressing sorrow or pity: ""a pitying observer threw his coat around her shoulders""; ""let him perish without a pitying thought of ours wasted upon him""-Thomas De Quincey",
182385,00157618,a,10,"unrestrained by convention or propriety: ""an audacious trick to pull""; ""a barefaced hypocrite""; ""the most bodacious display of tourism this side of Anaheim""-Los Angeles Times; ""bold-faced lies""; ""brazen arrogance""; ""the modern world with its quick material successes and insolent belief in the boundless possibilities of progress""-Bertrand Russell",
190428,01519719,a,10,"suggesting the operation of supernatural influences: ""an eldritch screech""; ""the three weird sisters""; ""stumps...had uncanny shapes as of monstrous creatures""-John Galsworthy; ""an unearthly light""; ""he could hear the unearthly scream of some curlew piercing the din""-Henry Kingsley",
192192,01819144,a,10,"having or showing arrogant superiority to and disdain of those one views as unworthy: ""some economists are disdainful of their colleagues in other social disciplines""; ""haughty aristocrats""; ""his lordly manners were offensive""; ""walked with a prideful swagger""; ""very sniffy about breaches of etiquette""; ""his mother eyed my clothes with a supercilious air""; ""shaggy supercilious camels""; ""a more swaggering mood than usual""-W.L.Shirer",1502
193211,01991315,a,10,"not the same one or ones already mentioned or implied: ""today isn't any other day""-the White Queen; ""the construction of highways and other public works""; ""he asked for other employment""; ""any other person would tell the truth""; ""his other books are still in storage""; ""then we looked at the other house""; ""hearing was good in his other ear""; ""the other sex""; ""she lived on the other side of the street from me""; ""went in the other direction""",1451
106317,00477929,n,10,"a wrongful act that the actor had no right to do; improper professional conduct: ""he charged them with electoral malpractices""",1675
119057,02619969,n,10,"a device for converting electric signals into sounds; it is held over or inserted into the ear: ""it was not the typing but the earphones that she disliked""",2284
128012,03985893,n,10,"the property of being more than sufficient; comfortable sufficiency: ""the ampleness of her servings more than satisfied his hunger""",
134605,05104821,n,10,"a written form of a musical composition; parts for different instruments appear on separate staves on large pages: ""he studied the score of the sonata""",2536
136299,05353662,n,10,"informal language consisting of words and expressions that are not considered appropriate for formal occasions; often vituperative or vulgar: ""their speech was full of slang expressions""",1969
147162,07102551,n,10,"a member of the British order of honor; ranks below a baron but above a knight: ""since he was a baronet he had to be addressed as Sir Henry Jones, Bart.""",2794
160714,09588854,n,10,"a fixed charge for borrowing money; usually a percentage of the amount borrowed: ""how much interest do you pay on your mortgage?""","1766,2872"
163714,10068933,n,10,"a state of confusion; ritual accompanied by complicated and purposeless activity that obscures and confuses: ""he engaged in the hugger-mugger of international finance""",
186893,00929061,a,10,"not moving quickly; taking a comparatively long time: ""a slow walker""; ""the slow lane of traffic""; ""her steps were slow""; ""he was slow in reacting to the news""; ""slow but steady growth""",2234
188175,01145007,a,10,"taking heed; giving close and thoughtful attention: ""heedful of the warnings""; ""so heedful a writer""; ""heedful of what they were doing""",
169893,00096357,v,10,"flatten, stretch, or mold metal or glass, by rolling or by pulling it through a die or by stretching: ""draw steel""",
170065,00126016,v,10,"add as part of something else; put in as part of a set, group, or category: ""We must include this chemical element in the group""",
171203,00303689,v,10,"unroll, unfold, or spread out or be unrolled, unfolded, or spread out from a furled state: ""unfurl a banner""",
175121,00913007,v,10,"mark or overlay with patches of contrasting color or texture; cause to appear splashed or spattered: ""The mountain was splashed with snow""",
176269,01089504,v,10,"enclose or envelop completely, as if by swallowing: ""The huge waves swallowed the small boat and it sank shortly thereafter""",
179820,01636187,v,10,"put forward; nominate for appointment to an office: ""The President nominated her as head of the Civil Rights Commission""",1820
179885,01646814,v,10,"be at play; be engaged in playful activity; typical of children: ""The kids were playing outside all day""; ""I used to play with trucks as a little girl""",2633
180023,01669261,v,10,"allow participation in or the right to be part of; permit to exercise the rights, functions, and responsibilities of: ""admit someone to the profession""; ""She was admitted to the New Jersey Bar""",
180429,01733557,v,10,"be compliant; go along with; act in agreement with: ""He complied with my instructions""; ""You must comply or else!"" ""Follow these simple rules""",
181117,01846815,v,10,"take the side of; be on the side of: ""Whose side are you on?"" ""Why are you taking sides with the accused?""",
128721,04108340,n,10,the muscle that extends the forearm and abducts the ulna in pronation of the wrist,"2233,2516"
185188,00634053,a,10,"having good fortune bestowed or conferred upon; sometimes used as in combination: ""blessed with a strong healthy body""; ""a nation blessed with peace""; ""a peace-blessed era""",
192972,01950989,a,10,"in fortunate circumstances financially; moderately rich: ""they were comfortable or even wealthy by some standards""; ""easy living""; ""a prosperous family""; ""his family is well-situated financially""; ""well-to-do members of the community""",1753
195060,02290610,a,10,"subjected to great tension; stretched tight: ""the skin of his face looked drawn and tight""; ""her nerves were taut as the strings of a bow""",
195159,02307578,a,10,"negligent of neatness especially in dress and person; habitually dirty and unkempt: ""filled the door with her frowzy bulk""; ""frowzy white hair""; ""slovenly appearance""",
198569,02780351,a,10,"relating to, or coming from, Europe and Asia: ""His mother was Eurasian, and his father Chinese""; ""the Eurasian landmass is the largest in the world""",2772
199950,00099025,r,10,"over great areas or distances; everywhere: ""he traveled far and wide""; ""the news spread far and wide""; ""people came from far and near""; ""searched for the child far and near""",
202339,00435962,r,10,"with resignation and acceptance; in a resigned manner: ""resignedly, I telegraphed back that it was all right with me if he insisted""",
128622,04089143,n,10,"a kind of body tissue containing stored fat that serves as a source of energy; adipose tissue also cushions and insulates vital organs: ""fatty tissue protected them from the severe cold""",2233
143322,06454884,n,10,"the area around the eastern Mediterranean; from Turkey to North Africa and eastward to Iran; the site of such ancient civilizations as Phoenicia and Babylon and Egypt and the birthplace of Judaism and Christianity and Islam: ""the Middle East is the cradle of Western civilization""",2772
144986,06757461,n,10,"a mechanism that creates a barrier between brain tissues and circulating blood; serves to protect the central nervous system: ""the brain was protected from the large molecules of the virus by the blood-brain barrier""",2233
172731,00550772,v,10,"escape potentially unpleasant consequences; get away with a forbidden action: ""She gets away with murder!"" ""I couldn't get out from under these responsibilities""",
172956,00590217,v,10,"warn in advance or beforehand; give an early warning: ""I forewarned him of the trouble that would arise if he showed up at his ex-wife's house""",
173371,00655029,v,10,"announce as the result of an investigation, or announce something to the proper authorities: ""Dozens of incidents of wife beatings are reported daily in this city""; ""The team reported significant advances in their research""",
176411,01108327,v,10,"remove all contents or possession from, or empty completely: ""The boys cleaned the sandwich platters""; ""The trees were cleaned of apples by the storm""; deprive wholly of money in a gambling game, robbery, etc; ""The other players cleaned him completely""",
177355,01253107,v,10,"change location; move, travel, or proceed: ""How fast does your new car go?"" ""We travelled from Rome to Naples by bus""; ""The policemen went from door to door looking for the suspect"";""The soldiers moved towards the city in an attempt to take it before night fell""",1946
178506,01429473,v,10,"shift the position or location of, as for business, legal, educational, or military purposes: ""He removed his children to the countryside""; ""Remove the troops to the forest surrounding the city""; ""remove a case to another court""","1753,1781,1802,1898"
179351,01563668,v,10,"fail to keep or to maintain; cease to have, either physically or in an abstract sense; fail to keep in mind or in sight: ""She lost her purse when she left it unattended on her seat""; ""She lost her husband a year ago""",
180683,01773475,v,10,"remove oneself from a familiar environment, usually for pleasure or diversion: ""We escaped to our summer house for a few days""; ""The president of the company never manages to get away during the summer""",
181023,01832891,v,10,"stretch out over a distance, space, time, or scope; run or extend between two points or beyond a certain point: ""Service runs all the way to Cranbury""; ""His knowledge doesn't go very far""; ""My memory extends back to my fourth year of life""; ""The facts extend beyond a consideration of her personal assets""",
181270,01869947,v,10,"enter or assume a condition, relation, use, or position: ""He came into contact with a terrorist group""; ""The shoes came untied""; ""I came to see his point of view""; ""her face went red with anger""; ""The knot came loose""; ""Your wish will come true""",
187520,01031226,a,10,"filled to overflowing with a vast number of moving or especially living things; sometimes used in combination: ""ditches alive with frogs""; ""a blanket alive with fleas""; ""roads crawling with cars""; ""a picnic table crawling with ants""; ""a house overflowing with guests""; ""fields overrun with locusts""; ""swarming with insects""; ""parade route swarming with spectators""; ""a drop of water teeming with microorganisms""",
194352,02175055,a,10,"produced or delivered by the voice; often used in combination: ""a frequently voiced opinion""; ""voiced consonants such as ""b"" and ""g"" and ""z""""; ""loud-voiced teenagers""",
195732,02398582,a,10,"of your own free will or design; not forced or compelled: ""man is a voluntary agent""; ""participation was voluntary""; ""voluntary manslaughter""; ""voluntary generosity in times of disaster""; ""voluntary social workers""; ""a voluntary confession""",
200308,00145269,r,10,"used to imply that one would expect the fact to be the opposite of that stated; surprisingly: ""you may actually be doing the right thing by walking out""; ""she actually spoke Latin""; ""they thought they made the rules but in reality they were only puppets""; ""people who seem stand-offish are in reality often simply nervous""",
202113,00405377,r,10,"in number; with regard to numbers: ""in ten years"" time the Oxbridge mathematicians, scientists, and engineers will not be much more significant numerically than the Oxbridge medical schools are now""",
211357,L3783648,n,9,"Shivering, trembling, resulting from fear, cold, fever or other physical causes.",
103320,00018916,n,10,an abstraction belonging to or characteristic of two entities or parts together,
103402,00032687,n,10,"the act of escaping physically: ""he made his escape from the mental hospital""; ""the canary escaped from its cage""; ""his flight was an indication of his guilt""",
103563,00058089,n,10,"the feat of mustering strength for a renewed effort: ""he singled to start a rally in the 9th inning""; ""he feared the rallying of their troops for a counterattack""",
103783,00091019,n,10,a catch of a punt on the fly by a defensive player who has signalled that he will not run and so should not be tackled,"2633,2638"
103827,00097598,n,10,butt welding by creating an electric arc between the two pieces which melts and joins them; used for joining segments of metal pipe,
103879,00105545,n,10,the population is divided into subpopulations (strata) and random samples are taken of each stratum,
103935,00114709,n,10,paying the raider to give up a takeover attempt (as by an extravagant buyback of the stock they hold in your corporation),1794
104042,00132095,n,10,"the act of transfering something from one form to another: ""the transfer of the music from record to tape suppressed much of the background noise""",
104127,00144920,n,10,suicide of a terminally ill person that involves an assistant who serves to make dying as painless and dignified as possible,1675
104228,00160063,n,10,"significant progress (especially in the phrase ""make strides"" or ""make rapid strides"")",
104325,00173526,n,10,introducing water into a pump to improve the seal and start the water flowing,
104464,00193637,n,10,the act of controlling and steering the movement of a vehicle or animal,1946
104483,00196343,n,10,a low-altitude flight (usually of military aircraft) over spectators on the ground,1942
104502,00198945,n,10,"a section or portion of a journey or course: ""then we embarked on the second stage of our Carribean cruise""","1946,2772"
104579,00208980,n,10,the passive introduction of a substance (a fluid or drug or electrolyte) into a vein or between tissues (as by gravitational force),
104682,00223506,n,10,"the act of upsetting something: ""he was badly bruised by the upset of his sled at a high speed""",
104784,00238038,n,10,a rhythmic tightening in labor of the upper uterine musculature that contracts the size of the uterus and pushes the fetus toward the birth canal,"2233,2234"
104859,00249236,n,10,the act of branching out or dividing into branches,
104905,00256511,n,10,the conversion of bare or cultivated land into forest (originally for the purpose of hunting),
104960,00265645,n,10,a custom among some peoples whereby the husband of a pregnant wife is put to bed at the time of bearing the child,
105015,00274048,n,10,"an inclination to retreat from unpleasant realities through diversion or fantasy: ""he escaped into romantic novels""; ""his alcohol problem was a form of escapism""",2600
105041,00278798,n,10,the act of participating in an athletic contest in which you try to jump as far as possible with a running jump from a fixed mark,2638
105097,00285914,n,10,riding horses in competitions over set courses to demonstrate skill in jumping over obstacles,2638
105118,00288600,n,10,the act of throwing a fishing line out over the water by means of a rod and reel,2655
105137,00291567,n,10,"an amusement or pastime: ""he thought of his painting as a game that filled his empty time""; ""his life was all fun and games""",2633
105216,00305357,n,10,a game played in a walled court or against a single wall by two or four players who strike a rubber ball with their hands,"2633,2638"
105226,00307082,n,10,(basketball) the way play begins or resumes when possession is disputed; an official tosses the ball up between two players who jump in an effort to tap it to a teammate,2871
105319,00323451,n,10,a board game in which each player tries to move a set of marbles through a set of holes from one point of a six-pointed star to the opposite point,2633
104380,00181920,n,10,"approaching a particular destination; a coming closer; a narrowing of a gap: ""the ship's rapid rate of closing gave them little time to avoid a collision""",
171966,00422928,v,10,"interpret something in a certain way; convey a particular meaning or impression: ""I read this address as a satire""; ""How should I take this message?""; You can't take credit for this!""",
211356,L4193227,n,9,"The action or quality (in hair) of rising or standing stiffly, bristling.",
211358,L6888735,p,9,away from,
211355,L6992236,n,9,a person or thing that inspires fear,1502
105327,00324666,n,10,(trademark) a board game in which players try to gain a monopoly on real estate as pieces advance around the board according to the throw of a die,2633
105333,00325752,n,10,"the act of playing for stakes in the hope of winning (including the payment of a price for a chance to win a prize); ""his gambling cost him a fortune""; ""there was heavy play at the blackjack table""",2636
105445,00342773,n,10,an energetic American dance that was popular in the 1930s (probably named for the aviator Charles Lindbergh),2621
105475,00346860,n,10,a style of dancing that originated among ordinary people (not in the royal courts),2621
105518,00353377,n,10,a type of dance music originating in the 1950s; a blend of rhythm-and-blues with country-and-western,2536
105589,00363615,n,10,"a predetermined set of movements in dancing or skating: ""she made the best score on compulsory figures""",
105655,00374165,n,10,a swimming stroke in which the arms move forward and backward while the legs do a scissors kick,2649
105721,00384872,n,10,(British) the job of a senior minister who is a member of the British cabinet,1820
105698,00381209,n,10,"active work of little value: ""while he was waiting he filled the days with busywork""",
105819,00397893,n,10,head of a former executive department created in 1903 and divided into two departments in 1913,1820
106059,00434731,n,10,a surgical operation that creates an opening from the colon to the surface of the body to function as an anus,2232
106148,00449552,n,10,psychotherapy that seeks to extinguish or inhibit abnormal or maladaptive behavior by reinforcing desired behavior and extinguishing undesired behavior,2232
106170,00454028,n,10,a method of treatment that manipulates body structures in the belief that it restores proper nerve functioning,2232
106310,00476851,n,10,"nonperformance of something distasteful (as by deceit or trickery) that you are supposed to do; ""his evasion of his clear duty was reprehensible""; ""that escape from the consequences is possible but unattractive""",
106362,00484294,n,10,the act of falsely representing the ideas or work of others as your own,1675
106418,00493581,n,10,physical efforts to oppose a lawful arrest; the resistance is classified as assault and battery upon the person of the police officer attempting to make the arrest,1802
106497,00506452,n,10,an acquisition based on analysis of the benefits of consolidation in anticipation of increased earning power,1769
106547,00514498,n,10,coordination and supervision of supply as well as storage and distribution and recording of materials to maintain adequate quantities for current needs,2872
106662,00533434,n,10,an emergency procedure that employs rhythmic compression of the heart (either through the chest wall or (during surgery) directly to the heart) in an attempt to maintain circulation during cardiac arrest,2232
106715,00541251,n,10,the act of drinking (especially an alcoholic drink),2234
106738,00545690,n,10,a contraceptive method in which coitus is initiated but the penis is deliberately withdrawn before ejaculation,"1703,2232"
106777,00551654,n,10,any reaction that occurs automatically without conscious thought or reflection (especially the undirected behavior seen in psychomotor epilepsy),2234
106806,00556493,n,10,a normal reflex of young infants; a sudden loud noise causes the child to stretch out the arms and flex the legs,2234
106896,00571000,n,10,teaching reading by training beginners to associate letters with their sound values,1898
106958,00579500,n,10,a method of examining body organs by scanning them with X rays and using a computer to construct an image,"1355,2232"
107013,00587845,n,10,the production of malt beverages (as beer or ale) from malt and hops by grinding and boiling them and fermenting the result with yeast,1794
107064,00594989,n,10,"the act of working out the form of something (as by making a sketch or outline or plan); ""he contributed to the design of a new instrument""",2479
107147,00607051,n,10,the act of processing used or abandoned materials for use in creating new products,1883
107149,00607299,n,10,"the act of bringing something to bear; using it for a particular purpose: ""he advocated the application of statistics to the problem""; ""a novel application of electronics to medical diagnosis",
107199,00618461,n,10,an organized rebellion aimed at overthrowing a constituted government through the use of subversion and armed conflict,
107221,00622063,n,10,any of the more or less continuous military expeditions in the 11-13th centuries when Christian powers of Europe tried to recapture the Holy Land from the Muslims,1781
107337,00643021,n,10,electronic warfare undertaken under direct control of an operational commander to locate sources of radiated electromagnetic energy for the purpose of immediate threat recognition,1781
107465,00662272,n,10,an exhausting routine that leaves no time for relaxation,
107456,00660718,n,10,"a particular course of action intended to achieve a results: ""the procedure of obtaining a driver's license""; ""it was a process of trial and error""",
107666,00691100,n,10,a tactic for delaying or obstructing legislation by making long speeches,
107736,00702192,n,10,a new apportionment (especially a reallotment of US congressional seats on the basis of census results),1753
107774,00708190,n,10,disposing of money or property with the expectation that the same thing (or an equivalent) will be returned,
107775,00708351,n,10,a kind of hedged investment meant to capture slight differences in price; when there is a difference in the price of something on two different markets the arbitrageur simultaneously buys at the lower price and sells at the higher price,"1787,1794"
107814,00714845,n,10,intaglio printing,"1787,1794"
107946,00734610,n,10,"the act of managing something: ""he was given overall management of the program""; ""is the direction of the economy a function of government?""",
108035,00747710,n,10,(politics) granting favors or giving contracts or making appointments to office in return for political support,1718
108078,00754475,n,10,"punishment of a group by cutting off commercial dealings with them: ""the economic strangulation of the Jews by the Nazi Party""",1802
108272,00785961,n,10,(math) the simplification of an expression or equation by eliminating radicals without changing the value of the expression or the roots of the equation,2873
108297,00790310,n,10,"the act of reserving (a place or passage) or engaging the services of (a person or group): ""wondered who had made the booking""",2772
108392,00803947,n,10,the spread of power away from the center to local branches or governments,"1707,1753"
108464,00814228,n,10,the transportation of people (as a family or colony) to a new settlement (as after an upheaval of some kind),
108525,00822409,n,10,the mission in San Antonio where Mexican forces under Santa Anna besieged and massacred American rebels who were fighting to make Texas independent of Mexico,"1781,2772"
108696,00860774,n,10,a war between the Allies (Australia Belgium Bolivia Brazil Canada China Colombia Costa-Rico Cuba Czechoslovakia Dominican-Republic El-Salvador Ethiopia Greece Guatemala Haiti Honduras India Iran Iraq Luxembourg Mexico Netherlands New-Zealand Nicaragua Norway Panama Philippines Poland South-Africa United-Kingdom US USSR Yugoslavia) and the Axis (Albania Bulgaria Finland Germany Hungary Italy Japan Rumania Slovakia Thailand) from 1939 to 1945,"1781,2768"
108808,00878620,n,10,organisms that typically reproduce by asexual budding or fission and whose nutritional mode is absorption or photosynthesis or chemosynthesis,2158
108902,00901363,n,10,microorganism resembling bacteria inhabiting arthropod tissues but capable of causing disease in vertebrates,2158
108979,00915005,n,10,any of a group of parasitic microorganisms that live in arthropods (as ticks and mites) and can cause disease if transmitted to human beings,2158
108983,00916896,n,10,any of diverse minute acellular or unicellular organisms usually nonphotosynthetic,"2158,2172"
109015,00922148,n,10,class of protozoa having cilia or hairlike appendages on part or all of the surface during some part of the life cycle,"2158,2172"
109053,00928733,n,10,any of various algae of the genus Tribonema; algae with branching filaments that form scum in still or stagnant fresh water,"2158,2172"
109105,00938132,n,10,nonmotile unicellular green algae potentially important as source of high-grade protein and B-complex vitamins,"2158,2172"
109121,00940834,n,10,marine algae in which the chlorophyll is masked by a red or purplish pigment; source of agar and carrageenan,"2158,2172"
109201,00954472,n,10,temporary outgrowth used by some microorganisms as an organ of feeding or locomotion,2233
109216,00966324,n,10,large Old World freshwater bottom-feeding fish introduced into Europe from Asia; inhabits ponds and sluggish streams and often raised for food; introduced into United States where it has become a pest,"2158,2188"
