136778,05424763,n,10,an arrangement of ribbons in a rose-shaped design worn as a badge of office or medal of honor,1675
136779,05424910,n,10,a black sash worn to show expert standards in the martial arts (judo or karate),1675
136780,05425046,n,10,an honor or award gained for excellence,1675
136781,05425157,n,10,an annual award for outstanding contributions to chemistry or physics or physiology and medicine or literature or economics or peace,
136782,05425347,n,10,an annual award by the Academy of Motion Picture Arts and Sciences for achievements in motion picture production and performance,
136783,05425527,n,10,V-shaped sleeve badge indicating military rank and service,1675
136784,05425675,n,10,"a piece of braid, usually on the sleeve, indicating military rank or length of service",1675
136785,05425814,n,10,(computer science) a graphic symbol (usually a simple picture) that denotes a program or a command or a data file or a concept in a graphical user interface,1355
136735,05419184,n,10,"a measure or standard used for comparison: ""on what kind of yardstick is he basing his judgment?""",
136789,05426706,n,10,an arrowhead mark identifying British government property,
202091,00402233,r,10,"(comparative of ""near"" or ""close"") within a shorter distance; ""come closer, my dear!""; ""they drew nearer""; ""getting nearer to the true explanation""",
136790,05426821,n,10,stone post at side of a road to show distances,1946
136791,05426934,n,10,a symbol (like x or y) that is used in mathematical or logical expressions to represent a variable quantity,2873
136792,05427114,n,10,a variable whose values are solutions of an equation,2873
136793,05427239,n,10,small markers inserted into a surface to mark scores or define locations etc.,
136794,05427372,n,10,a mark on a playing card (shape depending on the suit),2637
136795,05427502,n,10,a company emblem or device,2872
136796,05427590,n,10,an identifying or descriptive marker,
136797,05427739,n,10,a label identifying the owner of a book in which it is pasted,
136806,05428809,n,10,a sign (for victory); making a V with the index and middle fingers,
136810,05429418,n,10,bending at the knees; a gesture of respect made by women,
136814,05430010,n,10,a deep bow; a Muslim form of salutation,
136819,05430688,n,10,"something suggestive of speech in being a medium of expression: ""the wee small voice of conscience""; ""the voice of experience""; ""he said his voices told him to do it""",1502
136820,05430906,n,10,"the music of Bach: ""he played Bach on the organ""",2536
136821,05431005,n,10,"the music of Beethoven: ""he enjoyed Beethoven most of all",2536
136823,05431228,n,10,"the music of Chopin: ""he practiced Chopin day and night""",2536
136824,05431337,n,10,"the music of Gilbert and Sullivan: ""he could sing all of Gilbert and Sullivan""",2536
136828,05431729,n,10,"the music of Stravinsky: ""Stravinsky no longer causes riots in the streets""",2536
136829,05431861,n,10,"the music of Wagner: ""they say that Hitler listened only to Wagner""",2536
136838,05433932,n,10,"a sudden appearance of an overwhelming number of things: ""the program brought an avalanche of mail""",
136840,05434281,n,10,"an event as apprehended: ""a surprising experience""; ""that painful experience certainly got our attention""",
136839,05434087,n,10,"relatively unimportant or inconspicuous accompanying situation: ""when the rain came he could hear the sound of thunder in the background""",
136842,05434729,n,10,"an event that is experienced as indicating important things to come: ""he hoped it was an augury""; ""it was a sign from God""",
136844,05435037,n,10,"a sign of something about to happen: ""he looked for an omen before going into battle""",
136816,05430267,n,10,a computer user's instruction (not part of a program) that calls for action by the computer's executive program,
136798,05427868,n,10,metal plate on a dog collar bearing its registration number,
136799,05427981,n,10,military identification tag worn on a chain around the neck,
136800,05428094,n,10,a tag showing the name of the person who wears it,
136801,05428198,n,10,a tag showing the price of the article it is attached to,
136802,05428310,n,10,"made of cardboard, plastic, or metal",
136803,05428468,n,10,a mound of stones piled up as a memorial or to mark a boundary or path,
136804,05428590,n,10,a gesture involving the shoulders,
136805,05428675,n,10,the act of signaling by a movement of the hand,
136807,05428928,n,10,a sign of assent or salutation or command,
136808,05429019,n,10,bending the head or body or knee as a sign of reverence or submission or shame,
136811,05429537,n,10,the act of bending the knees in worship or reverence,
136812,05429662,n,10,a former Chinese custom of touching the ground with the forehead as a sign of respect or submission,
136815,05430102,n,10,a special rule (as in baseball) dealing with situations that arise due to the nature of the playing grounds,
136817,05430439,n,10,a notice of dismissal or discharge,
136818,05430534,n,10,a piece of writing that has been copied from someone else and is presented as being your own work,2657
136825,05431482,n,10,the music of Handel,2536
136826,05431554,n,10,the music of Haydn,2536
136830,05431981,n,10,a system of linguistic units or elements used in a particular language,1969
136832,05432389,n,10,a transmission from Earth to a spacecraft or the path of such a transmission,1935
136833,05432518,n,10,an event that could have occurred but never did,
136834,05432627,n,10,an anticipated event that turns out to be far less significant than was expected,
136835,05432762,n,10,an event that happens,
136836,05433534,n,10,an event or situation that happens at the same time as or in connection with another,
136843,05434947,n,10,an ominous sign that war threatens,
136845,05435260,n,10,a favorable omen,
136846,05435330,n,10,an unfavorable omen,
136847,05435406,n,10,an omen of death or destruction,
136850,05435797,n,10,a severe or trying experience,
202916,00508845,r,10,"in a southeastward direction: ""the river flows southeastward to the gulf""",2772
136854,05436378,n,10,an event characteristic of persons forming groups,1675
136855,05436522,n,10,a marvellous event manifesting a supernatural act of God,1565
203085,N0000118,n,11,automobile dotata di apparecchiatura radiotrasmittente,
136857,05436886,n,10,any amazing or wonderful occurrence,
136860,05437235,n,10,a happening that is distinctive in a series of related events,
136862,05437539,n,10,an episode that is turbulent or highly emotional,
136863,05437656,n,10,a possible event or occurrence or result,
136865,05438024,n,10,an event used to justify starting a war,
136869,05438927,n,10,the outcome of a complex sequence of events,
136871,05439220,n,10,fair treatment,
136872,05439304,n,10,unfair treatment,
136858,05436975,n,10,"something that causes feelings of wonder: ""the wonders of modern science""",
136861,05437423,n,10,"something experienced with great delight: ""a feast for the eyes""",
136859,05437110,n,10,"an event: ""a funny thing happened on the way to the...""",
136866,05438121,n,10,"an event whose occurrence ends something: ""his death marked the ending of an era""",
136876,05439829,n,10,"the outcome of an event especially as relative to an individual: ""that result is of no consequence""",
136867,05438448,n,10,"the concluding part of an event or occurrence: ""the end was exciting""; ""I had to miss the last of the movie""",
136870,05439027,n,10,"the type of treatment received (especially as the result of an agreement); ""he got a good deal on his car""",
136873,05439375,n,10,"the outcome of a game or contest: ""the team dropped three decisions in a row""",
136877,05440088,n,10,"a practical consequence that follows naturally: ""blind jealousy is a frequent corollary of passionate love""",
136878,05440251,n,10,"the consequence of some effort or action: ""he lived long enough to see the fruit of his policies""",
136880,05440478,n,10,"a series of consequences wrought by an event: ""it led to a train of disasters""",
136884,05441142,n,10,"a recompense for worthy acts or retribution for wrongdoing: ""the wages of sin is death""; ""virtue is its own reward""",
136886,05441431,n,10,"the least favorable outcome: ""the worst that could happen""",
136891,05442734,n,10,"a shocking surprise: ""news of the attack came like a bombshell""",
136894,05443053,n,10,"an unpleasant or disappointing surprise: ""it came as a shock to learn that he was injured""; ""it was blow to their hopes of reconciliation""",
136910,05445542,n,10,"a smouldering fire: ""the smoulder became a blaze""",
136895,05443250,n,10,"an unexpected and amazing event: ""the stunner was what happened on Saturday""",
136899,05444050,n,10,"a serious accident (usually involving one or more vehicles); ""they are still investigating the crash of the TWA plane""",1946
136903,05444579,n,10,"the event of something burning (often destructive); ""they lost everything in the fire""",
136875,05439713,n,10,a boxing decision in which the judges are not unanimous,2642
136879,05440400,n,10,a secondary consequence,
136881,05440608,n,10,an outcome in which virtue triumphs over vice (often ironically),
136883,05441038,n,10,something that follows something else,
136885,05441327,n,10,an inevitable event,
136887,05441541,n,10,an event that recurs at intervals,
136889,05442374,n,10,(psychology) modifying the natural expression of an impulse or instinct (especially a sexual one) to one that is socially acceptable,1502
136890,05442564,n,10,a sudden unexpected event,
136892,05442881,n,10,a dramatic surprise,
136893,05442962,n,10,something surprising and revealing,
136896,05443380,n,10,anything that happens by chance without an apparent cause,
136900,05444228,n,10,an accident in which a train runs off its track,1946
136901,05444332,n,10,a sharp uncontrollable turn made by an airplane while moving along the ground,1942
136902,05444467,n,10,an event in which two or more bodies come together,
136904,05444860,n,10,a large outdoor fire,
136905,05444945,n,10,an uncontrolled fire that consumes brush and shrubs and bushes,
136906,05445064,n,10,a small outdoor fire for warmth or cooking (as at a camp),
136907,05445176,n,10,a very intense and uncontrolled fire,
136908,05445300,n,10,an uncontrolled fire in a wooded area,
136909,05445449,n,10,an uncontrolled fire in a grassy area,
136911,05445646,n,10,a smoky fire to drive away insects,
136912,05445733,n,10,a forest fire that advances with great speed jumping from crown to crown ahead of the ground fire,
136853,05436224,n,10,"a religious or mystical experience of a supernatural appearance: ""he had a vision of the Virgin Mary""",1565
136914,05446010,n,10,a forest fire that burns only the surface litter and undergrowth,
203545,N0002311,n,11,lago italiano situato nel territorio di Lombardia e Ticino (Svizzera),
203663,N0002319,n,11,isola appartenente alla regione Sicilia,
136915,05446133,n,10,an raging and rapidly spreading conflagration,
136916,05446233,n,10,unnecessary and unforeseen trouble,
136918,05446561,n,10,a cause of great suffering and distress,
136920,05446938,n,10,something that extricates you from embarrassment,
136922,05447192,n,10,any experience that causes intense suffering,
136923,05447302,n,10,a sudden and severe onset of trouble,
136924,05447394,n,10,a disgraceful event,
136926,05447602,n,10,an episode of such pastoral or romantic charm as to qualify as the subject of a poetic idyll,
136927,05447746,n,10,a single distinct event,
136931,05448312,n,10,"the electrical discharge that travels along a nerve fiber: ""they demonstrated the transmission of impulses from the cortex to the hypothalamus""",2107
136936,05449233,n,10,"an instance or single occasion for some event: ""This time he succeeded""; ""He called four times""; ""he could do ten at a clip""",
136937,05449415,n,10,"an instance of some kind: ""it was a nice piece of work""; ""he had a bit of good luck""",
136952,05452156,n,10,"an accidental happening: ""he recorded all the little haps and mishaps of his life""",
136948,05451416,n,10,"process or result of becoming less or smaller: ""the material lost 2 inches per yard in shrinkage""",
136951,05451946,n,10,"a personal or social separation (as between opposing factions); ""they hoped to avoid a break in relations""",
136956,05452923,n,10,"a natural and unavoidable catastrophe that interrupts the expected course of events: ""he discovered that his house was not insured against acts of God""",
136959,05453472,n,10,"an unexpected piece of good luck: ""he finally got his big break""",
136967,05454715,n,10,"an event that accomplishes its intended purpose: ""let's call heads a success and tails a failure""; ""the election was a remarkable success for Republicans""",
136969,05455118,n,10,"a successful journey: ""they wished him Godspeed""",2772
136919,05446747,n,10,"some event that causes someone to be embarrassed: ""the outcome of the vote was an embarrassment for the liberals""",
136972,05455528,n,10,"weakening in force or intensity: ""attenuation in the volume of the sound""",
136928,05447915,n,10,any incident that attracts great public attention,
136929,05448024,n,10,the sudden giving off of energy,
136930,05448165,n,10,a discharge of electricity,2107
136932,05448543,n,10,the local voltage change across the cell wall as a nerve impulse is transmitted,2107
136933,05448685,n,10,a transient variation in voltage or current,2107
136934,05448780,n,10,a violent release of energy caused by a chemical or nuclear reaction,1781
136938,05449557,n,10,a natural event that involves a change in the position or location of something,
136939,05450024,n,10,the event of one object coming closer to another,
136941,05450302,n,10,the movement of the pointer or pen of a measuring instrument from its zero position,
136942,05450454,n,10,movement that causes the formation of a curve,
136943,05450578,n,10,a movement through space that changes the location of something,
136944,05450913,n,10,a collision between motor vehicles that produces minor damage,1946
136945,05451034,n,10,free movement or passage especially through a circuit as of water through pipes or sap through a plant,
136946,05451194,n,10,a slow longitudinal movement or deformation,
136947,05451289,n,10,the periodic passage from one region to another for feeding or breeding,2188
136950,05451786,n,10,an accident that results in physical damage or hurt,
136953,05452288,n,10,an instance of misfortune,
136954,05452519,n,10,loss of air pressure in a tire when a hole is made by some sharp object,1948
136957,05453204,n,10,a cosmic cataclysm in which God destroys the ruling powers of evil,1565
136958,05453327,n,10,an event that might have been arranged although it was really accidental,
136960,05453615,n,10,multiple collisions of vehicles,1946
136961,05453699,n,10,a serious collision (especially of motor vehicles),1946
136963,05454021,n,10,an event that does not accomplish its intended purpose,
136964,05454273,n,10,failure that results in a loss of position or reputation,
136965,05454384,n,10,a failure to function normally,
136970,05455221,n,10,any weakening or degeneration (especially through lack of use),
136971,05455349,n,10,becoming weaker,
136973,05455668,n,10,becoming stronger,
137159,05484396,n,10,(of a ship) sinking,1942
136921,05447067,n,10,"a cause of difficulty and suffering: ""war is hell""; ""go to blazes""",
136976,05456093,n,10,failure of a plan,
203781,W0003008,n,11,prezzo al quale il venditore e' disposto a vendere un titolo,1768
204017,W0003007,n,11,segno semicircolare con dentro un  punto che consente di prolungare a piacere la durata di una nota o di una pausa,2536
136977,05456179,n,10,a failure to hit (or meet or find etc),
136979,05456510,n,10,the emergence of a tooth as it breaks through the gum,
136982,05456978,n,10,the birth of a living fetus,
136983,05457098,n,10,(informal) the live birth of a child,
136984,05457208,n,10,delivery of an infant whose feet appear first,
136985,05457330,n,10,a second or new birth,
136986,05457439,n,10,the passing of a soul into another body after death,
136987,05457551,n,10,the event of coming into sight,
136988,05457728,n,10,appearing again,
136989,05457802,n,10,(Christian theology) the reappearance of Jesus as judge for the Last Judgment,1608
136990,05457964,n,10,an appearance in bodily form (as of a ghost),
136981,05456848,n,10,"the event of giving birth: ""she had a difficult delivery""",
136996,05458815,n,10,"the gradual beginning or coming forth: ""figurines presage the emergence of sculpture in Greece""",
136999,05459242,n,10,"the beginning of anything: ""it was off to a good start""",
137002,05459718,n,10,"the beginning or early stages: ""the onset of pneumonia""",
137011,05461147,n,10,"a factor in a given situation whose bearing and importance is not apparent: ""I don't know what the new man will do; he's still an unknown quantity""",
137007,05460489,n,10,"something that serves as a preceding event or introduces what follows: ""training is a necessary preliminary to employment""; ""drinks were the overture to dinner""",
137018,05462436,n,10,"an unavoidable event: ""don't argue with the inevitable""",
137012,05461357,n,10,"something that produces: ""Maine is a leading producer of potatoes"" or ""this microorganism is a producer of disease""",
137016,05462080,n,10,"a start given to contestants: ""I was there with my parents at the kickoff""",
137021,05462797,n,10,"total destruction: ""bomb tests resulted in the annihilation of the atoll""",
136993,05458440,n,10,a divine manifestation,
137019,05462548,n,10,(Hinduism and Buddhism) the effects of a person's actions that determine his destiny in his next incarnation,1565
137034,05464753,n,10,death that is imposed because of the person's adherence of a religious faith or cause,1565
137030,05464067,n,10,"complete annihilation: ""they think a meteor cause the extinction of the dinosaurs""",
137032,05464365,n,10,"a death resulting from an accident or a disaster: ""a decrease in the number of automobile fatalities""",
137035,05464894,n,10,"the death of a million people: ""they calibrate the effects of atom bombs in megadeaths""",
136980,05456618,n,10,"the event of being born: ""they celebrated the birth of their first child""",
137036,05465037,n,10,"euphemistic expressions for death: ""thousands mourned his passing""",
137014,05461717,n,10,"the beginning of a series or sequence: ""the Alpha and Omega, the first and the last, the beginning and the end""-Revelations",
137004,05459972,n,10,"the first event in a series: ""she played Chopin for her opener""; ""the season's opener was a game agains the Yankees""",
136994,05458517,n,10,a manifestation of the mind and will of God,
136997,05459005,n,10,a growth in strength or number or importance,
136998,05459154,n,10,a sudden rise in the crime rate,
137000,05459493,n,10,the increase in activity of the adrenal glands just before puberty,
137001,05459616,n,10,the first occurrence of menstruation in a woman,
137006,05460392,n,10,a preceding occurrence or cause or event,1451
137008,05460728,n,10,the cause of a disease,
137010,05461016,n,10,any factor that defines a system and determines (or limits) its performance,
137017,05462231,n,10,an event (or course of events) that will inevitably happen in the future,
137020,05462708,n,10,(Islamic) the will of Allah,1565
137022,05462964,n,10,the complete destruction of every trace of something,
137023,05463089,n,10,serious weakening and loss of energy,
137024,05463225,n,10,coming apart,
137025,05463353,n,10,process or result of distributing or extending over a wide expanse of space,
137026,05463529,n,10,the spread of social institutions (and myths and skills) from one society to another,
137027,05463669,n,10,driving off or spreading widely,
137028,05463806,n,10,the dispersion of the Jews from Palestine after the Babylonian exile (358 BC),
137031,05464222,n,10,the death of Jesus on the cross after he was condemned by the Jews as a false Messiah,1565
137038,05465405,n,10,an event that destroys something,
136975,05455950,n,10,"a disappointing decline after ad previous rise: ""the anticlimax of a brilliant career""",
137040,05465729,n,10,the event of a structure being completely demolished and leveled,1707
204295,W0003005,n,11,"ghirlanda di fiori che viene deposta sui feretri, sulle tombe o sui monumenti alla memoria",
204466,W0003021,n,11,nome di antiche monete e dell'attuale unita' monetaria circolante in alcuni paesi europei,"1768,1951"
204569,W0003016,n,11,massa cerebrale,2233
137041,05465857,n,10,an event that results in destruction,
137042,05465992,n,10,an event that results in total destruction,
137044,05466222,n,10,the event of passing out of sight,
137045,05466369,n,10,a sudden or mysterious disappearance,
137046,05466461,n,10,a slow or gradual disappearance,
137052,05467540,n,10,(chemistry) variability in chemical composition without variation in crystalline form,2111
137051,05467299,n,10,"a variation in circumstances or fortune at different times in your life or in the development of something: ""the project was subject to the usual vicissitudes of exploratory research""",
137050,05467031,n,10,an instance of change; the rate or magnitude of change,
137053,05467682,n,10,"contact by fitting together: ""the engagement of the clutch""; ""the meshing of gears""",
137057,05468378,n,10,"a sudden impact: ""the door closed with a jolt""",
137056,05468143,n,10,"an impact (as from a collision); ""the bump threw him off the bicycle""",
137058,05468490,n,10,"the physical coming together of two or more things: ""contact with the pier scraped paint from the hull""",
137082,05472244,n,10,"the wave that spreads behind a boat as it moves forward: ""the motorboat's wake capsized the canoe""",
137070,05470593,n,10,"one complete cycle of operations (as by a computer); ""it was not possible to complete the computation in a single pass""",
137083,05472404,n,10,"the movement or sound of water: ""the swash of waves on the beach""",
137073,05471083,n,10,"a periodically repeated sequence of events: ""a cycle of reprisal and retaliation""",
137075,05471329,n,10,"happening again (especially at regular intervals); ""the return of spring""",
137043,05466105,n,10,"the destruction or collapse of something: ""wrack and ruin""",
137090,05473610,n,10,"a wave motion: ""the fluctuations of the sea""",2097
137071,05470763,n,10,"an event that repeats: ""the events today were a repeat of yesterday's""",
137055,05468032,n,10,the striking of one body against another,
137059,05468760,n,10,loss of military equipment,1781
137060,05468896,n,10,loss of military equipment in battle,1781
137061,05469010,n,10,loss of military equipment in field operations,1781
137062,05469144,n,10,a decrease of military personnel or equipment,1781
137063,05469280,n,10,a casualty to military personnel resulting from combat,1781
137064,05469447,n,10,a wound that would cause an English soldier to be sent home from service abroad,1781
137065,05469586,n,10,a wound that does not damage important internal organs or shatter any bones,1781
137066,05469719,n,10,military personnel lost by death or capture,1781
137067,05469870,n,10,"personnel that are sacrificed (e.g., surrendered or lost in order to gain an objective)",1781
137072,05470971,n,10,several repetitions of a melodic phrase in different keys,
137074,05471216,n,10,something (especially a game) that is played again,
137076,05471504,n,10,a reappearance of an earlier characteristic,2188
137077,05471625,n,10,an unexpected but vivid recurrence of a past experience (especially a recurrence of the effects of an hallucinogenic drug taken much earlier),
137078,05471822,n,10,the daily event of the sun rising above the horizon,
137079,05471927,n,10,the daily event of the sun sinking below the horizon,
137080,05472032,n,10,a broad and deep undulation of the ocean,
137081,05472145,n,10,waves breaking on the shore,
137084,05472521,n,10,a small wave on the surface of a liquid,
137085,05472643,n,10,(physics) a wave that is hypothesized to propagate gravity and to travel at the speed of light,2097
137086,05472815,n,10,a wave whose waveform resembles a sine curve,2097
137087,05472915,n,10,(physics) a regular variation in value about a mean,2097
137088,05473126,n,10,(electronics) an oscillation of small amplitude imposed on top of a steady value,2284
137089,05473259,n,10,(physics) a progressive disturbance propagated without displacement of the medium itself,2097
137093,05474140,n,10,(acoustics) a wave that transmits sound,2101
137094,05474254,n,10,a sound wave that is transmitted via air,2101
137095,05474349,n,10,(physics) a short-lived oscillation in a system caused by a sudden change of voltage or current or load,2097
137096,05474508,n,10,the shape of a wave illustrated graphically by plotting the values of the period quantity against time,2097
137097,05474690,n,10,a region of high pressure travelling through a gas at a high velocity,
137049,05466934,n,10,"a bad experience: ""the school of hard knocks""",
137099,05475051,n,10,the undulating movement of the surface of the open sea,
204585,N0001173,n,11,"condizione patologica caratterizzata da un aumento del gas contenuto nell'intestino, con distensione addominale e, talora, dolori diffusi",
137100,05475192,n,10,a wave that lifts the surface of the water or ground,
137101,05475302,n,10,a large sea wave,
137102,05475379,n,10,a huge destructive wave (especially one caused by an earthquake),
137103,05475510,n,10,a long heavy sea wave as it advances towards the shore,
137104,05475639,n,10,a periodic motion in which the displacement is either symmetrical about a point or is the sum of such motions,
