135805,05279868,n,10,a musical composition written for six performers,2536
135806,05279989,n,10,a musical composition written for seven performers,2536
135807,05280103,n,10,a musical composition written for eight performers,2536
135808,05280215,n,10,a musical setting for a religious text,2536
135809,05280318,n,10,a light piece of music for piano,2536
135811,05280537,n,10,(Irish) a funeral lament sung with loud wailing,2536
135812,05280635,n,10,a contrapuntal piece of music in which a melody in one part is imitated exactly in other parts,2536
135813,05280799,n,10,a canon in which the entrances of successive parts were indicated by cryptic symbols and devices (popular in the 15th and 16th centuries),2536
135814,05281048,n,10,a composition for orchestra and a soloist,2536
135815,05281162,n,10,a baroque composition for orchestra and a group of solo instruments,2536
135817,05281448,n,10,a musical form consisting of a theme repeated a fifth above or a fourth below its first statement,2536
135818,05281597,n,10,a musical composition that evokes rural life,2536
135819,05281716,n,10,a musical form that is often the last movement of a sonata,2536
135820,05281836,n,10,a musical composition of 3 or 4 movements of contrasting forms,2536
135821,05282006,n,10,a sonata for piano,2536
135822,05282083,n,10,a baroque musical composition (usually for a keyboard instrument) with full chords and rapid elaborate runs in a rhythmically free style,2536
135823,05282273,n,10,a musical composition of a free form usually incorporating several familiar themes,2536
135824,05282410,n,10,a long and complex sonata for symphony orchestra,2536
135786,05276818,n,10,"the canticle of the Virgin Mary (from Luke 1:46 beginning ""Magnificat anima mea Dominum"")","1565,2536"
198582,02782505,a,10,"of or relating to Rene Descartes or his works: ""Cartesian linguistics""","1451,2768,2873"
198583,02782661,a,10,"of or relating to Mexico or its inhabitants: ""Mexican food is hot""","1820,2772"
135825,05282531,n,10,a short section of a musical composition,2536
135826,05282751,n,10,a brief introductory passage to a piece of popular music,2536
135827,05282859,n,10,a short musical passage two to four measures long,2536
135828,05283015,n,10,a musical phrase repeated over and over during a composition,2536
135855,05286811,n,10,a song celebrating the joys of drinking; sung at drinking parties,2536
135830,05283288,n,10,a brilliant solo passage occuring near the end of a piece of music,2536
135865,05288291,n,10,an unaccompanied partsong for 2 or 3 voices; follows a strict poetic form,2536
135881,05290226,n,10,a stately piece of music composed for dancing the minuet; often incorporated into a sonata or suite,2536
135882,05290378,n,10,music in march time composed for dancing the paso doble; often played a bull fights,2536
135840,05284976,n,10,"a composition intended to develop one aspect of the performer's technique; ""a study in spiccato bowing""",2536
135832,05283630,n,10,a movement that is to be performed in a slow and broad manner,2536
135833,05283743,n,10,a fast movement (usually in triple time),2536
135834,05283837,n,10,a musical composition of several movements only loosely connected,2536
135835,05283954,n,10,an orchestral composition based on literature or folk tales,2536
135836,05284086,n,10,a musical composition consisting of a series of songs or other musical pieces from various sources,2536
135837,05284260,n,10,a pensive lyrical piece of music (especially for the piano),2536
135838,05284374,n,10,a musical composition to be played in adagio tempo (slowly and gracefully),2536
135841,05285131,n,10,alternate (responsive) singing by a choir in two parts,2536
135842,05285241,n,10,a song formally adopted as the anthem for a nation,"1565,2536"
135843,05285389,n,10,the French national anthem,"1565,2536"
135844,05285474,n,10,the national anthem of the US,"1565,2536"
135845,05285570,n,10,an elaborate song for solo voice,2536
135846,05285690,n,10,a short aria,2536
135847,05285769,n,10,a narrative song with a recurrent refrain,2536
135848,05285887,n,10,ballads sung by minstrels,2536
135849,05285969,n,10,a boating song sung by Venetian gondoliers,2536
135850,05286080,n,10,a rhythmical work song originally sung by sailors,2536
135851,05286215,n,10,the part of a song where a soloist is joined by a group of singers,2536
135852,05286381,n,10,a set of nonsensical syllables used while humming a refrain,2536
135853,05286505,n,10,a short simple song (or the words of a poem intended to be sung),2536
135854,05286621,n,10,a song or hymn of mourning composed or performed as a memorial to a dead person,2536
135858,05287380,n,10,a flattened third or seventh,2536
135859,05287483,n,10,a German art song of the 19th century,2536
135860,05287571,n,10,a song about love or expressing love for another person,2536
135861,05287681,n,10,a quiet song intended to lull a child to sleep,2536
135863,05288085,n,10,the lyric of a lovesong,"1422,2657"
135864,05288165,n,10,a song with two or more voice parts,2536
135867,05288668,n,10,a song in which a line or phrase is repeated as the refrain,2536
135868,05288783,n,10,a song (sometimes improvised) sung by guests at a banquet,2536
135869,05288909,n,10,a song characteristically played outside the house of a woman,2536
135870,05289043,n,10,a popular song concerned with disappointment in love,2536
135871,05289152,n,10,a usually rhythmical song song to accompany repetitious work,2536
135872,05289286,n,10,a noisy mock serenade (made by banging pans and kettles) to a newly married couple,2536
135873,05289482,n,10,music written for a ballet,2536
135874,05289561,n,10,music written in the rhythm of the bolero dance,2536
135875,05289661,n,10,music composed for dancing the conga,2536
135876,05289749,n,10,music composed in quadruple time for dancing the gavotte,2536
135877,05289859,n,10,music for dancing the hornpipe,2536
135878,05289944,n,10,music in three-four time for dancing a jig,2536
135879,05290036,n,10,music in triple time for dancing the landler,2536
135880,05290134,n,10,music composed for dancing the mazurka,2536
135883,05290518,n,10,music composed for dancing the pavane,2536
135884,05290608,n,10,music performed for dancing the polka,2536
135885,05290697,n,10,music for dancing the quadrille,2536
135831,05283408,n,10,"a major self-contained part of a symphony or sonata; ""the second movement is slow and melodic""",2536
198584,02782781,a,10,"of or relating to a style of architecture in England in the 15th century: ""half-timbered Tudor houses""; ""Tudor furniture""","1675,2794"
135886,05290784,n,10,music composed for dancing a reel,2536
135887,05290868,n,10,syncopated music in duple time for dancing the rumba,2536
135888,05290981,n,10,music composed for dancing the samba,2536
135889,05291069,n,10,music composed for dancing the saraband,2536
135890,05291163,n,10,music performed for dancing the schottische,2536
135891,05291264,n,10,20th century music that uses of a definite order of notes as a thematic basis for a musical composition,2536
135893,05291692,n,10,music written in duple time for dancing the tango,2536
135903,05293127,n,10,popular music originating in the West Indies; repetitive bass riffs and regular chords played on the off beat by a guitar,2536
135905,05293492,n,10,"a way of expressing something (in language or art or music etc.) that is characteristic of a particular person or group of people or period; ""all the reporters were expected to adopt the style of the newspaper""","1969,2425"
135915,05295296,n,10,"the style of expressing yourself: ""he suggested a better formulation""; ""his manner of expression showed how much he cared""","1969,2425"
135919,05296038,n,10,"an expression of respect: ""the Japanese use many honorifics""","1969,2425"
135940,05299034,n,10,"the manner in which something is expressed in words: ""use concise military verbiage""-G.S.Patton","1969,2425"
135930,05297733,n,10,"expressing in coherent verbal form: ""the articulation of my feelings"" or ""I gave voice to my feelings""",
135924,05297025,n,10,the style of writing characteristic of some government officials: formal and obscure,"1969,2425"
135926,05297264,n,10,"matter of fact, commonplace, or dull expression","1969,2425"
135942,05299457,n,10,"a manner of speaking: ""he spoke with a thick tongue""; ""she has a glib tongue""",2425
135906,05294187,n,10,"the manner of speaking to another individual: ""he failed in his manner of address to the captain""","1969,2425"
135929,05297596,n,10,the expression of one's individuality (usually through creative activities),"1969,2425"
135894,05291793,n,10,music composed in six-eight time for dancing the tarantella,2536
135917,05295741,n,10,high flown style; excessive use of verbal ornamentation,"1969,2425"
135895,05291909,n,10,music composed in triple time for waltzing,2536
135896,05292003,n,10,music having wide appeal (but usually only for a short time),2536
135898,05292336,n,10,music of general appeal to young people,2536
135899,05292437,n,10,the traditional and typically anonymous music that is an expression of the life of people in a community,2536
135901,05292903,n,10,country music originating in mountainous regions of southern US,2536
135902,05293028,n,10,music performed for square dancing,2536
135907,05294338,n,10,a break or check in the voice (usually a sign of strong emotion),"1969,2425"
135909,05294626,n,10,triteness or triviality of style,"1969,2425"
135910,05294711,n,10,something in an artistic work designed to achieve a particular effect,"1969,2425"
135911,05294851,n,10,using the technical language of ecology to make the user seem ecologically aware,"1969,2425"
135912,05294987,n,10,powerful and effective language,"1969,2425"
135913,05295084,n,10,any artificially elegant style of language,"1969,2425"
135914,05295181,n,10,the jargon of European community documents and regulations,"1969,2425"
135916,05295633,n,10,incomprehensible or pompous jargon of specialists,"1969,2425"
135918,05295934,n,10,using the abbreviated style of headline writers,"1969,2425"
135920,05296154,n,10,specialized technical terminology characteristic of a particular subject,"1969,2425"
135921,05296369,n,10,the style in which newspapers are written,"1969,2425"
135922,05296485,n,10,a style that uses the abstruse technical vocabulary of the law,"1969,2425"
135925,05297167,n,10,a style that has the power to evoke feelings,"1969,2425"
135927,05297363,n,10,using language loaded with psychological terminology,"1969,2425"
135928,05297474,n,10,using language effectively to please or persuade,"1969,2425"
135931,05297902,n,10,the use of an archaic expression,"1969,2425"
135932,05298002,n,10,a standard formulation of legal documents or news stories,"1753,1802,1969,2425"
135934,05298308,n,10,the appropriate word or expression,"1969,2425"
135935,05298398,n,10,expressing something in words,"1969,2425"
135936,05298487,n,10,a manner of speaking that is natural to native speakers of a language,"1969,2425"
135937,05298619,n,10,an expression that is characteristic of English as spoken by Americans,"1969,2425"
135939,05298941,n,10,a word or phrase borrowed from French,1969
135941,05299284,n,10,the use of manner of speaking to communicate particular meanings,"1935,1969"
135943,05299605,n,10,a bitter or critical manner of speaking,2425
135944,05299703,n,10,a manner of speaking that is distinctive of a particular group of people,"1969,2425"
135897,05292195,n,10,popular dance music of Brazil; derived from the practices of the macumba religious cult,2536
135948,05300305,n,10,an expert manner of speaking involving control of voice and gesture,"1969,2425"
198587,02783177,a,10,"of or relating to William Shakespeare or his works: ""Shakespearean plays""",2657
198589,02783427,a,10,"of or relating to Queen Victoria of Great Britain or to the age in which she ruled: ""Victorian morals""",2794
135949,05300428,n,10,the rapid and continuous delivery of linguistic communication (spoken or written),1969
135950,05300588,n,10,the patterns of stress and intonation in a language,"1969,2425"
135951,05300778,n,10,rise and fall of the voice pitch,"1969,2425"
135952,05300937,n,10,intonations characteristic of questions and requests and statements,"1969,2425"
135962,05302452,n,10,the first beat of a musical measure (as the conductor's arm moves downward),2536
135961,05302217,n,10,"the basic rhythmic unit in a piece of music: ""the piece has a fast rhythm""; ""the conductor set the beat""",2536
135977,05304369,n,10,"a distinctive style or manner: ""he continued in this vein for several minutes""","1969,2425"
135985,05305506,n,10,"using more words than necessary: ""a tiny little child""","1969,2425"
135986,05305615,n,10,"useless repetition: ""to say that something is ""adequate enough"" is a tautology""","1969,2425"
135989,05306031,n,10,"abbreviation of a word by omitting the final sound or sounds: ""the British get ""pud"" from ""pudding"" by apocope""",1969
135960,05302022,n,10,"the arrangement of spoken words alternating stressed and unstressed elements: ""the rhythm of Frost's poetry""","1969,2425"
136005,05308355,n,10,"a metrical unit with unstressed-stressed-unstressed syllables (e.g., ""remember"")",2657
135953,05301069,n,10,an unchanging intonation,"1969,2425"
135954,05301166,n,10,a regular and monotonous rising and falling intonation,"1969,2425"
135955,05301275,n,10,a break or pause (usually for sense) in the middle of a verse line,"1969,2425"
135957,05301661,n,10,emphasis the results from pitch rather than loudness,"1969,2425"
135958,05301787,n,10,the distribution of stresses within a polysyllabic word,"1969,2425"
135959,05301914,n,10,the distribution of stresses within a sentence,"1969,2425"
135963,05302582,n,10,an unaccented beat (especially the last beat of a measure),2536
135964,05302693,n,10,a musical rhythm accenting a weak beat,2536
135965,05302789,n,10,a vocal passage of narrative text that a singer delivers with natural rhythms of speech,2536
135966,05302951,n,10,(music) a short recitative that is melodic but is not an aria,2536
135967,05303065,n,10,a musical passage moving from one key to another,2536
135968,05303183,n,10,pompous or pretentious talk or writing,"1969,2425"
135969,05303310,n,10,using long words,"1969,2425"
135971,05303599,n,10,technical jargon from computing and other high-tech subjects,"1969,2425"
135972,05303718,n,10,a neatly short and concise expressive style,"1969,2425"
135973,05303907,n,10,terseness achieved by expressing a great deal in just a few words,"1969,2425"
135975,05304196,n,10,the use of brief expressions,"1969,2425"
135976,05304278,n,10,terseness of expression,"1969,2425"
135978,05304498,n,10,an expressive style that uses excessive words,"1969,2425"
135979,05304721,n,10,overabundance of words,"1969,2425"
135980,05304798,n,10,boring verboseness,"1969,2425"
135981,05304969,n,10,a style that involves indirect ways of expressing things,"1969,2425"
135982,05305100,n,10,pompously embellished language,"1969,2425"
135983,05305212,n,10,verboseness resulting from excessive repetitions,"1969,2425"
135984,05305375,n,10,repetition of messages to reduce the probability of errors in transmission,"1969,2425"
135988,05305918,n,10,a shortened form of a word or phrase,1969
135990,05306196,n,10,a word formed from the initial letters of a multi-word name,1969
135991,05306309,n,10,a style of expressing yourself in writing,"2425,2657"
135993,05306706,n,10,literature in metrical form,"2425,2657"
135994,05306820,n,10,any communication resembling poetry in beauty or the evocation of feeling,"1969,2425,2657"
135995,05306946,n,10,the writing of verse,2657
135996,05307062,n,10,a system of versification,2657
135997,05307231,n,10,(prosody) the accent in a metrical foot of verse,2657
135998,05307412,n,10,analysis of verse into metrical patterns,2657
135999,05307507,n,10,a poetic rhythm that imitates the rhythm of speech,2657
136000,05307617,n,10,the usual (iambic) meter of a ballad,2657
136001,05307729,n,10,a group of 2 or 3 syllables forming the basic unit of poetic rhythm,2657
136002,05308005,n,10,a metrical unit with stressed-unstressed-unstressed syllables,2657
136003,05308119,n,10,a metrical unit with unstressed-stressed syllables,2657
136004,05308229,n,10,a metrical unit with unstressed-unstressed-stressed syllables,2657
136006,05308492,n,10,a metrical unit with stressed-stressed-unstressed syllables,2657
135947,05300195,n,10,"a quiet or hushed tone of voice: ""spoke in undertones""","1969,2425"
198593,02784009,a,10,"of or relating to Aristotle or his philosophy: ""Aristotelean logic""","1451,1820,2768,2772"
198599,02784667,a,10,"of or relating to George Boole or his logic: ""Boolean logic""",2873
136007,05308605,n,10,a metrical unit with stressed-stressed syllables,2657
136008,05308707,n,10,a metrical unit with unstressed-unstressed syllables,2657
136022,05310558,n,10,"an imperfect rhyme (e.g., ""love"" and ""move"")",2657
136054,05315524,n,10,"reversal of the syntactic relation of two words (as in ""her beauty's face"")",2657
136051,05315111,n,10,"immediate rephrasing for intensification or justification: ""Seems, madam! Nay, it is""",2657
136050,05314959,n,10,"a substitution of part of speech or gender or number or tense etc. (e.g., editorial ""we"" for ""I"")",2657
136032,05312549,n,10,"repetition of a word in a different case or inflection in the same sentence: ""My own heart's heart""",2657
136048,05314709,n,10,"an exclamatory rhetorical device: ""O tempore! O mores""",2657
136055,05315655,n,10,"reversal of normal word order (as in ""cheese I love"")",2657
136057,05315873,n,10,"use of a series of parallel clauses (as in ""I came, I saw, I conquered"")",2657
136058,05316002,n,10,"reversal of normal order of two words or sentences etc. (as in ""bred and born"")",2657
136009,05308823,n,10,a verse line having four metrical feet,1969
136010,05308918,n,10,a verse line having five metrical feet,1969
136011,05309013,n,10,a verse line having six metrical feet,1969
136012,05309106,n,10,a verse line having eight metrical feet,1969
136013,05309201,n,10,a verse line having eight syllables or a poem of octosyllabic lines,1969
136014,05309327,n,10,a verse line having ten syllables,1969
136015,05309419,n,10,correspondence in the sounds of two or more lines (esp. final sounds),2657
136016,05309656,n,10,a rhyme between words in the same line,2657
136018,05309989,n,10,the repetition of similar vowels in the stressed syllables of successive words,2657
136019,05310137,n,10,the repetition of consonants (or consonant patterns) especially at the ends of words,2657
136021,05310430,n,10,a stanza of eight lines of heroic verse with the rhyme scheme abababcc,"1422,2657"
136023,05310658,n,10,a use of language that creates a literary effect (but often without regard for literal significance),2657
136024,05311417,n,10,an abrupt change within a sentence from one syntactic structure to another,2657
136025,05311563,n,10,the repeated use of the same word or word pattern as a rhetorical device,2657
136026,05311872,n,10,repetition of the final words of a sentence or line at the beginning of the next,2657
136027,05312010,n,10,repetition after intervening words,2657
136028,05312102,n,10,repetition or recapitulation in reverse order,2657
136029,05312220,n,10,"repetition of the ends of two or more successive sentences, verses, etc.",2657
136030,05312360,n,10,doubling of a word or words,2657
136031,05312444,n,10,repetition to gain special emphasis or extend meaning,2657
136033,05312705,n,10,repetition of a word or phrase as the beginning of successive clauses,2657
136034,05312842,n,10,using a pronoun or other pro-word instead of repeating a word,2657
136035,05312958,n,10,"repetition of a word or phrase at the beginning and another at the end of successive clauses, i.e., simultaneous use of anaphora and epistrophe",2657
136036,05313156,n,10,the reversal of the normal order of words,2657
136037,05313266,n,10,the use of a word in a sense opposite to its normal sense (especially in irony),2657
136038,05313422,n,10,the juxtaposition of contrasting words or ideas to give a feeling of balance,2657
136039,05313555,n,10,substitution of a title for a name,2657
136040,05313647,n,10,mentioning something by saying it will not be mentioned,2657
136041,05313758,n,10,breaking off in the middle of a sentence (as by writers of realistic conversations),2657
136042,05313899,n,10,address to an absent or imaginary person,2657
136044,05314197,n,10,inversion in the second of two parallel phrases,2657
136045,05314299,n,10,arrangement of clauses in ascending order of forcefulness,2657
136046,05314409,n,10,interchange of subject and predicate of a proposition,2657
136049,05314834,n,10,special and significant stress by means of position or repetition e.g.,2657
136052,05315255,n,10,a rhetorical device in which the speaker reproaches the audience in order to incite or convince them,2657
136053,05315411,n,10,use of two conjoined nouns instead of a noun and modifier,2657
136056,05315765,n,10,use of a series of subjects with a single predicate,2657
136059,05316145,n,10,"understatement, esp. expressing an affirmative by negating its contrary",2657
136060,05316280,n,10,using words that imitate the sound they denote,2657
136061,05316385,n,10,suggesting by deliberately concise treatment that much of significance is omitted,2657
136020,05310296,n,10,a stanza form having seven lines of iambic pentameter; introduced by Chaucer,"1422,2657"
136064,05316890,n,10,anticipating and answering objections in advance,2657
198611,02786115,a,10,"of or relating to Draco or his harsh code of laws: ""Draconian measures""","1802,2768,2772"
198612,02786242,a,10,"of or relating to Albert Einstein or his theories: ""the Einsteinian universe""",2097
136065,05316994,n,10,a comparison comprising a well-known quotation followed by a facetious sequel,2657
136066,05317127,n,10,language used in a figurative or nonliteral sense,2657
136073,05318526,n,10,"substituting the name of an attribute or feature for the name of the thing itself (as in ""they counted heads"")",2657
136075,05318823,n,10,"conjoining contradictory terms (as in ""deafening silence"")",2657
136077,05319077,n,10,"a figure of speech that expresses a resemblance between things of different kinds (usually formed with ""like"" or ""as"")",2657
136082,05319899,n,10,"communication by word of mouth: ""his speech was slurred""; ""he uttered harsh language""; ""he recorded the language of the streets""",
136083,05320310,n,10,"the words that are spoken: ""I listened to his words very closely""",
136085,05320939,n,10,"the exchange of spoken words: ""they were perfectly comfortable together without speech""",
136113,05325365,n,10,"a consonant produced by stopping air at some point and suddenly releasing it: ""his stop consonants are too aspirated""",1969
136103,05323874,n,10,a neutral middle vowel; occurs in unstressed syllables,1969
136107,05324387,n,10,"a semivowel produced with the tongue near the palate (like the initial sound in the English word ""yeast"")",1969
136080,05319528,n,10,"use of a word to govern two or more words though appropriate to only one: """"Mr. Pickwick took his hat and his leave"" is an example of zeugma""",2657
136067,05317444,n,10,a trope that involves incongruity between what is expected and what occurs,2657
136068,05317607,n,10,extravagant exaggeration,2657
136069,05317702,n,10,"conventional metaphoric name for something, used esp. in Old English and Old Norse poetry",2657
136070,05317845,n,10,a figure of speech in which an expression is used to refer to something that it does not literally denote in order to suggest a similarity,2657
136072,05318372,n,10,a metaphor that exploits a similarity between experiences in different sense modalities,2657
136074,05318709,n,10,substituting metonymy of one figurative sense for another,2657
136076,05318936,n,10,representing an abstract quality or idea as a person or creature,2657
136078,05319248,n,10,substituting a more inclusive term for a less inclusive one or vice versa,2657
136079,05319378,n,10,use of a word to govern two or more words though agreeing in number or case etc. with only one,2657
136081,05319740,n,10,communication that relies on hearing,
136084,05320427,n,10,sounds uttered for auditory communication,
136087,05321341,n,10,(linguistics) an individual sound unit of speech without concern as to whether or not it is a phoneme of some language,1969
136088,05321661,n,10,(linguistics) the phonemes (or strings of phonemes) that constitute the various allomorphs of a morpheme,1969
136089,05321825,n,10,(linguistics) one of a small set of speech sounds that are distinguished by the speakers of a particular language,1969
136090,05322010,n,10,(linguistics) any of various acoustically different forms of the same phoneme,1969
136091,05322143,n,10,a vowel whose quality or length is changed to indicate linguistic distinctions (such as sing sang sung song),1969
136092,05322316,n,10,a vowel sound that starts near the articulatory position for one vowel and moves toward the position for another,1969
136093,05322484,n,10,a speech sound made with the vocal tract open,1969
136094,05322685,n,10,the system of accentuation used in a particular language,1969
136095,05322822,n,10,the system of consonants used in a particular language,1969
136096,05322960,n,10,the morphophonemics of a particular language,1969
136097,05323072,n,10,the system of phonemes recognized in a language,1969
136098,05323217,n,10,the system of phones used in a particular language,1969
136099,05323371,n,10,the pattern of syllable formation in a particular language,1969
136100,05323487,n,10,a system of tenses used in a particular language,1969
