192407,01855460,a,10,"characterized by unrest or disorder or insubordination: ""effects of the struggle will be violent and disruptive""; ""riotous times""; ""these troubled areas""; ""the tumultuous years of his administration""; ""a turbulent and unruly childhood""",
192409,01855993,a,10,"characterized by short periods of noisy commotion: ""a home life that has been extraordinarily squally""",
192412,01856561,a,10,"dependent upon or characterized by chance: ""a haphazard plan of action""; ""his judgment is rather hit-or-miss""",
192415,01856994,a,10,"not haphazard: ""a series of orderly actions at regular hours""",
192446,01862188,a,10,"having been read; often used in combination: ""a widely read newspaper""",
192416,01857122,a,10,"having or showing or acting with a purpose or design: ""purposive behavior""",
192417,01857252,a,10,"consistent with or based on or using reason: ""rational behavior""; ""a process of rational inference""; ""rational thought""",
192421,01858003,a,10,"marked by sound judgment: ""sane nuclear policy""",
192422,01858114,a,10,"not consistent with or using reason: ""irrational fears""; ""irrational animals""",
192423,01858410,a,10,"not based on reason on evidence: ""blind hatred""; ""unreasonable expectations""",
192424,01858567,a,10,"unable to think or express your thoughts in a clear or orderly manner: ""incoherent with grief""",
192427,01859078,a,10,"not based on reason: ""there is a great deal that is nonrational in modern culture""",
192429,01859418,a,10,"determined or actuated by emotion rather than reason: ""it was an emotional judgment""",
192426,01858836,a,10,"(archaic) showing or experiencing a state of disordered feeling or distorted judgment as through bitterness or melancholy; ""all looks yellow to the jaundiced eye""-Alexander Pope",
192430,01859558,a,10,"involving intelligence rather than emotions or instinct: ""a cerebral approach to the problem""; ""cerebral drama""",
192432,01859989,a,10,"consisting of or combining two races: ""a biracial committee""",
192433,01860104,a,10,"involving or existing between two or more races: ""interracial neighborhoods""; ""interracial politics""; ""interracial marriage""; ""interracial understanding""",
192434,01860315,a,10,"made up of or involving or acting on behalf of various races: ""a multiracial society""; ""multiracial government""",
192435,01860484,a,10,"based on racial intolerance: ""racist remarks""",
192442,01861579,a,10,"not participating in a chemical reaction: ""desired amounts of inactive chlorine""","2097,2111"
192444,01861920,a,10,"inert especially toward oxygen: ""a noble gas such as helium or neon""; ""noble metals include gold and silver and platinum""","2097,2111"
192437,01860809,a,10,"(chemistry and physics) participating readily in reactions; ""sodium is a reactive metal""; ""free radicals are very reactive""","2097,2111"
192438,01861041,a,10,(physics) of e.g. a molecule; made reactive or more reactive,"2097,2111"
192447,01862309,a,10,"not having been read: ""through sheer mischance the letter remained unread""",
192449,01862922,a,10,"ready for immediate use: ""soldiers with guns at the ready""; ""students with pens and notebooks at the ready""",
192455,01864037,a,10,"not prepared or in a state of readiness; slow to understand or respond: ""she cursed her unready tongue""",
192451,01863316,a,10,"in a state of proper readiness or preparation or arrangement: ""everything is in order for their arrival""",
192452,01863475,a,10,"quick in apprehending or reacting: ""a prompt (or ready) response""; ""a ready smile""",
192453,01863610,a,10,"fully prepared or eager: ""the colonists were ripe for revolution""",
192456,01864302,a,10,"unprepared and unable to react quickly: ""the new product caught their competitors flat-footed""",
192457,01864454,a,10,"not prepared or vigilant: ""the blow caught him napping""; ""caught in an off-guard moment""; ""found him off his guard""",
192410,01856161,a,10,"marked by a lack of quiet; not conducive to rest: ""spent a restless night""; ""fell into an uneasy sleep""",
192398,01853858,a,10,"sounding like thunder: ""the thundering herd""",
192459,01864865,a,10,not fully prepared,
192508,01876171,a,10,(of theories etc) incapable of being defended or justified,2234
192515,01877643,a,10,capable of acting on or influencing each other,
192518,01878006,a,10,moving alternately backward and forward,
192519,01878121,a,10,given or done or owed to each other,
192522,01878429,a,10,not reciprocal,
192523,01878539,a,10,not moving alternately forward and backward,
192464,01866030,a,10,"lacking in reality or substance or genuineness; not corresponding to acknowledged facts or criteria: ""ghosts and other unreal entities""; ""unreal propaganda serving as news""",
192470,01867622,a,10,"based on or told of in traditional stories; lacking factual basis or historical validity: ""mythical centaurs""; ""the fabulous unicorn""",
192468,01867171,a,10,"celebrated in fable or legend: ""the fabled Paul Bunyan and his blue ox""; ""legendary exploits of Jesse James""",
192493,01872783,a,10,"coinciding with reality: ""perceptual error...has a surprising resemblance to veridical perception""-F.A.Olafson",
192490,01872306,a,10,"true to life; lifelike: ""the living image of her mother""",
192474,01868517,a,10,"marked by or producing illusion: ""illusionary stage effects""",
192476,01869002,a,10,"imagined as in a play: ""the make-believe world of theater""; ""play money""; ""dangling their legs in the water to catch pretend fish""",
192478,01869539,a,10,"having all the qualities typical of the thing specified: ""wanted a proper dinner; not just a snack""; ""he finally has a proper job""",
192479,01869725,a,10,"rightly so called: ""true courage""; ""a spirit which true men have always admired""; ""a true friend""",
192481,01870192,a,10,"causing one to believe what is not true or fail to believe what is true: ""deceptive calm""; ""a delusory pleasure""",
192482,01870371,a,10,"resembling a dream: ""night invested the lake with a dreamlike quality""; ""as irrational and surreal as a dream""",
192487,01871576,a,10,"sensible and practical: ""has a straightforward down-to-earth approach to a problem""; ""her earthy common sense""",
192484,01870741,a,10,"(economics) being value measured in terms of purchasing power; ""real prices""; ""real income""; ""real wages""",1753
192485,01870897,a,10,"(economics) being value in terms of specification on currency or stock certificates rather than purchasing power; ""nominal or face value""",1753
192489,01872076,a,10,"evoking lifelike images within the mind: ""pictorial poetry and prose""; ""graphic accounts of battle""; ""a lifelike portrait""; ""a vivid description""",
192491,01872415,a,10,"founded on practical matters: ""a recent graduate experiencing the real world for the first time""",
192511,01876713,a,10,"concerning each of two or more persons or things; especially given or done in return: ""reciprocal aid""; ""reciprocal trade""; ""reciprocal respect""; ""reciprocal privileges at other clubs""",
192501,01874433,a,10,"absurd and inappropriate: ""the unreasonable nimbus of romance with which she had encircled that man""-Thomas Hardy",
192494,01872957,a,10,"being actually such in almost every respect: ""a practical failure""; ""the once elegant temple lay in virtual ruin""",
192495,01873142,a,10,"not realistic: ""unrealistic expectations""; ""prices at unrealistic high levels""",
192497,01873650,a,10,"inappropriate to reality or facts: ""delusive faith in a wonder drug""; ""delusive expectations""; ""false hopes""",
192499,01873966,a,10,"characterized by surreal distortion and a sense of impending danger: ""the kafkaesque terror of the endless interrogations""",
192502,01874606,a,10,"showing reason or sound judgment: ""a sensible choice""; ""a sensible person""",2234
192505,01875627,a,10,"based on known statements or events or conditions: ""rain was a logical expectation, given the time of year""",2234
192506,01875788,a,10,"based on sound reasoning or evidence: ""a reasonable argument""; ""well-founded suspicions""",2234
192509,01876300,a,10,"not marked by the use of reason: ""mindless violence""; ""reasonless hostility""; ""a senseless act""",2234
192512,01877135,a,10,"of or relating to or having the nature of retribution: ""retributive justice demands an eye for an eye""",
192507,01875945,a,10,not reasonable; not showing good judgment,2234
192516,01877763,a,10,"inversely related: ""1/2 is the inverse of 2""",
192517,01877861,a,10,"experienced or expressed by each toward the other: ""mutual trust""; ""a mutual defense treaty""",1753
192514,01877498,a,10,"(grammar) indicating a reciprocal or complementary relation; ""correlative conjunctions""",1974
192520,01878216,a,10,"returned in kind: ""requited love""",
192521,01878304,a,10,"of or relating to retaliation: ""a retaliatory attack""",
192472,01868141,a,10,"existing in fancy only: ""fantastic figures with bulbous heads the circumference of a bushel""-Nathaniel Hawthorne",
192462,01865550,a,10,"of the nature of fact; having actual existence: ""rocks and trees...the actual world""; ""actual heroism""; ""the actual things that produced the emotion you experienced""",
192530,01879921,a,10,used facetiously,
192531,01879989,a,10,affectedly dainty or refined,
192536,01880673,a,10,excessively delicate or refined,
192537,01880774,a,10,of good upbringing,
192540,01881454,a,10,(of persons) lacking art or knowledge,2516
192543,01882256,a,10,(of persons) so unrefined as to be lacking in discrimination and sensibility,2516
192544,01882384,a,10,(of persons) lacking in refinement or grace,2516
192548,01882863,a,10,rude or uncouth in speech,
192549,01882947,a,10,not befitting a gentleman,
192550,01883050,a,10,lacking the behavior or manner or style considered proper for a lady,
192552,01883488,a,10,free from unwanted solid matter,
192553,01883575,a,10,"stored, processed, or analyzed by computer",
192554,01883676,a,10,"(used of rubber, e.g.) treated by a chemical or physical process to improve its properties (hardness and strength and odor and elasticity)","2097,2111"
192557,01884160,a,10,having been subjected to partial processing,
192561,01884850,a,10,not vulcanized,
192527,01879085,a,10,"(followed by ""to"") not reconciled; ""he remained unreconciled to the situation""",
192533,01880250,a,10,"developed with extreme delicacy and subtlety: ""the satire touches with finespun ridicule every kind of human pretense""",
192534,01880434,a,10,"befitting a man of good breeding: ""gentlemanly behavior""",
192542,01881881,a,10,"lacking refinement or cultivation or taste: ""he had coarse manners but a first-rate mind""; ""behavior that branded him as common""; ""an untutored and uncouth human being""; ""an uncouth soldier--a real tough guy""; ""appealing to the vulgar taste for violence""; ""the vulgar display of the newly rich""",
192556,01884027,a,10,"treated, coated, or impregnated with rubber: ""rubberized cloth""",
192545,01882535,a,10,"unrefined in character: ""low comedy""",
192546,01882621,a,10,"rough and crude: ""a robust tale""",
192551,01883175,a,10,"prepared or converted from a natural state by subjecting to a special process: ""processed ores""",
192558,01884264,a,10,"not altered from an original or natural state: ""unprocessed commodities""",
192555,01883879,a,10,"(of grains especially rice) having the husk or outer layers removed; ""polished rice""",
192560,01884712,a,10,"not processed by putting through a strainer: ""unstrained home-style orange juice""",
192565,01885595,a,10,(of sewage) treated with aeration and bacteria to aid decomposition,"2097,2111"
192563,01885093,a,10,"not refined or processed: ""unrefined ore""; ""crude oil""",
192567,01885853,a,10,"treated by heating to a high temperature but below the melting or fusing point: ""burnt sienna""","2097,2111"
192570,01886230,a,10,"treated so as to become resistant: ""rust-proofed automobiles""; ""shrink-proofed fabrics""","2097,2111,2401"
192571,01886371,a,10,"not subjected to chemical or physical treatment: ""an untreated fabric""","2097,2111"
192569,01886107,a,10,"(of wood) darkened or colored by exposure to ammonia fumes; ""fumed oak""","2097,2111"
192572,01886533,a,10,"not processed or refined: ""raw sewage""","2097,2111"
192573,01886621,a,10,"treated with oil: ""oiled country roads""; ""an oiled walnut table""",
192575,01886862,a,10,"given medical care or treatment: ""a treated cold is usually gone in 14 days; if left untreated it lasts two weeks""",
192577,01887260,a,10,"treated with some kind of application: ""a mustache dosed with bear grease""",
192579,01887488,a,10,"not given medical care or treatment: ""an untreated disease""; ""the untreated wounded lay on makeshift cots""",
192581,01887819,a,10,"recoverable upon payment or fulfilling a condition: ""redeemable goods in a pawnshop",1753
192582,01887959,a,10,"capable of being regained especially with effort: ""he believed the information was retrievable""",
192585,01888430,a,10,"impossible to recover or recoup or overcome: ""an irretrievable loss""; ""irretrievable errors in judgment""",
192586,01888610,a,10,"incapable of being recovered or regained: ""his lost honor""",
192588,01888932,a,10,"spiritually reborn or converted: ""a born-again Christian""; ""a converted sinner""",
192562,01884923,a,10,"freed from impurities by processing: ""refined sugar""; ""refined oil""; ""to gild refined gold""-Shakespeare",
192538,01880864,a,10,"used of persons and their behavior; not refined; uncouth: ""how can a refined girl be drawn to such an unrefined man?""",
192566,01885718,a,10,(of a liquid) treated by having air passed or bubbled through it for purification,"2097,2111"
192568,01886008,a,10,treated or impregnated with a foreign substance,"2097,2111"
192578,01887386,a,10,treated with medications and protective covering,
192583,01888112,a,10,incapable of being recovered or regained,
192526,01878963,a,10,"(followed by ""to"") having come to accept; ""resigned to his fate""",
192591,01889480,a,10,stubbornly persistent in wrongdoing,
192592,01889605,a,10,impervious to moral persuasion,
192593,01889692,a,10,not converted,
192609,01892566,a,10,according to custom or rule or natural law,2234
192611,01892827,a,10,made regular,2234
192616,01893376,a,10,(grammar) used of verbs having standard (or regular) inflection,1974
192624,01894803,a,10,set up or distributed in a deliberately random way,2234
192626,01895050,a,10,used of merchandise,2234
192628,01895327,a,10,regulated by a thermostat,
192634,01896147,a,10,that is able or fit be rented,
192637,01896541,a,10,capable of being maintained,
192648,01898218,a,10,having the same vowel sound occurring with different consonants in successive words or stressed syllables,
192649,01898378,a,10,rhymed on the terminal syllables of the verses,
192596,01890280,a,10,"officially entered in a roll or list: ""an enrolled student""",
192653,01898965,a,10,"occurring in or having many forms or shapes or appearances: ""the multiform universe of nature and man""-John Dewey",
192598,01890550,a,10,"not registered: ""an unregistered citizen""",
192599,01890668,a,10,"not having your name entered on a voting list: ""an unlisted voter""",
192602,01891147,a,10,"made a matter of official record: ""a properly recorded deed to the property""",
192600,01890789,a,10,"(of animals) officially recorded with or certified by a recognized breed association; especially in a stud book; ""a registered Percheron""",2188
192603,01891296,a,10,"entered in a record: ""he claims to have graduated from Harvard but his name is not on the books""",
192604,01891451,a,10,"not made a matter of official record: ""an unrecorded deed""",
192606,01891762,a,10,"in accordance with fixed order or procedure or principle: ""his regular calls on his customers""; ""regular meals""; ""regular duties""",2234
192612,01892897,a,10,"occurring at fixed times or predictable intervals: ""made her routine trip to the store""",2234
192608,01892470,a,10,of members of a team; not substitutes,2234
192623,01894606,a,10,"not conforming to legality, moral law, or social convention: ""an irregular marriage""; ""improper banking practices""",2234
192613,01893038,a,10,"regularly and widely used or sold: ""a standard size""; ""a stock item""",2234
192614,01893169,a,10,"regularly spaced in time: ""closely timed intervals""",2234
192615,01893272,a,10,"evenly spaced: ""at regular (or uniform) intervals""",2234
192617,01893490,a,10,"ordered well: ""well-ordered work habits""",2234
192619,01893999,a,10,"not having a steady rhythm: ""an arrhythmic heartbeat""",2234
192620,01894138,a,10,"irregular in shape or outline: ""asymmetrical features""; ""a dress with an crooked hemline""",2234
192622,01894506,a,10,"taken or to be taken at random: ""grab samples""",2234
192630,01895550,a,10,"possible to remedy: ""remediable problems""; ""a remediable setback""; ""not a crime but only a remediable blunder""",
192629,01895411,a,10,"not regulated; not subject to rule or discipline: ""unregulated off-shore fishing""",
192625,01894910,a,10,"(grammar) of verbs not having standard (or regular) inflection; """"go"" is a strong verb""",1974
192638,01896627,a,10,"impossible to repair, rectify, or amend: ""irreparable harm""; ""an irreparable mistake""; ""irreparable damages""",
192632,01895880,a,10,"that can be renewed or extended: ""a renewable lease""; ""renewable subscriptions""",
192633,01896015,a,10,"that can not be renewed: ""books on that shelf are renewable",
192635,01896231,a,10,"not able or fit to be rented: ""the house was unrentable in that condition""",
192640,01897013,a,10,"not able or fit to be repeated or quoted: ""what he said was funny but unquotable""",
192641,01897184,a,10,"fit for publication because free of material that is morally or legally objectionable: ""printable language""",
192643,01897538,a,10,"asked for: ""the requested aid is forthcoming""",
192644,01897639,a,10,"not requested: ""the merchandise was unrequested""",
192645,01897763,a,10,"not asked for: ""unasked advice""",
192646,01897848,a,10,"having corresponding sounds especially terminal sounds: ""rhymed verse""; ""rhyming words""",
192647,01898069,a,10,"having the same consonant at the beginning of each stressed syllable: ""alliterative verse""",
192650,01898481,a,10,"not having rhyme: ""writing unrhymed blank verse is like playing tennis without a net""",
192652,01898852,a,10,"having uniform application: ""a single legal code for all""",
192610,01892687,a,10,"conforming to set usage, procedure, or discipline: ""in prescribed order""",2234
192594,01889777,a,10,"listed or recorded officially: ""record is made of ""registered mail"" at each point on its route to assure safe delivery""; ""registered bonds""",
192597,01890403,a,10,"(of securities) having the owner's name entered in a register; ""recorded holders of a stock""",1769
192655,01899335,a,10,happening or recurring at regular intervals,
192656,01899518,a,10,marked by repeated cycles,
192657,01899596,a,10,stopping and starting at regular intervals,
192658,01899697,a,10,having periodic vibrations,
192660,01899986,a,10,not recurring at regular intervals,
192661,01900126,a,10,not having repeated cycles,
192662,01900208,a,10,not having periodic vibrations,
192666,01900739,a,10,"connected by kinship, common origin, or marriage",
192667,01900985,a,10,related by marriage,
192669,01901182,a,10,related by blood,
192673,01901681,a,10,not connected by kinship,
192674,01901779,a,10,not connected by birth or family,
192684,01903869,a,10,mutually related,
192690,01904822,a,10,not connected or associated,
192691,01904959,a,10,having had the relation broken,
192692,01905061,a,10,mistakenly related,
192670,01901318,a,10,"related by common characteristics or ancestry: ""allied species""; ""allied studies""",
192671,01901452,a,10,"related on the mother's side; ""my maternal grandmother""",
192705,01907468,a,10,"serving to bring to mind: ""cannot forbear to close on this redolent literary note""-Wilder Hobson; ""a campaign redolent of machine politics""",1502
192672,01901582,a,10,"related by blood or marriage: ""kindred clans""",
192676,01902400,a,10,"following as a consequence: ""an excessive growth of bureaucracy, with related problems""; ""snags incidental to the changeover in management""",
192678,01902856,a,10,"associated with or accompanying: ""Christmas and associated festivities""",
192679,01902996,a,10,"closely or inseparably connected or associated with: ""his career is bound up with the fortunes of the enterprise""",
192681,01903287,a,10,"related in nature: ""connate qualities""",
192685,01903968,a,10,"accompanying: ""all rights carry with them corresponding responsibilities""",
192682,01903389,a,10,"in relation (or in regard) to; especially as in the phrases; ""as far as x is concerned""; ""where x is concerned""",
192686,01904101,a,10,"being associated as a companion or associate: ""fellow traveler""; ""brother workers""; ""sister ship""",
192688,01904468,a,10,"related by having something in common with or coinciding with: ""having overlapping duties""; ""found unexpected overlapping areas of interest""",
192696,01905657,a,10,"now in consideration or under discussion: ""regarding the matter in hand""",
192703,01907044,a,10,"bearing in mind; attentive to: ""ever mindful of her health""; ""mindful of his responsibilities""; ""mindful of these criticisms, I shall attempt to justify my action""",1502
192697,01905858,a,10,"having close kinship and appropriateness: ""he asks questions that are germane and central to the issue""",
192699,01906243,a,10,"having no bearing on or connection with the subject at issue: ""an irrelevant comment""; ""irrelevant allegations""",
192700,01906465,a,10,"of superficial relevance if any: ""a digressive allusion to the day of the week""; ""a tangential remark",
192702,01906906,a,10,"not capable of being applied: ""rules inapplicable to day students""",
192709,01908159,a,10,"capable of replacing or changing places with something else: ""interchangeable parts""",
192664,01900466,a,10,"permanent: ""a standing army""",1781
192693,01905136,a,10,not varying together,
192710,01908345,a,10,"impossible to replace: ""irreplaceable antiques""",
192711,01908486,a,10,"used especially of art: ""representational art""; ""representational images""",2425
192715,01909135,a,10,"characterized by or of the nature of or using mimesis: ""a mimetic dance""; ""the mimetic presentation of images""",2425
192717,01909528,a,10,"emphasizing or expressing things as perceived without distortion of personal feelings or interpretation: ""objective art""",2425
192719,01909899,a,10,"not representing or imitating external reality or the objects of nature: ""a large abstract painting""",2425
192695,01905507,a,10,"capable of being applied; having relevance: ""gave applicable examples to support her argument",
192721,01910236,a,10,"(fine arts) characterized by simple geometric forms in design and decoration; ""a buffalo hide painted with red and black geometric designs""",2425
192668,01901058,a,10,"related on the father's side; ""a paternal aunt""",
192707,01907936,a,10,suffering from a partial loss of memory,1502
192708,01908040,a,10,capable of being replaced,
192712,01908730,a,10,depicted in a recognizable manner,2425
192713,01908833,a,10,of visual imagery of almost photographic accuracy,2425
192718,01909704,a,10,art,2425
192720,01910102,a,10,(fine arts) represented in simplified or symbolic form,2425
192663,01900299,a,10,"(used of the military) belonging to or engaged in by legitimate army forces; ""the regular army""",1781
192723,01910643,a,10,characteristic of the earliest phase of geometric art especially in Greece,2425
192724,01910778,a,10,characterized by stylized but recognizable subject matter,2425
192728,01911535,a,10,not standing for something else,
192733,01912391,a,10,lacking respectability in character or behavior or appearance,1675
192739,01913718,a,10,not worthy of respect,1675
192740,01913799,a,10,accorded no respect,1675
192745,01914528,a,10,not receptive,
192748,01914922,a,10,capable of being made harmonious or consistent,
192758,01916477,a,10,set aside for the use of a particular person or party,
192759,01916639,a,10,reserved in advance,
192761,01916859,a,10,reserved for an eleite group,
192762,01916953,a,10,not reserved,
192763,01917058,a,10,not accepting reservations,
192764,01917163,a,10,not reserved in advance,
192784,01920887,a,10,uncertain in purpose or action,
192791,01921793,a,10,unworthy of respect,
192755,01916045,a,10,"showing modest reserve: ""she was diffident when offering a comment on the professor's lecture""",
192734,01912691,a,10,"tending to bring discredit or disrepute; blameworthy: ""his marks were not at all discreditable""",1675
192736,01913005,a,10,"having an exceedingly bad reputation: ""a notorious gangster""; ""the tenderloin district was notorious for vice""",1675
192737,01913194,a,10,"of questionable taste or morality: ""a louche nightclub""; ""a louche painting""",1675
192741,01913876,a,10,"ready or willing to receive favorably: ""receptive to the proposals""",
192742,01914053,a,10,"accepting willingly: ""acceptive of every new idea""; ""an acceptant type of mind""",
192746,01914617,a,10,"not having an open mind: ""a closed mind unreceptive to new ideas""",
192744,01914346,a,10,"(""hospitable"" is usually followed by ""to"") having an open mind; ""hospitable to new ideas""; ""open to suggestions""",
192747,01914751,a,10,"capable of being reconciled: ""her way of thinking is reconcilable with mine""",
192750,01915194,a,10,"impossible to reconcile: ""irreconcilable differences""",
192751,01915361,a,10,"impossible to bring into friendly accord: ""hostile factions""",
