190588,01549354,a,10,having a nose (either literal or metaphoric) especially of a specified kind,
190589,01549517,a,10,having an aquiline nose,
190591,01549755,a,10,having no nose,
190599,01550965,a,10,not perceived or commented on,
190606,01552132,a,10,not noticed,
190607,01552221,a,10,having been learned or found or determined especially by investigation,
190612,01553203,a,10,exceedingly harmful,
190614,01553503,a,10,causing blisters,
190615,01553587,a,10,not injurious to physical or mental health,
190616,01553768,a,10,having no adverse effect,
190626,01555961,a,10,habitually disposed to disobedience and opposition,1502
190629,01556469,a,10,noticeable in an unpleasant way,
190638,01557909,a,10,particular to a given individual,
190640,01558102,a,10,(of e.g. evidence) not objective or easily verified,
190642,01558568,a,10,under a moral obligation to someone,
190645,01558954,a,10,under a moral obligation to do something,
190586,01549077,a,10,"used to signify the Confederate forces in the Civil War (who wore gray uniforms); ""a stalwart gray figure""","1820,2768,2772"
190590,01549597,a,10,"having a blunt nose: ""a pug-nosed boy with freckles""; ""a snub-nosed automatic""",
190592,01549824,a,10,"being perceived or observed: ""an easily noticed effect on the rate of growth""",
190593,01549973,a,10,"perceived with the mind: ""he winced at the detected flicker of irony in her voice""",
190595,01550329,a,10,"not noticed inadvertently: ""her aching muscles forgotten she danced all night""; ""he was scolded for his forgotten chores""",
190597,01550712,a,10,"not taken into account: ""his retirement was not allowed to go unmarked""",
190598,01550861,a,10,"not observed: ""managed to slip away unobserved""",
190601,01551237,a,10,"detected by means of the senses: ""a perceived difference in temperature""",
190603,01551633,a,10,"detected or perceived by the sense of hearing: ""a conversation heard through the wall""",
190604,01551771,a,10,"not perceived or discerned: ""they feared some undetected trace of poison""; ""she looked around to be sure her faux pas was undetected""",
190605,01551997,a,10,"not discovered: ""with earth-based telescopes many stars remain undiscovered""",
190609,01552685,a,10,"not yet having been ascertained or determined: ""of undetermined species""",
190610,01552834,a,10,"not explained: ""accomplished by some unexplained process""",
190613,01553310,a,10,"harmful to the mind or morals: ""corrupt judges and their corrupting influence""; ""the vicious and degrading cult of violence""",
190617,01553848,a,10,"not offensive: ""an inoffensive level""",
190618,01553961,a,10,"lacking significance or impact: ""an insipid novel""",
190622,01554984,a,10,"willingly obedient out of a sense of duty and respect: ""a dutiful child""; ""a dutiful citizen""; ""Patient Griselda was a chaste and duteous wife"";",1502
190624,01555533,a,10,"resistant to guidance or discipline: ""Mary Mary quite contrary""; ""an obstinate child with a violent temper""; ""a perverse mood""; ""wayward behavior""",1502
190628,01556277,a,10,"undesirably noticeable: ""the obtrusive behavior of a spoiled child""; ""equally obtrusive was the graffiti""",
190631,01556732,a,10,"not blatant or overly aggressive in manner or appearance: ""a retiring disposition""",
190585,01548926,a,10,"of or having to do with the southern Confederacy during the Civil War: ""Confederate soldiers""","1820,2768,2772"
190634,01557310,a,10,"disinterested or dispassionate: ""made a cool appraisal of all the issues in the dispute""",
190635,01557449,a,10,"having no personal preference: ""impersonal criticism""; ""a neutral observer""",
190637,01557713,a,10,"taking place within the mind and modified by individual bias: ""a subjective judgment""",
190646,01559067,a,10,owing gratitude or recognition to another for help or favors etc,
190627,01556111,a,10,"refusing to submit to authority: ""the recusant electors...cooperated in electing a new Senate""-Mary W.Williams",1502
190643,01558661,a,10,"being under moral or legal obligation: ""felt bound by his promise""",
190644,01558822,a,10,"required or ordered to: ""felt called upon to do his duty""",
190632,01556883,a,10,"undistorted by emotion or personal bias; based on observable phenomena: ""an objective appraisal""; ""objective evidence""",
190639,01557996,a,10,emanating from a person's emotions and prejudices,
190647,01559189,a,10,under a legal obligation to someone,
190587,01549241,a,10,"used by northerners of Confederate soldiers: ""the rebel yell""","1820,2768,2772"
190649,01559437,a,10,not obligated,
190650,01559544,a,10,free of moral obligation,
190659,01561258,a,10,needing no explanation,
190674,01563843,a,10,affected with or obstructed by a clot of coagulated blood,
190687,01565888,a,10,that has been withdrawn or retreated from,
190704,01569114,a,10,expressing offensive reproach,2234
190706,01569409,a,10,incapable of offending or attacking,2234
190708,01569800,a,10,designed to inflict death or personal injury rather than material destruction,
190710,01570059,a,10,disposed to attack,
190714,01570671,a,10,actively attacking,
190654,01560095,a,10,"easily perceived or understood: ""obvious errors""",2097
190653,01559910,a,10,"(biology) able to exist under more than one set of conditions; ""a facultative parasite can exist as a parasite or a saprophyte""",2158
190656,01560732,a,10,"evident without proof or argument: ""an axiomatic truth""; ""we hold these truths to be self-evident""",
190661,01561516,a,10,"in plain view or directly in from of one: ""the keys were right under his nose""",
190669,01563078,a,10,"stopped up; clogged up: ""clogged pipes""; ""clogged up freeways""; ""streets choked with traffic""",
190660,01561343,a,10,"easily understood or seen through (because of a lack of subtlety); ""a transparent explanation""; ""a transparent lie""",
190662,01561743,a,10,"made more obvious or prominent: ""the effect of...his irregular life could be seen writ large on his gaunt features""",
190664,01562149,a,10,"not readily apparent: ""the answer was at first unapparent""",
190665,01562264,a,10,"not provable: ""it was both unproved and unprovable""",
190667,01562738,a,10,"preventing entry or exit or a course of action: ""a barricaded street""; ""barred doors""; ""the blockaded harbor""",
190668,01562925,a,10,"completely obstructed or closed off: ""the storm was responsible for many blocked roads and bridges""",
190671,01563490,a,10,"made difficult or slow: ""we blamed our impeded progress on lack of money""",
190693,01567385,a,10,"grossly offensive to decency or morality; causing horror: ""subjected to outrageous cruelty""; ""a hideous pattern of injustice""; ""horrific conditions in the mining industry""",2234
190672,01563617,a,10,"closed off: ""an occluded artery""",
190676,01564142,a,10,"affording free passage or view: ""a clear view""; ""a clear path to victory""; ""a free lane""",
190673,01563704,a,10,"(of a nose) blocked; ""a stopped (or stopped-up) nose""",
190677,01564296,a,10,"not slowed or prevented: ""a time of unimpeded growth""; ""an unimpeded sweep of meadows and hills afforded a peaceful setting""",
190679,01564575,a,10,"held or filled or in use: ""she keeps her time well occupied""; ""the wc is occupied""",
190682,01565206,a,10,"not held or filled or in use: ""an unoccupied telephone booth""; ""unoccupied hours""",
190681,01565114,a,10,"(of time) taken up; ""well-filled hours""",1463
190683,01565380,a,10,"not occupied or in use: ""a free locker""",
190684,01565470,a,10,"not taken up by scheduled activities: ""a free hour between classes""; ""spare time on my hands""",
190685,01565622,a,10,"seized and controlled as by military invasion: ""the occupied countries of Europe""",
190686,01565758,a,10,"not seized and controlled: ""unoccupied areas of France""",
190696,01567894,a,10,"dirty and disgusting: ""worry about the gossip and secretiveness and other scrimy sides""-Al Hine",2234
190692,01567263,a,10,"suggesting the horror of death and decay: ""morbid details""",2234
190695,01567795,a,10,"very offensive in smell or taste: ""a rank cigar""",2234
190700,01568528,a,10,"morally respectable or inoffensive: ""a past that was scarcely savory""",
190651,01559628,a,10,"having debts paid up: ""an unindebted man, at last""",
190697,01568043,a,10,of the nature of vermin; very offensive or repulsive,2234
190701,01568674,a,10,"morally offensive: ""an unsavory reputation""; ""an unsavory scandal""",
190702,01568837,a,10,"morally offensive: ""odoriferous legislation""",
190703,01568939,a,10,"causing anger or annoyance: ""offensive remarks""",2234
190705,01569247,a,10,"not causing anger or annoyance: ""inoffensive behavior""",2234
190709,01569937,a,10,"used in an attack: ""assault weapons"", ""attack planes""",
190711,01570149,a,10,"designed for or consisting of a brief attack followed by a quick escape: ""hit-and-run units""; ""tip-and-run assaults""",
190712,01570337,a,10,"involving invasion or aggressive attack: ""invasive war""",
190715,01570755,a,10,"intended or appropriate for defending against or deterring aggression or attack: ""defensive weapons""; ""a defensive stance""",
190658,01561162,a,10,"clearly manifest; evident: ""frank enjoyment""",
190716,01571041,a,10,designed for defense from a surface position against air attack,
190717,01571163,a,10,defensive against enemy submarines,
190718,01571257,a,10,designed for defense against armored vehicles,
190719,01571357,a,10,(games or sports) attempting to or designed to prevent an opponent from winning or scoring,"2633,2638"
190720,01571503,a,10,(fencing) in a defensive stance,2642
190726,01572491,a,10,feeling regret for a fault or offence,
190727,01572583,a,10,attempting to justify or defend in speech or writing,
190728,01572736,a,10,conscious of your own shortcomings,
190735,01573850,a,10,having some official authority or sanction,
190750,01576723,a,10,established as if settled into a groove or rut,
190753,01577158,a,10,(of a church) given official status as a national or state institution,1565
190761,01578276,a,10,used in unloading or removing e.g. cargo,
190766,01578971,a,10,situated or taking place on the area of a stage visible to the audience,
190724,01572177,a,10,"not offending: ""an unoffending motorist should not have been stopped""",
190729,01572833,a,10,"unwilling to make or express an apology: ""an unapologetic believer""",
190730,01572959,a,10,"having official authority or sanction: ""official permission""; ""an official representative""",
190732,01573379,a,10,"by virtue of an office or position: ""the head of the department serves as an ex officio member of the board""",
190737,01574240,a,10,"performed speedily and without formality: ""a summary execution""; ""summary justice""",
190734,01573689,a,10,given formal standing or endorsement; made official or legitimate by the observance of proper procedures,
190738,01574387,a,10,"not officially recognized or controlled: ""an informal agreement""; ""a loose organization of the local farmers""",
190739,01574559,a,10,"without official authorization: ""an unauthorized strike""; ""wildcat work stoppage""",
190740,01574709,a,10,"without explicit official permission: ""unsanctioned use of company cars""",
190742,01575081,a,10,"verified officially: ""the election returns are now official""",
190743,01575196,a,10,"not finally established or settled: ""an unconfirmed letter of credit""; ""unconfirmed rumors""",
190744,01575363,a,10,"not officially established: ""the early election returns are unofficial""",
190746,01576017,a,10,"widely or permanently accepted: ""an accepted precedent""",
190747,01576127,a,10,"caused to exist: ""he applauded the good will brought about in the neighborhood""",
190749,01576595,a,10,"established firmly and securely: ""the entrenched power of the nobility""",
190751,01576838,a,10,"made a norm or custom or habit: ""his habitual practice was to eat an early supper""; ""her habitual neatness""",
190754,01577283,a,10,"provided with a secure reputation: ""a recognized authority""",
190756,01577529,a,10,"not established: ""a reputation as yet unestablished""",
190723,01571950,a,10,"violating or tending to violate or offend against: ""violative of the principles of liberty""; ""considered such depravity offensive against all laws of humanity""",
190757,01577659,a,10,"not having a secure reputation: ""short stories by unrecognized writiers""",
190759,01577936,a,10,"not established by conditioning or learning: ""an unconditioned reflex""",1502
190763,01578501,a,10,"at the scene of action: ""an on-the-spot reporter""; ""on-the-spot inspections""; ""an on-the scene newscast""",
190760,01578087,a,10,"designed for use in loading e.g. cargo; ""a loading dock""; ""a loading chute is used to drive cattle into a truck or other conveyance""",
190765,01578822,a,10,"situated or taking place in the area of a stage not visible to the audience: ""offstage noises""",
190767,01579096,a,10,"not on the streets: ""off-street parking""; ""off-street unloading of vehicles""",
190768,01579229,a,10,"at the sides of streets: ""on-street parking is prohibited at rush hour""",
190771,01580126,a,10,"so extremely old as seeming to belong to an earlier period: ""a ramshackle antediluvian tenement""; ""antediluvian ideas""; ""archaic laws""",2234
190772,01580342,a,10,"made in or typical of earlier times and valued for its age: ""the an ""beautiful antique French furniture""",2234
190773,01580500,a,10,"a Scottish word: ""auld lang syne""",2234
190776,01580848,a,10,"ancient: ""hoary jokes""",2234
190777,01580930,a,10,"long past; beyond the limits of memory or tradition or recorded history: ""time immemorial""",2234
190779,01581218,a,10,"of long duration: ""a longtime friend""",2234
190780,01581313,a,10,"mended usually clumsily by covering a hole with a patch: ""patched jeans""",2234
190781,01581439,a,10,"previously used or owned by another: ""bought a secondhand (or used) car""",2234
190782,01581575,a,10,"of a declining industry or technology: ""sunset industries""",2234
190774,01580584,a,10,"no longer new; uninteresting: ""cold (or stale) news""",2234
190791,01583317,a,10,of or characteristic of a parvenu,2234
190802,01585591,a,10,growing old,2234
190804,01585759,a,10,of or like a feeble old woman,2234
190805,01585840,a,10,being at least 100 years old,2234
190810,01586787,a,10,being roughly between 45 and 65 years old,2234
190812,01587026,a,10,being from 80 to 89 years old,2234
190813,01587114,a,10,somewhat elderly,2234
190829,01589585,a,10,characteristic of a puppy,2234
190831,01589805,a,10,somewhat young,2234
190837,01590669,a,10,"stored in, controlled by, or in direct communication with a central computer",1355
190788,01582842,a,10,"having just or recently arisen or come into existence: ""new nations""; ""with newborn fears""",2234
190786,01582587,a,10,"(of a cycle) beginning or occurring again; ""a fresh start""; ""fresh ideas""",2234
190790,01583181,a,10,"pleasantly novel or different: ""common sense of a most refreshing sort""",2234
190792,01583415,a,10,"being new in a time not long past: ""recent graduates""; ""a recent addition to the house""; ""recent buds on the apple trees""",2234
190794,01583757,a,10,"newly come into prominence: ""a rising young politician""",2234
190797,01584174,a,10,"not yet put into use: ""we boughtt an unused car for a change""",2234
190809,01586508,a,10,"showing characteristics of age, especially having gray or white hair: ""whose beard with age is hoar""-Coleridge; ""nodded his hoary head""",2234
190798,01584288,a,10,"being used or worked for the first time: ""virgin wool""",2234
190803,01585675,a,10,"very old: ""an ancient mariner""",2234
190801,01585423,a,10,"having attained a specific age; (""aged"" is pronounced as one syllable); ""aged ten""; ""ten years of age""",2234
190807,01586070,a,10,"mentally or physically infirm with age: ""his mother was doddering and frail""",2234
190811,01586886,a,10,"being from 90 to 99 years old: ""the nonagenarian inhabitants of the nursing home""",2234
190815,01587378,a,10,"discharged as too old for use or work; especially with a pension: ""a superannuated civil servant""",2234
190817,01587675,a,10,"impressive by reason of age: ""a venerable sage with white hair and beard""",2234
190785,01582417,a,10,"conspicuously new: ""shiny brand-new shoes""; ""a spick-and-span novelty""",2234
190819,01588301,a,10,"being of the age 13 through 19: ""teenage mothers""; ""the teen years""",2234
190820,01588453,a,10,"being or befitting or characteristic of an infant: ""baby rabbits""",2234
190821,01588596,a,10,"befitting or characteristic of a young boy: ""a boyish grin""; ""schoolboyish pranks""",2234
190822,01588756,a,10,"befitting a young child: ""childlike charm""",2234
190823,01588864,a,10,"very young: ""at an early age""",2234
190824,01588945,a,10,"susceptible to alteration by development and experience: ""formative years""",2234
190826,01589250,a,10,"including or intended for youthful persons: ""a junior sports league""; ""junior fashions""",2234
190827,01589390,a,10,"very young: ""a little child""; ""small children""",2234
190828,01589497,a,10,"recently borne: ""a newborn infant""",2234
190830,01589677,a,10,"susceptible to physical or emotional injury: ""at a tender age""",2234
190841,01591249,a,10,"in operation or operational: ""left the oven on""; ""the switch is in the on position""",
190832,01589874,a,10,suggestive of youth; vigorous and fresh,2234
190834,01590138,a,10,"(of clothing) made in or consisting of two parts or pieces; ""a two-piece swimsuit""",2875
190835,01590294,a,10,"(of clothing) made in or consisting of three parts or pieces; ""the standard three-piece business suit; jacket and trousers and vest""",2875
190838,01590822,a,10,"(computer sci) not connected to a computer network; ""off-line resources""",1355
190839,01590949,a,10,"(transportation) on a regular route of a railroad or bus or airline system; ""on-line industries""",1946
190840,01591099,a,10,"(transportation) not on a regular route of a transportation system; ""an off-line ticket office""",1946
190842,01591399,a,10,"plugged in: ""first check to see whether the appliance is connected""",
190844,01591662,a,10,"not plugged in or connected to a power source: ""the iron is disconnected""",
190814,01587183,a,10,"too old to be useful: ""He left the house...for the support of twelve superannuated wool carders""-Anthony Trollope",2234
190845,01591794,a,10,"(of events) planned or scheduled; ""the picnic is on, rain or shine""; ""we have nothing on for Friday night""",
190847,01592068,a,10,"(of events) no longer planned or scheduled; ""the wedding is definitely off""",
190848,01592205,a,10,(sports) not offside; being within the prescribed area of play,2638
190795,01583865,a,10,"of an industry or technology; new and developing: ""high-technology sunrise industries""",2234
190874,01596322,a,10,(printing) having thin strips of lead between the lines of type,1422
190876,01596601,a,10,arranged without spaces between,
190877,01596705,a,10,(printing) not having leads between the lines,1422
190879,01597305,a,10,enclosed in a basin,
190884,01597895,a,10,(of an insect pupa) enclosed in a rigid case,2202
190885,01597995,a,10,enclosed by a confining fence,
190899,01600074,a,10,(music) used of string or hole or pipe of instruments,2536
190900,01600181,a,10,(music) used of string or hole or pipe of instruments,2536
190901,01600297,a,10,converted to leather by a tanning agent,
190908,01601466,a,10,(military) of or intended for or involved in military operations,1781
190911,01601998,a,10,not involved in military operations,1781
190912,01602112,a,10,not engaged in military action,1781
190852,01592841,a,10,"open wide: ""left the doors wide-open""",
190853,01592934,a,10,"not open: ""the door slammed shut""",
190855,01593287,a,10,"made open or clear: ""the newly opened road",
190859,01594009,a,10,"closed at one end: ""a blind alley""",
190856,01593382,a,10,"(of a container) having the stopper removed; ""whiskey spilled from the unstoppered bottle""",
190861,01594230,a,10,"having the curtains or draperies closed or pulled shut: ""the drawn draperies kept direct sunlight from fading the rug""",
190863,01594537,a,10,"used of mouth or eyes: ""keep your eyes open""; ""his mouth slightly opened""",
190864,01594742,a,10,"with the mouth wide open as in wonder or awe: ""the gaping audience""; ""we stood there agape with wonder""; ""with mouth agape""",
190867,01595219,a,10,"with the mouth wide open indicating boredom or sleepiness: ""a yawning congregation""",
190868,01595356,a,10,"used especially of mouth or eyes: ""he sat quietly with closed eyes""; ""his eyes were shut against the sunlight""",
190865,01594929,a,10,"(used of eyes) open and fixed as if in fear or wonder; ""staring eyes""",
190870,01595731,a,10,"pressed tightly together: ""with lips compressed""",
190871,01595844,a,10,"having eyes half closed in order to see better: ""squinched eyes""",
190878,01596805,a,10,"closed in or surrounded or included within: ""an enclosed porch""; ""an enclosed yard""; ""the enclosed check is to cover shipping and handling""",
190881,01597482,a,10,"enclosed in or as if in a box: ""boxed cigars""; ""a confining boxed-in space""; ""felt boxed in by the traffic""",
190875,01596438,a,10,"(of type or print) not having a blank space between lines; ""business letters are usually single-spaced""",1422
190887,01598328,a,10,"enclosed or sheltered in or as if in a bower: ""a house embowered with wysteria""",
190888,01598463,a,10,"enclosed within a circle: ""the encircled camp was complete cut off""",
190882,01597669,a,10,(botany; of seeds or spores) enclosed in a capsule,2172
190889,01598586,a,10,"completely enclosed or swallowed up: ""a house engulfed in flames""; ""the fog-enveloped cliffs""; ""a view swallowed by night""",
190891,01598968,a,10,"so enveloped in fog that it is not safe to move about: ""a fogbound fleet""; ""the fogbound city""",
190892,01599117,a,10,"enclosed in the same envelope or package: ""the included check""",
190893,01599234,a,10,"enveloped: ""a castle involved in mist""; ""the difficulties in which the question is involved""",
190895,01599514,a,10,"confined on all sides: ""a camp surrounded by enemies""; ""the encircled pioneers""",
190897,01599844,a,10,"having no protecting cover or enclosure: ""an open boat""; ""an open fire""; ""open sports cars""",
190898,01599986,a,10,"not fenced in: ""unfenced pasture""",
190902,01600389,a,10,"not converted to leather by a tanning agent: ""a whip made of untanned hide""",
190904,01600704,a,10,"of a cask or barrel: ""the cask was set abroach""",
190905,01600816,a,10,"not subjected to tapping: ""an untapped keg; ""an untapped sugar maple""",
190914,01602469,a,10,"most suitable or right for a particular purpose: ""a good time to plant tomatoes""; ""the right time to act""; ""the time is ripe for great sociological changes""",
190916,01603004,a,10,"not opportune: ""arrived at a most inopportune hour""; ""an inopportune visit""",
190907,01601186,a,10,(mathematics) of a curve or surface; having no end points or boundary curves; of a set; having members that can be produced by a specific operation on other members of the same set; of an interval; containing both its endpoints,2873
190910,01601848,a,10,"(military) equipped and ready for service; ""the fort was held by about 100 effective soldiers""",1781
190917,01603191,a,10,"badly timed: ""an ill-timed intervention""; ""you think my intrusion unseasonable""; ""an untimely remark""; ""it was the wrong moment for a joke""",
190872,01595976,a,10,"arranged with spaces between; often used as a combining form: ""widely spaced eyes""",
190851,01592753,a,10,"slightly open: ""the door was ajar""",
190920,01603721,a,10,not opposable,
190927,01604909,a,10,(stock market) expecting a rise in prices,1769
190928,01605004,a,10,pleasantly (even unrealistically) optimistic,
190931,01605426,a,10,confidently optimistic and cheerful,
190932,01605516,a,10,expecting the worst in this worst of all possible worlds,
190933,01605702,a,10,(stock market) expecting prices to fall,1769
190939,01606701,a,10,(of radiate organisms) located on the surface or end on which the mouth is situated,2158
190940,01606838,a,10,(of radiate animals) located on the surface or end opposite to that on which the mouth is situated,2158
190945,01607897,a,10,disposed to loud disagreements and fighting,
190950,01608738,a,10,in alphabetical order,
190952,01608988,a,10,not arranged in order,
190959,01610405,a,10,lacking a visible order or organization,
190974,01612750,a,10,not organized and maintained as a legal coporation,
190922,01603948,a,10,"on bad terms: ""they were usually at odds over politics""; ""conflicting opinions""",
190923,01604098,a,10,"not having opposition or an opponent: ""unopposed military forces""; ""the candidate was unopposed""",
190926,01604600,a,10,"expecting the best in this best of all possible worlds: ""in an optimistic mood""; ""optimistic plans""; ""took an optimistic view""",
190929,01605127,a,10,"reflecting optimism: ""a rosy future""; ""looked at the world through rose-colored glasses""",
190930,01605281,a,10,"unrealistically or naively optimistic: ""a starry-eyed reformer""; ""starry-eyed idealism""",
190936,01606349,a,10,"toward the inside of the cheek: ""the buccal aspect of the gum""",2233
190937,01606475,a,10,"lying within the mouth: ""a buccal gland""",2233
190941,01606992,a,10,"devoid of violence or disruption: ""an orderly crowd confronted the president""",
190938,01606568,a,10,"(anatomy) opposite to or away from the mouth; ""the aboral surface of a starfish""",2233
190943,01607281,a,10,"undisciplined and unruly: ""disorderly youths""; ""disorderly conduct""",
