116709,02266510,n,10,a glove worn by batters in baseball to give a firmer grip on the bat,"2871,2875"
116710,02266656,n,10,a helmet worn by the batter in baseball,"2871,2875"
116711,02266774,n,10,a broadax used as a weapon,1781
116712,02266924,n,10,a cruiser of maximum speed and firepower,"1781,1942"
116713,02267025,n,10,a military uniform designed for field service,2875
116714,02267129,n,10,a flag that leads troops into battle,2425
116715,02267223,n,10,a rampart built around the top of a castle with regular gaps for firing arrows or guns,"1781,2446"
116716,02267414,n,10,large and heavily armoured,"1781,1942"
116717,02267547,n,10,an arrangement of sights that makes possible the rapid aiming of a firearm at short ranges,2102
116718,02267695,n,10,one of a pair of swinging doors (as at the entrance to a western saloon),2415
116721,02268139,n,10,a knife that can be fixed to the end of a rifle and used as a weapon,1781
116722,02268261,n,10,"a steel arch bridge connecting New Jersey and Staten Island at Bayonne, New Jersey","1946,2772"
116723,02268423,n,10,an aromatic liquid originally obtained by distilling the leaves of the bayberry tree with rum,2371
116724,02268570,n,10,a window that sticks out from the outside wall of a house,"2415,2446"
116725,02268715,n,10,a shop where a variety of goods are sold,"2446,2872"
116726,02268816,n,10,a street of small shops (especially in Orient),"2446,2872"
116727,02268923,n,10,a portable rocket launcher used by infantrymen as an anti-tank weapon,1781
116728,02269046,n,10,a small pellet fired from an air rifle or BB gun,1781
116729,02269153,n,10,battery for supplying a constant positive voltage to the plate of a vacuum tube,2284
116730,02269288,n,10,pellets are propelled by air pressure,1781
116732,02269475,n,10,a house built on or near a beach,2415
116675,02262010,n,10,a double-reed instrument; the tenor of the oboe family,2536
174798,00866366,v,10,cover with whitewash; as of walls,
174805,00867188,v,10,"cover the interior of, as of garments: :lined gloves""",
116750,02272039,n,10,a rein designed to keep the horse's head in the desired position,2188
116754,02272635,n,10,a spot worn on a lady's face for adornment,2875
116752,02272304,n,10,tall; worn by some British soldiers on ceremonial occasions,2875
116764,02274560,n,10,a heavy corded fabric similar to corduroy; used for clothing,1787
116791,02278492,n,10,trousers with legs that flare; worn by sailors; absurdly wide hems were fashionable in the 1960s,2875
116734,02269665,n,10,a car that has a long body and rear door with space behind rear seat,1946
116735,02269893,n,10,clothing to be worn at a beach,2875
116792,02278668,n,10,a small shelter for bells; has a gable or shed roof,
116748,02271708,n,10,an incised design resembling a bear's claw used in Native American pottery,2425
116736,02269979,n,10,a tower with a light that gives warning of shoals to passing ships,2446
116737,02270135,n,10,a small ball with a hole through the middle,2474
116738,02270247,n,10,a beaded molding for edging or decorating furniture,2446
116739,02270399,n,10,ornamentation with beads,2875
116740,02270488,n,10,a plane with a concave blade for making moulding with beadwork,"2415,2425"
116741,02270610,n,10,beads threaded on a string,
116742,02270742,n,10,usually without a handle,1957
116744,02270931,n,10,"long thick piece of wood or metal or concrete, etc., used in construction","2415,2446"
116745,02271325,n,10,a balance consisting of a lever with two equal arms and a pan suspended from each arm,1951
116749,02271838,n,10,placed between moving parts to allow them to move easily,2098
116751,02272174,n,10,any wall supporting a floor or the roof of a building,2415
116753,02272434,n,10,a musical instrument that sounds by means of a reed,2536
116755,02272735,n,10,a hat made of beaver fur or similar material,2875
116756,02272841,n,10,a movable piece of armor on a medieval helmet used to protect the lower face,"1781,2768,2875"
116757,02272989,n,10,a light wallboard made of compressed wood pulp,2415
116758,02273094,n,10,a mercury thermometer that measures small differences or changes in temperature,1951
116762,02274215,n,10,covering that are used on a bed,2875
116763,02274436,n,10,material used to provide a bed for animals,2338
116765,02274679,n,10,a lightweight jacket worn over bedclothes (as when sitting in bed),2875
116766,02274802,n,10,pejorative terms for an insane asylum,"1707,2232,2415"
116767,02275010,n,10,linen or cotton articles for a bed (as sheets and pillowcases),2353
116768,02275182,n,10,a shallow vessel used by a bedridden patient for defecation and urination,
116769,02275308,n,10,a soft pillow for use on a bed,2410
116770,02275395,n,10,any of 4 vertical supports at the corners of a bedstead,2410
116771,02275523,n,10,bedding rolled up for carrying,2875
116772,02275625,n,10,a room used primarily for sleeping,2415
116773,02275897,n,10,a furnished sitting room with sleeping accommodations (and some plumbing),"1707,2415"
116774,02276053,n,10,decorative cover for a bed,2875
116775,02276232,n,10,(usually plural) one of the springs holding up the mattress of a bed,2410
116776,02276393,n,10,the framework of a bed,2410
116777,02276576,n,10,a man-made receptacle that houses a swarm of bees,2415
116778,02276723,n,10,any workplace where people are very busy,
116779,02276817,n,10,a barrel that holds beer,
116780,02276910,n,10,a bottle that holds beer,
116781,02276992,n,10,a can that holds beer,
116782,02277068,n,10,a relatively large glass for serving beer,
116783,02277166,n,10,a mug intended for serving beer,2410
116784,02277260,n,10,a wood or metal bar to which a rope can be secured (as on a ship or in mountain climbing),"1946,2415,2638"
116785,02277408,n,10,a room (often at the top of a tower) where bells are hung,2415
116786,02277537,n,10,a hollow device made of metal that makes a ringing sound when struck,"2101,2446"
116787,02277910,n,10,the flared opening of a tubular device,"1781,1957,2536"
116788,02278056,n,10,an alkaloidal extract or tincture of the poisonous belladonna herb that is used medicinally,"2111,2248"
116789,02278204,n,10,a round arch resting on corbels,2446
116793,02278786,n,10,a floor under the bells of an open belfry,2415
116794,02278883,n,10,a foundry where bells are cast,"1787,1794"
116795,02278972,n,10,an extension of a gable that serves as a bell cote,2415
169582,00041370,v,10,"have fawns, of deer","2158,2188"
116747,02271581,n,10,a small skullcap; formerly worn by schoolboys and college freshmen,2875
174807,00867480,v,10,"cover the front or surface of: ""The building was faced with beautiful stones""",
116822,02282730,n,10,with no brim or bill; made of soft cloth,2875
116826,02283245,n,10,a bed on a ship or train; usually in tiers,2410
116838,02285136,n,10,a preparation of the leaves and flowers of the hemp plant; much used in India,2248
116840,02285383,n,10,top part; covering the chest,"1787,2875"
116851,02286791,n,10,"a coffin along with its stand: ""we followed the bier to the graveyard""",
116843,02285672,n,10,has two wheels; moved by foot pedals,1946
116841,02285480,n,10,"informal: ""her best bib and tucker""",2875
116796,02279079,n,10,a bell-shaped glass cover used to protect and display delicate objects or to cover scientific apparatus or to contain gases,2053
116855,02287295,n,10,a child's tight-fitting cap; often ties under the chin,2875
116797,02279270,n,10,a mechanical device that blows air onto a fire to make it burn more fiercely,2098
116799,02279539,n,10,a button that is pushed to ring a bell,2098
116800,02279633,n,10,a seat that has a bell shape (on some 18th century chairs),1948
116801,02279762,n,10,a bell-shaped tent,2772
116802,02279836,n,10,supports or shelters a bell,
116803,02279957,n,10,a strap around the belly of a draft animal holding the shafts of a wagon,
116804,02280085,n,10,a cloth band that is worn around the waist (as on infants until the navel has healed),2875
116805,02280226,n,10,a band to tie or buckle around the body (usually at the waist),2875
116806,02280467,n,10,endless loop of flexible material between two rotating shafts or pulleys,
116807,02280681,n,10,the buckle used to fasten a belt,2875
116808,02280809,n,10,the material of which belts are made,1787
116809,02280937,n,10,a gazebo sited to command a fine view,"2415,2446"
116810,02281030,n,10,a long seat for more than one person,2410
116811,02281262,n,10,the seat on which reserve players sit during a game,2410
116812,02281365,n,10,(law) the seat for judges in a courtroom,"1802,2410"
116813,02281476,n,10,a clamp used to hold work in place on a workbench,
116814,02281583,n,10,a small punch press mounted on a workbench,"1787,2415"
116815,02281683,n,10,curved segment,1946
116816,02281793,n,10,diagonal line traversing a shield from the upper right corner to the lower left,2794
116818,02282070,n,10,a suspension bridge across the Delaware River,"1946,2772"
116819,02282205,n,10,(trademark) a form of amphetamine,2248
116820,02282304,n,10,a white crystalline ester used as a local anesthetic,2248
116823,02282822,n,10,a limousine with a glass partition between the front and back seats,1946
116824,02282942,n,10,a rig of triangular sails for a yacht,
116825,02283082,n,10,(usually in the plural) trousers that end at the knee,2875
116827,02283397,n,10,a broom made of twigs tied together on a long handle,2353
116830,02284035,n,10,accelerates a continuous beam of electrons to high speeds by means of the electric field produced by changing magnetic flux,2097
116831,02284237,n,10,a house of worship (especially one for sailors),"1565,2415"
116832,02284337,n,10,a cyclotron that accelerates protons up to several billion electron volts,2097
116833,02284465,n,10,a hand tool consisting of two rules that are hinged together so you can draw or measure angles of any size,2415
116834,02284638,n,10,two surfaces meeting at an angle different from 90 degrees,
116835,02284782,n,10,gears that mesh at an angle,2098
116836,02284932,n,10,a sloping edge on a cutting tool,
116837,02285016,n,10,the ordinary clarinet with a middle range,2536
116839,02285284,n,10,a napkin tied under the chin a child while eating,2353
116842,02285576,n,10,brim turned up to form two points,2875
116844,02286019,n,10,with two sets of pedals and two seats,1946
116845,02286133,n,10,small pump that fills bicycle tires with air,"2098,2643"
116846,02286237,n,10,a rack for parking bicycles,
116847,02286323,n,10,a seat for the rider of a bicycle,"1948,2643"
116848,02286443,n,10,the wheel of a bicycle,"1946,2098"
116849,02286581,n,10,for washing genitals and anal area,2446
116850,02286667,n,10,a stand to support a corpse or a coffin prior to burial,
116852,02286912,n,10,an interior door,2415
116853,02287006,n,10,"clock in the clock tower of the Houses of Parliament, London",1951
116856,02287402,n,10,the middle part of a slack rope (as distinguished from its ends),2066
116857,02287537,n,10,a small and delicately worked piece,2474
116821,02282435,n,10,any of several similar lipophilic amines used as tranquilizers or sedatives or hypnotics or muscle relaxants; chronic use can lead to dependency,2248
174808,00867637,v,10,"provide with a new facing: ""The building was refaced with beautiful stones""",
116866,02288748,n,10,"a long-handled saw with a curved blade; ""he used a bill to prune branches off of the tree""","2314,2876"
116860,02287841,n,10,where the sides of the vessel curve in to form the bottom,1942
116873,02289616,n,10,a container; usually has a lid,
116891,02291725,n,10,a catcher's mask with a strong wire face,2871
116885,02291083,n,10,old fashioned; two wings one above the other,1946
116899,02292928,n,10,"piece of metal held in horse's mouth by reins and used to control the horse while riding; ""the horse was not accustomed to a bit""",2651
116895,02292166,n,10,a stiff cap with ridges across the crown; worn by Roman Catholic clergy,2875
116897,02292428,n,10,a small informal restaurant; serves wine,"1707,2415,2446,2772"
116865,02288518,n,10,"a brim that projects to the front to shade the eyes: ""he pulled down the bill of his cap and trudged ahead""","2871,2875"
116911,02294665,n,10,sheet of slate; for writing with chalk,1898
116915,02295133,n,10,a black flag bearing a white skull and crossbones; indicates a pirate ship,2425
169583,00041451,v,10,birthe; of certain mammals,"2158,2188"
116880,02290498,n,10,a nonmagnetic housing for a ship's compass (usually in front of the helm),
116862,02288154,n,10,a pump to remove bilgewater,"1942,2098"
116863,02288257,n,10,"in a vessel with two hulls, an enclosed area between the frames at each side",1942
116864,02288386,n,10,(nautical) a well where seepage drains to be pumped away,1942
116867,02288900,n,10,large outdoor signboard,
116868,02288990,n,10,for military personnel (especially in a private home),2415
116869,02289096,n,10,balls used in playing billiards,2633
116870,02289223,n,10,a device for keeping the score in a game of billiards,2633
116871,02289338,n,10,a room in which billiards is played,2415
116872,02289504,n,10,bends with rise in temperature,"2098,2284"
116874,02289786,n,10,something used to tie,
116875,02289871,n,10,holds loose papers or magazines,1422
116876,02289969,n,10,a machine that cuts grain and binds it in sheaves,"2314,2876"
116877,02290087,n,10,a place where books are bound,2446
116879,02290380,n,10,strip sewn over or along an edge for reinforcement or decoration,2425
116881,02290626,n,10,designed for simultaneous use by both eyes,2102
116882,02290788,n,10,a laboratory for biological research,2158
116883,02290913,n,10,a kind of early movie projector,2102
116884,02290999,n,10,a South African movie theater,"1707,2415,2606"
116886,02291181,n,10,for obtaining interference fringes,2102
116887,02291288,n,10,bundle of birch twigs used to hit people as punishment,1802
116888,02291406,n,10,a canoe made with the bark of a birch tree,"1942,2772"
116889,02291522,n,10,an ornamental basin (usually in a garden) for birds to bathe in,
116890,02291640,n,10,a cage in which a bird is kept,2338
116892,02291825,n,10,a device for imitating a birdcall,2101
116893,02291913,n,10,a shelter for birds (especially pigeons),2338
116894,02292034,n,10,small lead shot for shotgun shells,1781
116896,02292291,n,10,a chess piece that can be moved diagonally over unoccupied squares of the same color,2628
116901,02293366,n,10,a dental X-ray film that can be held in place by the teeth during radiography,2527
116902,02293498,n,10,an image represented as a two dimensional array of brightness values for pixels,
116903,02293649,n,10,a strong post on the deck of a ship around which mooring lines can be attached,2415
116904,02293815,n,10,(nautical) the inboard end of a line or cable especially the end that is wound around a bitt,1942
116905,02293983,n,10,the upper end of a bitt,2415
116906,02294080,n,10,a pin through the bitthead to keep the mooring lines from slipping off,
116907,02294205,n,10,a protective coating of asphalt and filter used on structural metals that are exposed to weathering,
116908,02294361,n,10,black clothing (worn as a sign of mourning),"1565,2875"
116909,02294456,n,10,(chess or checkers) the darker-colored pieces,2628
116910,02294553,n,10,a black-and-white photograph or slide,2527
116912,02294773,n,10,removes chalk marks from blackboard,
116913,02294872,n,10,records information about the performance of an aircraft during flight,1942
116914,02294998,n,10,the makeup (usually burnt cork) used by a performer in order to imitate a Negro,2371
116917,02295460,n,10,worn with a dinner jacket,2875
116918,02295541,n,10,a simple hitch used for temporarily attaching a line to a hook,
116919,02295665,n,10,a bag that fills with air,"2633,2871"
116859,02287733,n,10,small and tight-fitting underpants; worn by women,2875
174817,00868723,v,10,"to mark, or produce an imprint in or on something: ""a man whose name is permanently stamped on our maps,""",
116929,02297407,n,10,for smelting of iron from iron oxide ores; combustion is intensified by a blast of air,"1787,1794"
116932,02297870,n,10,lightweight single-breasted jacket; often striped in the colors of a club or school,2875
116933,02298036,n,10,an outdoor grandstand without a roof; patrons are exposed to the sun as linens are when they are bleached,"1707,2415"
116937,02298734,n,10,"a hiding place sometimes used by hunters (especially duck hunters); ""he waited impatiently in the blind""",
116940,02299122,n,10,a light that flashes on and off; used as a signal or to send messages,1935
116945,02300099,n,10,"an obstruction in a pipe or tube: ""we had to call a plumber to clear out the blockage in the drainpipe""",
116960,02302163,n,10,"blue clothing: ""she was wearing blue""",2875
116949,02300752,n,10,a stronghold that is reinforced for protection from enemy fire; with apertures for defensive fire,1781
116965,02302683,n,10,"a flat piece of material designed for a special purpose: ""he nailed boards across the windows""",
116966,02303171,n,10,"a flat portable surface (usually rectangular) designed for board games; ""he got out the board and set up the pieces""",2633
116920,02295763,n,10,the flat part of a tool or weapon that (usually) has a cutting edge,"1781,1957"
116972,02304119,n,10,a walkway made of wooden boards; usually at seaside,1946
116977,02305127,n,10,at edge of river or lake; used to store boats,2415
116981,02305626,n,10,a small float usually made of cork; attached to a fishing line,2655
116927,02297094,n,10,strong reinforcing stitch for edges of blanket and other thick material; similar to buttonhole stitch,2425
116921,02296070,n,10,flat surface that rotates and pushes against air or water,"1942,2098,2772"
116922,02296353,n,10,the part of the skate that slides on the ice,2646
116923,02296468,n,10,a cartridge containing an explosive charge but no bullet,1781
116924,02296598,n,10,a piece of material ready to be made into something,
116926,02296948,n,10,a layer of lead surrounding the highly reactive core of a nuclear reactor,2097
116928,02297256,n,10,"a stone in Blarney Castle in Ireland, said to impart skill in flattery to whoever kisses it",2415
116931,02297730,n,10,mixture of guncotton with nitroglycerin,"2110,2111"
116934,02298197,n,10,an electrically powered mixer with whirling blades that mix or chop or liquefy foods,1957
116935,02298348,n,10,a small nonrigid airship used for observation or as a barrage balloon,1946
116938,02298890,n,10,a street with only one way in or out,1946
116939,02299036,n,10,a cloth used to cover the eyes,2875
116943,02299904,n,10,prevents access or progress,
116944,02299986,n,10,a ship that runs through or around a naval blockade,1942
116946,02300359,n,10,pulley blocks with associated rope or cable,2415
116947,02300484,n,10,a large bomb used to demolish extensive areas,2110
116950,02300906,n,10,a small plane used on end grains of wood,"2415,2425"
116951,02301004,n,10,a motor vehicle equipped to collect blood donations,1946
116953,02301305,n,10,a top worn by women,2875
116954,02301468,n,10,a device that produces a current of air,2098
116955,02301578,n,10,a tube through which darts can be shot by blowing,2306
116956,02301715,n,10,a burner that produces a hot flame,
116957,02301842,n,10,directs air or gas into a flame to concentrate heat,"1787,1946"
116958,02301971,n,10,a high shoe with laces over the tongue,2875
116959,02302074,n,10,used as a weapon,
116961,02302251,n,10,a blue poker chip with the highest value,2633
116962,02302347,n,10,photographic print of plans or technical drawings etc.,2527
116963,02302457,n,10,a short musket of wide bore with a flared muzzle,1781
116964,02302582,n,10,a file with parallel edges,"1787,2415"
116967,02303495,n,10,a structure of boards,
116968,02303589,n,10,a private house that provides accommodations and meals for paying guests,"1707,2415,2772"
116969,02303738,n,10,a room where a committee meets (such as the board of directors of a company),2415
116970,02303906,n,10,a measure used in computing board feet,1951
116971,02304001,n,10,the boarding that surrounds an ice hockey rink,"2415,2646"
116973,02304226,n,10,a small vessel for travel on water,"1942,2772"
116974,02304780,n,10,the upper deck on which lifeboats are stored,1942
116975,02304880,n,10,a stiff straw hat with a flat crown,2875
116976,02305027,n,10,pole-handled hook used to pull or push boats,1946
116979,02305400,n,10,a train taking passengers to or from a port,1946
116980,02305500,n,10,a whistle on a boat that is sounded as a warning,"1942,2101"
116942,02299702,n,10,"housing in a large building that is divided into separate units: ""there is a block of classrooms in the west wing""",2415
144960,06753125,n,10,a nebula that was once thought to be a star with its planets but is now thought to be a very hot star surrounded by an expanding envelope of ionized gases that emit a fluorescent glow because of intense radiation from the star,2076
117028,02312763,n,10,"a vehicle that is dilapidated and uncomfortable: ""that old bike without rubber tires was a real boneshaker""",1946
116992,02307096,n,10,"the external structure of a vehicle: ""the body of the car was badly rusted""",1946
117002,02308959,n,10,a rope with weights attached to the ends; is thrown to entangle the legs of an animal; of South American origin,
117003,02309121,n,10,a short jacket; worn mostly by women,2875
117006,02309468,n,10,long heavy and single-edged knife; of Philippine origin,
117008,02309693,n,10,measures heat radiation; extremely sensitive,1951
117017,02311234,n,10,a large shawm; the bass member of the shawm family,2536
117029,02312927,n,10,a small drum; played with the hands,2536
116982,02305784,n,10,"a hanging weight, especially a metal ball on a string",
117031,02313137,n,10,"a book as a physical object: a number of pages bound together; ""he used a large book as a doorstop""",1422
117037,02314154,n,10,a van with shelves of books; serves as a mobile library or bookstore,1946
116983,02305960,n,10,around which thread or tape or film or other flexible materials can be wound,2098
117042,02314803,n,10,(Australian) a curved piece of wood; when properly thrown will return to thrower,1781
116993,02307258,n,10,armor that protects the wearer's body,"1781,2768"
116985,02306286,n,10,a long racing sled (for 2 or more people) with a steering mechanism,1946
116986,02306419,n,10,formerly two short sleds coupled together,1946
116987,02306526,n,10,wooden ball that is bowled in the Italian game of bocce,2633
116988,02306665,n,10,part of a dress above the waist,2875
116989,02306768,n,10,a blunt needle for pulling ribbon through loops,2415
116990,02306868,n,10,a small sharp-pointed tool for punching holes in leather or fabric,2415
116994,02307927,n,10,a bag in which the body of a dead soldier is placed,
116995,02308033,n,10,a pad worn by hockey goalkeeper,2875
116996,02308119,n,10,the exterior body of a motor vehicle,1946
116997,02308229,n,10,an automatic double-barreled antiaircraft gun,1781
116998,02308331,n,10,an unidentified (and possibly enemy) aircraft,1946
116999,02308443,n,10,sealed vessel where water is converted to steam,"2098,2415"
117000,02308652,n,10,thick plate iron used in the production of boilers,
117004,02309210,n,10,a strong post on a wharf or quay around which to attach mooring lines,"1942,2415"
117005,02309359,n,10,a pulley-block at the head of a topmast,"1787,2098"
117007,02309587,n,10,record or recording made by a bolometer,2536
117009,02309793,n,10,a cord fastened around the neck with an ornamental clasp and worn as a necktie,2875
117010,02309951,n,10,a pillow that is often put across a bed underneath the regular pillows,2410
117011,02310089,n,10,screws into a nut to form a fastener,
117012,02310305,n,10,the part of a lock that is engaged or withdrawn with a key,2415
117013,02310462,n,10,a sliding bar in a breech-loading firearm that ejects an empty cartridge and replaces it and closes the breech,"1781,2415"
117014,02310642,n,10,an implement for cutting bolts,2415
117016,02310834,n,10,an explosive device fused to denote under specific conditions,2110
117018,02311368,n,10,strong sealed vessel for measuring heat of combustion,1951
117019,02311491,n,10,a military aircraft that drops bombs during flight,1946
117020,02311649,n,10,gathered into a band at the waist,2875
117021,02311742,n,10,a device on an aircraft for carrying bombs,1946
117022,02311859,n,10,an explosive bomb or artillery shell,2110
117024,02312120,n,10,a sighting device in an aircraft for aiming bombs,2102
117025,02312225,n,10,small porous bowl made of bone ash used in assaying to separate precious metals from e.g. lead,
117026,02312403,n,10,fine porcelain that contains bone ash,2446
117030,02313027,n,10,a hat tied under the chin,2875
117033,02313624,n,10,a bag in which students carry their books,
117034,02313720,n,10,a piece of furniture with shelves for storing books,"2410,2446"
117035,02313845,n,10,a support placed at the end of a row of books to keep them upright (on a shelf or table),1422
117038,02314279,n,10,a shelf on which to keep books,2410
117039,02314365,n,10,a shop where books are sold,"2446,2872"
117040,02314471,n,10,any of various more-or-less horizontal spars or poles used to extend the foot of a sail or for handling cargo or in mooring,1942
117041,02314664,n,10,a pole carrying an overhead microphone projected over a film or tv set,2606
116991,02306987,n,10,formerly a long hairpin; usually with an ornamental head,
144976,06755791,n,10,any of numerous small celestial bodies composed of rock and metal that move around the sun (mainly between the orbits of Mars and Jupiter),2076
117068,02318679,n,10,glass or plastic vessel; cylindrical with a narrow neck; no handle,
