117367,02362913,n,10,small room on a ship or boat where people sleep,"1942,2415"
117370,02363314,n,10,accommodations on a ship or train or plane that are less expensive than first class accommodations,"2415,2772"
117371,02363485,n,10,has a cabin and plumbing and other conveniences necessary for living on board,"1942,2772"
117373,02363899,n,10,"housing for electronic instruments, as radio or television",2107
117375,02364208,n,10,woodwork finished by hand by a cabinetmaker,"1787,2425"
117376,02364309,n,10,a liner with cabins for passengers,1942
117378,02364535,n,10,a television system transmitted over cables,2606
117379,02364710,n,10,an electrical conductor connecting telephones or television or power stations,"1939,2107,2606"
117381,02365185,n,10,a railway up the side of a mountain pulled by a moving cable and having counterbalancing ascending and descending cars,"1707,1946,2772"
117382,02365414,n,10,a hidden storage space (for money or provisions or weapons),
117384,02365805,n,10,a seal on a letter,
117385,02365895,n,10,for storing tea,
117386,02365974,n,10,based on the energy difference between two states of the caesium nucleus in a magnetic field,1951
117387,02366126,n,10,a small restaurant where drinks and snacks are sold,"1707,2415,2446,2772"
117388,02366323,n,10,serve yourself and pay a cashier,"1707,2415,2446"
117389,02366429,n,10,a tray for carrying your food in a cafeteria,
117390,02366534,n,10,(British slang) cafe,"1707,2415,2772"
117393,02366903,n,10,made or wire or metal bars in which birds or animals are kept,2338
117394,02367076,n,10,the goal in ice hockey,2633
117396,02367226,n,10,large watertight chamber used for construction under water,
117397,02367370,n,10,a chest to hold ammunition,
117398,02367469,n,10,a two-wheeled vehicle carrying artillery ammunition,"1781,1946"
117399,02367574,n,10,a block of soap or wax,
117401,02367822,n,10,the folding top of a horse-drawn carriage,1946
117403,02368081,n,10,an ankle-length shoe worn by ancient Romans,2875
117406,02368666,n,10,a small machine for mathematical calculations,2873
117407,02368898,n,10,a very large pot,1957
117408,02368979,n,10,a machine that smoothes or glazes paper or cloth by pressing it between plates or passing it through rollers,1787
117409,02369142,n,10,a coarse cloth with a bright print,1787
117410,02369229,n,10,an instrument for measuring the distance between two points,"1787,1951"
117411,02369394,n,10,a metal cleat on the bottom front of a horseshoe to prevent slipping,
117412,02369522,n,10,a bulletin board backstage in a theater,2610
117361,02362070,n,10,small two-wheeled horse-drawn; with two seats and a folding hood,1946
174835,00870970,v,10,"scratch the surface of: ""scarify seeds""",
174838,00871417,v,10,"mark with lines: ""sorrow had lined his face""",
117437,02373391,n,10,a broad-brimmed felt hat with a high crown; formerly worn by the United States Army and Marine personnel,2875
117413,02369618,n,10,a small display that will show you the telephone number of the party calling you,"2107,2284"
117438,02373554,n,10,a bell tower; usually stands alone unattached to a building,"1707,2446"
117441,02373917,n,10,a wheeled vehicle that can be pulled by a car or truck; equipped for living; especially for holiday trips,1946
117447,02374890,n,10,branched; ornamental; has several lights,
117467,02377475,n,10,small and light boat; pointed at both ends; propelled with a paddle,"1942,2772"
117473,02378420,n,10,a flask for carrying water; used by soldiers or travelers,
117474,02378531,n,10,in a factory; where workers can eat,2415
117414,02369754,n,10,a musical instrument consisting of a series of steam whistles played from a keyboard,2536
117415,02369926,n,10,determines quantities of heat,1951
117417,02370228,n,10,a Latin cross set on three steps,2425
117418,02370339,n,10,shaped rotating disk to convert circular into linear motion,"1787,2098"
117419,02370466,n,10,a medieval hood of mail suspended from a basinet to protect the head and neck,"1781,2768,2875"
117420,02370636,n,10,an arch with a straight horizontal extrados and a slightly arched intrados,2446
117421,02370768,n,10,a finely woven white linen,1787
117422,02370848,n,10,a university in England,"1820,1922,2772"
117423,02370969,n,10,a soft tan cloth made with the hair of a camel,1787
117424,02371086,n,10,engraving or carving in relief,2459
117425,02371168,n,10,a light-proof box with a lens at one end and light-sensitive film at the other,2527
117426,02371599,n,10,a lens that focuses the image in a camera,"2102,2527,2606"
117427,02371823,n,10,an attachment that enables an observer to view simultaneously the image and a drawing surface for sketching it,2097
117428,02372012,n,10,a darkened enclosure in which images of outside objects are projected through an aperture onto a facing surface,
117429,02372184,n,10,a tripod used to support a camera,2527
117430,02372277,n,10,a short negligee,2875
117431,02372348,n,10,a short sleeveless undergarment for women,2875
117432,02372458,n,10,device or stratagem for concealment or deceit,
117439,02373678,n,10,a light folding chair,2410
117440,02373756,n,10,a recreational vehicle equipped for camping out while traveling,"1946,2772"
117442,02374123,n,10,a cerate made of camphor and wax and spermaceti and castor oil,2248
117443,02374243,n,10,a folding stool,2410
117444,02374314,n,10,has cams attached to it,2098
117445,02374411,n,10,airtight sealed metal container for food or drink or paint etc.,
117446,02374666,n,10,long and narrow strip of water made for boats or for irrigation,1946
117448,02375001,n,10,a miniature camera with a fast lens,2527
117449,02375096,n,10,stick of wax with a wick in the middle,
117450,02375281,n,10,with sockets for candles,
117451,02375452,n,10,the wick of a candle,
117452,02375566,n,10,loops of soft yarn are cut to give a tufted pattern,"2425,2875"
117453,02375674,n,10,a thermometer used to determine the temperature of candy syrups during cooking,1951
117454,02375816,n,10,used to hit students as punishment,1802
117455,02375901,n,10,something people can lean on to help them walk,
117456,02376052,n,10,metal container for storing dry foods such as tea or flour,
117458,02376457,n,10,where food is canned,"1787,1794"
117459,02376531,n,10,a small can,
117460,02376597,n,10,a wooden bucket,
117461,02376667,n,10,a large gun that is usually on wheels,1781
117462,02376829,n,10,heavy automatic gun fired from an airplane,1781
117463,02376924,n,10,(medieval) a cylindrical piece of armor plate to protect the arm,"1781,2768"
117464,02377096,n,10,a solid projectile that in former times was fired from a cannon,1781
117465,02377243,n,10,a large firecracker,2110
117468,02377666,n,10,a device for cutting cans open,
117469,02377784,n,10,a jar used in ancient egypt to contain entrails of an embalmed body,
117470,02377924,n,10,a covering (usually of cloth) that serves as a roof to shelter an area from the weather,
117471,02378172,n,10,the umbrella-like part of a parachute that fills with air,1787
117472,02378301,n,10,the transparent covering of an aircraft cockpit,1942
117475,02378620,n,10,a recreation room in an institution,2415
117435,02373004,n,10,"a prison for forced laborers: ""China has many work camps for political prisoners""",1802
174839,00871542,v,10,"mark with or consist of a pattern of crossed lines: ""wrinkles crisscrossed her face""",
174840,00871694,v,10,"cut or make a notch into: ""notch the rope""",
117493,02381739,n,10,a tube of small internal diameter; holds liquid by capillary action,"1951,2306"
117499,02382434,n,10,a threaded screw for machine parts; screws into a tapped hole,
117507,02383458,n,10,"4-wheeled motor vehicle; usually propelled by an internal combustion engine; ""he needs a car to get to work""","1946,2772"
117509,02384960,n,10,"where passengers ride up and down: ""the car was on the top floor""","1707,2415"
117512,02385479,n,10,a bottle with a stopper; for serving wine or water,
117477,02378820,n,10,sells food and personal items to personnel at an institution or school or camp etc.,2872
117484,02379828,n,10,"the mat that forms the floor of the ring in which boxers or professional wrestlers compete: ""the boxer picked himself up off the canvas""",2642
117520,02386541,n,10,a large bottle for holding corrosive liquids; usually cushioned in a special container,
117530,02388145,n,10,a small light table with folding legs; can be folded for storage,2410
117514,02385783,n,10,a storage battery in a car; the heart of the car's electrical system,2284
117479,02379087,n,10,projecting horizontal beam fixed at one end only,2415
117480,02379192,n,10,constructed of two cantilevers that meet in the middle,1946
117481,02379436,n,10,the back of a saddle seat,"1948,2651"
117483,02379654,n,10,heavy closely woven fabric (used for clothing or chairs or sails or tents),1787
117485,02380046,n,10,an oil painting on canvas,2511
117486,02380134,n,10,a tent made of canvas,2772
117487,02380304,n,10,a tight-fitting covering for the head,2875
117488,02380860,n,10,a top (as for a bottle),
117489,02380969,n,10,something serving as a cover or protection,
117490,02381151,n,10,an electrical device characterized by its capacitance,2284
117491,02381405,n,10,"a decorated covering for a horse, especially (formerly) for a warhorse",2651
117492,02381581,n,10,a sleeveless garment like cloak but shorter,2875
117494,02381917,n,10,the upper part of a column that supports the entablature,2446
117495,02382063,n,10,a warship of the first rank in size and armament,"1781,1942"
117496,02382170,n,10,a bottle opener to pry off caps,
117497,02382258,n,10,a long hooded cloak,2875
117498,02382345,n,10,a long hooded overcoat,2875
117500,02382551,n,10,a windlass rotated in a horizontal plane,"1787,2415"
117501,02382645,n,10,used at top of wall,2415
117502,02382765,n,10,a pill in the form of a small rounded container with medicine inside,2248
117503,02382887,n,10,a small container (as one holding electronic equipment),
117504,02382996,n,10,a wooden armchair with a saddle seat and a low back that has vertical spindles,2410
117506,02383379,n,10,a hooded cloak for women,2875
117510,02385109,n,10,car suspended from an airship and carrying personnel and cargo and power plant,"1946,2415"
117513,02385593,n,10,an inn in some Eastern countries with a large courtyard that provides accommodation for caravans,"1707,2415,2772"
117515,02385949,n,10,light automatic rifle,1781
117517,02386194,n,10,a colorless basic antibiotic that inhibits the growth of Gram-positive organisms,2248
117518,02386331,n,10,a copy made with carbon paper,
117519,02386427,n,10,has carbon electrodes,
117521,02386680,n,10,mixes air with gasoline vapor prior to explosion,2098
117522,02386875,n,10,a trailer that can be loaded with new cars for delivery to sales agencies,1946
117524,02387286,n,10,a small case for carrying business cards,
117525,02387381,n,10,a piece of electronic equipment for continual observation of the function of the heart,2107
117526,02387583,n,10,knitted jacket that is fastened up the front with buttons or a zipper,2875
117527,02387726,n,10,records electric currents associated with contractions of the heart,"2107,2232"
117528,02387891,n,10,the door of a car,"1946,1948,2415"
117529,02388057,n,10,a room for gambling on card games,2415
117531,02388266,n,10,a table for playing cards (as in a casino),2410
117532,02388365,n,10,a ferry that transports motor vehicles,"1942,2772"
117533,02388459,n,10,goods carried by a large vehicle,"1946,2872"
117534,02388614,n,10,the space in a ship or aircraft for storing cargo,1942
117535,02388774,n,10,a large container for freight,
117536,02388865,n,10,a helicopter that carries cargo,1946
117537,02388959,n,10,a liner that carries cargo,1942
117538,02389043,n,10,a ship design to carry cargo,1942
117539,02389270,n,10,set of bells hung in a bell tower,2536
117508,02384604,n,10,"a wheeled vehicle adapted to the rails of railroad: ""three cars had jumped the rails""",1940
174842,00871942,v,10,"make a recess in: ""recess the piece of wood""",
117555,02391202,n,10,for one or two cars; flat roof supported on poles,2415
117566,02393107,n,10,"a vehicle designed to carry something: ""refrigerated carriers have revolutionized the grocery business""",1946
117565,02392911,n,10,a rack attached to a vehicle; for carrying luggage or skis or the like,
117578,02394984,n,10,"a module designed to be inserted into a larger piece of equipment: ""he loaded a cartridge of fresh tape into the tape deck""",
117573,02394238,n,10,a box made of cardboard; opens by flaps on top,
117593,02397245,n,10,"a portable container for carrying several objects: ""the musicians left their instrument cases backstage""",
117583,02395801,n,10,a metal frame or container holding cartridges; can be inserted into an automatic gun,"1781,2098"
117592,02397113,n,10,a number of transformers in series; provides a high-voltage source,2284
117595,02397914,n,10,"a cover for a pillow: ""the burglar carried his loot in a pillowcase""",2353
117564,02392779,n,10,either of a pair of strong posts that support a windlass on a ship's deck,2415
117540,02389358,n,10,medication that prevents the formation of gas in the alimentary tract or eases its passing,2248
117541,02389506,n,10,a mirror that the driver of a car can use,1946
117542,02389659,n,10,large mechanical apparatus with seats for children to ride on,2098
117543,02389817,n,10,carries luggage to air travelers,1787
117544,02389923,n,10,a hammer with a cleft at one end for pulling nails,"2415,2425"
117546,02390164,n,10,a straight bar of light metal with a spirit level in it,"1787,2415"
117547,02390320,n,10,a rule used by a carpenter,1951
117550,02390632,n,10,for beating dust out of carpets,
117551,02390764,n,10,a loom for weaving carpeting,1787
117552,02390850,n,10,a pad placed under a carpet,2410
117553,02390988,n,10,revolving brushes pick up dirt as it is pushed over a carpet,2353
117554,02391119,n,10,used to nail down carpets,
117556,02391316,n,10,a large galleon sailed in the Mediterranean as a merchantman,1942
117557,02391439,n,10,small individual study area in a library,
117558,02391579,n,10,a wheeled vehicle drawn by horses,1946
117559,02392046,n,10,a machine part that carries something else,"1422,1787,2098,2410"
117562,02392552,n,10,a wrench designed for use with carriage bolts,"1787,2415"
117563,02392659,n,10,a knot used to connect the ends of two large ropes or hawsers,
117567,02393264,n,10,formerly used to treat burns,2248
117568,02393349,n,10,a capacious bag or basket,
117569,02393457,n,10,box-shaped with handles for a baby to sleep in,2410
117570,02393577,n,10,a seat in a passenger car,"1940,1948"
117571,02393752,n,10,a heavy open vehicle usually having two wheels and drawn by an animal,1946
117572,02394054,n,10,rubber ring around the rim of an automobile wheel,"1948,2875"
117574,02394355,n,10,usually with paper casing,1781
117575,02394447,n,10,a train that transports passengers and their automobiles,1946
117577,02394781,n,10,the part of the arm of a record player that holds the needle and that is removable,"2284,2536"
117579,02395199,n,10,a broad belt with loops or pockets for holding ammunition,2875
117580,02395335,n,10,a mechanism in a firearm that ejects the empty shell case after firing,"1781,2098"
117581,02395498,n,10,a mechanism in a firearm that pulls an empty shell case out of the chamber and passes it to the ejector,"1781,2098"
117582,02395718,n,10,a fuse cased in a tube,2284
117584,02396020,n,10,has wooden spokes and a metal rim,"1946,2098"
117585,02396166,n,10,an object created by carving (as wood or ivory or stone),2459
117586,02396366,n,10,a large fork used in carving cooked meat,1957
117587,02396465,n,10,a large knife used to carve cooked meat,1957
117589,02396780,n,10,a window in a car,1948
117590,02396909,n,10,a supporting column carved in the shape of a person,2446
117591,02397015,n,10,used to liquefy air or oxygen etc.,2097
117594,02397742,n,10,a glass container used to store and display items in a shop or museum or home,2410
117596,02398067,n,10,a water-base paint made with casein (which is a protein precipitated from milk),2511
117597,02398214,n,10,a knife carried in a sheath,
117599,02398414,n,10,a window that is hinged (usually on one side),2415
117600,02398514,n,10,military barracks in a garrison town,"1707,1781,2415"
117601,02398603,n,10,a shot-packed metallic cylinder used as ammunition in a firearm,1781
117602,02398768,n,10,a counter at a large party where you can purchase drinks by the glass,2410
117603,02398892,n,10,a box for holding cash,1768
117549,02390533,n,10,made of carpet; widely used in 19th century,
174843,00872050,v,10,"hollow out in the form of a furrow or groove: ""furrow soil""",
174847,00872771,v,10,"make wrinkles or creases into a smooth surface: ""The dress got wrinkled""",
117611,02400117,n,10,(15-16th century) any armor for the head; usually ornate without a visor,"1781,2768"
117627,02402428,n,10,extracted from the seed of the castor plant; used in paint and varnish as well as medically,2248
117634,02403444,n,10,Y-shaped stick with elastic between the arms; used to propel small stones,2633
117607,02399553,n,10,"the enclosing frame around a door or window opening: ""the casings had rotted away and had to be replaced""","2415,2446"
117604,02399005,n,10,a machine (outside some banks) that dispenses cash when a personal coded card is used,1766
117648,02405339,n,10,circular-shaped; spins round and round,2110
117660,02406949,n,10,narrow pathway high in the air (as above a stage; between parts of a building; along a bridge),1946
117661,02407097,n,10,narrow; models display clothes on it at a fashion show,2875
117605,02399264,n,10,a soft fabric made from the wool of the Cashmere goat,1787
117608,02399756,n,10,the outermost covering of a pneumatic tire,"1948,2098,2875"
117609,02399870,n,10,a public building for gambling and entertainment,"2415,2446,2772"
117610,02399989,n,10,small and often ornate for holding jewels or other valuables,2474
117612,02400279,n,10,a light open helmet without a visor or beaver,"1781,2768"
117614,02400665,n,10,large deep dish in which food can be cooked and served,1957
117615,02400775,n,10,a container that holds a magnetic tape used for recording or playing sound or video,
117616,02400968,n,10,a tape deck for playing and recording cassette tapes,2107
117617,02401080,n,10,for playing cassettes,2107
117618,02401163,n,10,for recording or playing cassettes,2606
117619,02401261,n,10,a cassette that contains magnetic tape,
117620,02401378,n,10,an ankle-length black garment worn by priests or choristers,2875
117621,02401509,n,10,object formed by a mold,
117622,02401647,n,10,a firm covering (often made of plaster of Paris) that immobilizes broken bones while they heal,2248
117623,02401807,n,10,a pivoting wheel attached to the bottom of furniture or trucks or portable machines to make them movable,2098
117624,02401973,n,10,a good hard soap made from olive oil and sodium hydroxide,
117625,02402089,n,10,a large building formerly occupied by a ruler and fortified against attack,1781
117626,02402254,n,10,the chessman that can move any number of unoccupied squares in a direction parallel to the sides of the chessboard,2628
117628,02402595,n,10,an underground tunnel with recesses where bodies were buried (as in ancient Rome),"1707,2415"
117629,02402731,n,10,a decorated bier on which a coffin rests in state during a funeral,
117630,02402854,n,10,antipollution device on an automotive exhaust system,1787
117632,02403199,n,10,a sailboat with two parallel hulls held together by single deck,1942
117633,02403318,n,10,an ancient heavy war engine for hurling large stones,1781
117635,02403592,n,10,launches aircraft from a warship,1781
117636,02403690,n,10,a boat with a single mast set far forward,1942
117637,02403785,n,10,a receptacle for cat excrement,
117638,02403869,n,10,a fastener that fastens or locks a door or window,
117640,02404234,n,10,a mask to protect the face of the catcher in baseball,2871
117641,02404402,n,10,a structure in which water is collected,
117642,02404497,n,10,(trademark) a tractor that is driven by caterpillar tracks,1946
117643,02404638,n,10,around wheels to grip rough ground,"1781,1946"
117644,02404832,n,10,a strong cord made from the intestines of sheep and used in surgery,
117645,02404977,n,10,the official chair of a bishop,"1565,1707,2410,2415"
117646,02405099,n,10,any large and important church,"1565,1707,2415,2446"
117649,02405457,n,10,a thin flexible tube inserted into the body to permit introduction or withdrawal of fluids,2306
117650,02405602,n,10,negative pole,"2107,2284"
117651,02405724,n,10,a vacuum tube in which a hot cathode emits a beam of electrons that pass through a high voltage anode and are focused or deflected before hitting a phosphorescent screen,"1355,2107,2284,2606"
117652,02406093,n,10,a long double-edged knife used for amputations,2259
117654,02406327,n,10,rig of a catboat,
117655,02406397,n,10,a hitch in the middle of rope that has two eyes into which tackle can be hooked,
117656,02406532,n,10,a bottle that holds catsup,
117657,02406635,n,10,a freight car for transporting cattle,1940
117658,02406729,n,10,a cargo ship for the transport of livestock,1942
117659,02406843,n,10,a trail over which cattle were driven to market,1946
117662,02407205,n,10,a road that is raised above water or marshland or sand,1946
117639,02404024,n,10,"a restraint that checks the motion of something: ""he used a book as a stop to hold the door open""",
145227,06798517,n,10,the strait separating South America from Tierra del Fuego and other islands south of the continent; discovered by Ferdinand Magellan in 1520; an important route around South American before the Panama Canal was built,2772
145267,06803926,n,10,an interface forming the boundary between the non-miscible liquids oil and water,2111
174789,00865384,v,10,"cover with paper: ""paper the box""",
117685,02411012,n,10,"any small compartment: ""the cells of a honeycomb""",
117695,02412359,n,10,"a building dedicated to a particular activity: ""they were raising money to build a new center for research""",2415
117689,02411468,n,10,a large stringed instrument; seated player holds it upright while playing,2536
117698,02412996,n,10,"the part of the outfield directly ahead of the catcher: ""he hit the ball to deep center""",2871
117679,02410004,n,10,"the overhead inside lining of a room: ""he hated painting the ceiling""","2415,2446"
117664,02407580,n,10,a soft felt hat with a wide flexible brim,2875
117665,02407693,n,10,a stout sword with a curved blade and thick back,1781
117666,02407835,n,10,battery used to maintain the grid potential in a vacuum tube,2284
117667,02407951,n,10,a clamp in the shape of a C,
117668,02408032,n,10,a drive that reads a compact disc and that is connected to an audio system,"1355,2107"
117669,02408180,n,10,a stand-alone piece of electronic equipment that either has its own display or attaches to a television set,2107
117670,02408362,n,10,a compact disc on which you can write only once and thereafter is read-only,2536
117673,02408968,n,10,made of cedar,
117674,02409039,n,10,a parenteral cephalosporin (trade name Cefobid) used for severe infections,2248
117675,02409182,n,10,a parenteral cephalosporin (trade name Claforan) used for severe infections of the lungs or throat or ears or urinary tract,2248
117676,02409373,n,10,a parenteral cephalosporin (trade names Fortaz and Tazicef) used to treat moderate infections,2248
117677,02409543,n,10,a parenteral cephalosporin (trade name Rocephin) used for severe infection of the lungs or throat or ears or urinary tract,2248
117680,02410183,n,10,a musical instrument consisting of graduated steel plates that are struck by hammers activated by a keyboard,2536
117681,02410345,n,10,a spherical model of the heavens,"1565,2772"
117682,02410439,n,10,a device that delivers an electric current as the result of a chemical reaction,2284
117683,02410657,n,10,a room where a prisoner is kept,2415
117684,02410874,n,10,small room is which a monk or nun lives,"1565,2415"
117686,02411112,n,10,space where wines are stored,
117687,02411207,n,10,a storage area in a cellar,2415
117688,02411289,n,10,a division of a prison (usually consisting of several cells),"1802,2415"
117690,02411607,n,10,a transparent paper-like product that is impervious to moisture and used to wrap candy or cigarettes etc.,
117691,02411769,n,10,"a hand-held mobile radiotelephone for use in an area divided into small sections (cells), each with its own short-range transmitter/receiver","1939,2107"
117692,02411991,n,10,a Latin cross with a ring surrounding the intersection,2425
117693,02412104,n,10,built to honor soldiers who died in a war,2772
117694,02412200,n,10,a container for burning incense (especially one that is swung on a chain in a religious ritual),
117696,02412654,n,10,a bit with a sharp center point for guidance and two side cutters,"1787,2415"
117697,02412789,n,10,a retractable fin keel used on sailboats to prevent drifting to leeward,"1942,2651,2772"
117699,02413170,n,10,placed at the center of something (as on a table),2410
117700,02413309,n,10,a thermometer calibrated in degrees centigrade,1951
117701,02413424,n,10,a telecommunications facility,"1939,2446"
117702,02413594,n,10,air or water is heated at a central furnace and sent through the building via vents or pipes and radiators,"1787,2415"
117704,02414131,n,10,CENTRal EXchange,1939
117705,02414201,n,10,a pump that use centrifugal force to discharge fluid into a pipe,2098
117706,02414328,n,10,uses centrifugal force to separate particles from a suspension,"2097,2279"
