118327,02509632,n,10,an equivalent counterbalancing weight,1787
118328,02509831,n,10,(British) offices used by the accountants of a business,
118329,02509946,n,10,a house (usually large and impressive) on an estate in the country,2415
118331,02510373,n,10,a two-door car with front seats and a luggage compartment,1946
118332,02510482,n,10,a mechanical device that serves to connect the ends of adjacent objects,2098
118339,02511950,n,10,a wool-like fabric,1787
118340,02512024,n,10,a building that houses judicial courts,2415
118341,02512138,n,10,a building that houses the offices of a county government,2415
118343,02512384,n,10,a loose-fitting garment that is worn over other clothing,2875
118344,02512549,n,10,a bridge whose passageway is protected by a roof and enclosing sides,1946
118345,02512678,n,10,a litter with a cover for privacy,1946
118347,02513049,n,10,an artifact that protects or shelters or conceals,
118348,02513603,n,10,a decorative bedspread (usually quilted),2875
118349,02513698,n,10,a plate used to cover over or close in a chamber or receptacle,
118350,02513818,n,10,a barn for cows,"2415,2446"
118351,02513919,n,10,a bell hung around the neck of cow so that the cow can be easily located,2101
118354,02514327,n,10,metal part that covers the engine,1946
118355,02514447,n,10,an enclosure for cattle,2338
118356,02514546,n,10,the main circuit board for a computer,1355
118357,02514673,n,10,a purified and potent form of cocaine that is smoked rather than snorted,2248
118358,02514797,n,10,a party favor consisting of a paper roll (usually containing candy or a small favor) that pops when pulled at both ends,
118359,02514997,n,10,a crate used for packing crackers,
118360,02515088,n,10,glazed china with a network of fine cracks on the surface,2446
118362,02515336,n,10,a vehicle designed for navigation in or on water or air or through outer space,1946
118364,02515681,n,10,a clamp for holding pieces of wood together while they are glued,2425
118365,02515797,n,10,an iron spike attached to the shoe to prevent slipping on ice when walking or climbing,2638
118368,02516321,n,10,an instrument for measuring skull sizes,1951
118369,02516418,n,10,rotating shaft with parallel handle,2415
118370,02516533,n,10,housing for a crankshaft,2098
118371,02516632,n,10,used to start an engine,2415
118372,02516732,n,10,a rotating shaft driven by (or driving) a crank,2098
118334,02510906,n,10,"a layer of masonry: ""a course of bricks""",2415
145964,06920049,n,10,fertility goddess in ancient mythology; wife of Cronus and mother of Zeus; identified with Roman Ops and Cybele of ancient Asia Minor,1566
174857,00874409,v,10,bend into the shape of a crank,
118405,02521149,n,10,a needle with a hook on the end; used in crocheting,
118375,02517175,n,10,neckwear worn in a slipknot with long ends overlapping vertically in front,2875
118418,02522816,n,10,a cross as an emblem of Christianity; used in heraldry,2425
118424,02523804,n,10,a rock drill having cruciform cutting edges; used in mining,2415
118427,02524162,n,10,a long racket with a triangular frame; used in playing lacrosse,2638
118429,02524549,n,10,metal block that connects to a piston; it slides on parallel guides and moves a connecting rod back and forth,2098
118396,02520021,n,10,child's bed with high sides,2410
118376,02517338,n,10,a colored stick of composition wax used for writing and drawing,2479
118377,02517467,n,10,a patchwork quilt without a design,2875
118378,02517559,n,10,any of various substances resembling cream that have a soothing effect when applied to the skin,2371
118379,02517783,n,10,a place where butter and cheese are made,2446
118380,02517878,n,10,an establishment where dairy products are sold,"2446,2872"
118381,02517979,n,10,a small pitcher for serving cream,1957
118382,02518101,n,10,something that has been brought into existence by someone,
118383,02518411,n,10,an institution where infant children of unknown parents are taken in and cared for,"1707,2232,2415,2446"
118385,02518684,n,10,a sideboard or buffet,2410
118386,02518771,n,10,a wicker basket used to hold fish,
118387,02518856,n,10,a pen that is fenced so that young animals can enter but adults cannot,2338
118388,02518978,n,10,a furnace where a corpse can be burned and reduced to ashes,
118389,02519145,n,10,a mortuary where corpses are cremated,"1707,2415,2446"
118390,02519252,n,10,a soft thin light cloth with a crinkled surface,1787
118391,02519413,n,10,a very thin crepe of silk or silklike fabric,1787
118392,02519518,n,10,"(heraldry) in medieval times, used to decorate a helmet",2794
118394,02519776,n,10,embroidery done with loosely twisted worsted yarn,"2425,2875"
118395,02519882,n,10,a plain straight neck opening from shoulder to shoulder of sweaters,2875
118398,02520281,n,10,ball used in playing cricket,"2633,2871"
118399,02520386,n,10,a bat used in playing cricket,2871
118400,02520498,n,10,equipment used in playing cricket,2871
118401,02520649,n,10,a metal ring for lining a small hole to permit the attachment of cords or lines,
118402,02520808,n,10,a stiff coarse fabric used to stiffen hats or clothing,1787
118403,02520918,n,10,full stiff petticoat made of crinoline,2875
118404,02521012,n,10,something created by interlocking looped stitches with a hooked needle,2425
118406,02521276,n,10,a stitch made by pulling a loop of thread through another loop with a crochet needle,2425
118407,02521493,n,10,an earthen jar (made of baked clay),
118408,02521598,n,10,eating and serving dishes collectively,1957
118409,02521792,n,10,an ornament of curved foliage used at the edge of a spire or gable,2446
118410,02521912,n,10,(Great Britain) a small farm worked by a crofter,"2314,2876"
118411,02522012,n,10,a long staff with one end being hook shaped,
118412,02522125,n,10,small paddlewheel that rotates when placed in daylight,1951
118413,02522244,n,10,original gas-discharge tube,"1355,2107,2284,2606"
118414,02522330,n,10,the stock or handle of a whip,
118415,02522429,n,10,a wooden ball used in playing croquet,"2633,2638"
118416,02522543,n,10,equipment used in playing croquet,2638
118417,02522694,n,10,a mallet used to strike the ball in croquet,2638
118419,02523138,n,10,a wooden structure consisting of an upright post with a transverse piece,
118420,02523262,n,10,long thin horizontal piece between two vertical posts,2415
118421,02523389,n,10,horizontal bar to be jumped or vaulted over,2633
118422,02523487,n,10,a horizontal bar that goes across something,2415
118425,02523919,n,10,a bow fixed transversely on a wooden stock grooved to direct the arrow (quarrel),1781
118426,02524054,n,10,cuts at right angles to the grain (or major axis),2415
118430,02524733,n,10,a place (often marked) where a street or railroad can be crossed,1946
118431,02524918,n,10,the lowermost sail on a mizzenmast,"1787,1942"
118432,02525024,n,10,a transverse brace,2415
118433,02525189,n,10,embroidery done in cross-stitch,"2425,2875"
118434,02525279,n,10,two stitches forming a cross or X,2425
118435,02525389,n,10,a small tool or hook-like implement,
118393,02519644,n,10,an unglazed heavy fabric; brightly printed; used for slipcovers and draperies,1787
146034,06931292,n,10,hero of American folk tales; portrayed as an enormously strong black man who worked on the railroads and died from exhaustion after winning a contest with a steam drill,2657
174858,00874502,v,10,"free from flexure, as of a bow",
118457,02528213,n,10,small; holds liquid (oil or water),
118492,02532571,n,10,a specialized endoscope for visually examining a woman's pelvic organs,2232
169731,00063224,v,10,"undergo atrophy: ""Muscles that are not used will atrophy""",
118456,02528056,n,10,a strap from the back of a saddle passing under the horse's tail; prevents saddle from slipping forward,2188
118436,02525479,n,10,a small rake used by a croupier to move chips around on the table,2633
118437,02525606,n,10,a heavy iron lever with one end forged into a wedge,"2098,2415"
118438,02525778,n,10,the part of a hat covering the crown of the head,2875
118439,02525897,n,10,an ornamental headdress signifying sovereignty,"2474,2875"
118440,02526040,n,10,a wreath or garland worn on the head to signify victory,
118441,02526165,n,10,the center of a cambered road,1946
118442,02526273,n,10,the jewellery and other paraphernalia worn by a sovereign on state occasions,2474
118443,02526426,n,10,a lens made of optical crown glass,2102
118444,02526517,n,10,a mock crown made of thorn branches that Roman soldiers placed on Jesus before the Crucifixion,
118445,02526673,n,10,a saw having teeth around the edge of a hollow cylinder,2415
118446,02526784,n,10,an artificial crown for a tooth,2265
118447,02526877,n,10,platform for a lookout at or near the top of a mast,1942
118448,02527005,n,10,a vessel of heat-resisting material used for high temperature chemical reactions,
118449,02527154,n,10,image of cross on which Jesus died,2425
118450,02527262,n,10,holds wine or oil or vinegar for the table,
118451,02527365,n,10,a stand for cruets containing various condiments,2410
118452,02527471,n,10,mechanism for keeping an automobile at a set speed,2098
118455,02527956,n,10,a passenger ship used for pleasure cruises,"1942,2772"
118458,02528299,n,10,a device that crushes something,2098
118460,02528552,n,10,an instrument for destroying tissue by freezing it,2232
118461,02528660,n,10,a thermometer designed to measure low temperatures,1951
118462,02528766,n,10,an instrument for measuring freezing and melting points,1951
118463,02528877,n,10,a thermostat that operates at very low temperatures,2098
118464,02528983,n,10,a cellar or vault or underground chamber (especially beneath a church),"1565,2446,2800"
118465,02529105,n,10,a device for deciphering codes and ciphers,1969
118466,02529205,n,10,a protective cover that protects the face of a watch,1951
118467,02529360,n,10,glassware made of quartz,1957
118468,02529438,n,10,a crystalline element used in various electronic devices,"1951,2284"
118469,02529642,n,10,ionizing event increases conductivity,1951
118471,02529906,n,10,sound waves vibrate a piezoelectric crystal that generates a varying voltage,2284
118472,02530066,n,10,produces electrical oscillations at a frequency determined by the physical characteristics of a piezoelectric quartz crystal,"2107,2284"
118473,02530275,n,10,output voltage is produced by the vibration of a piezoelectric crystal,"2284,2536"
118475,02530523,n,10,a small secluded room,2415
118476,02530626,n,10,a small compartment,
118477,02530714,n,10,something in the (approximate) shape of a cube,
118478,02530862,n,10,a cigarette containing cubeb,
118479,02530979,n,10,armor that protects the elbow,"1781,2768"
118480,02531083,n,10,a chair in which offenders were ducked in water as a form of punishment,1802
118481,02531230,n,10,announces the hours with a sound like the call of the cuckoo,1951
118482,02531349,n,10,the galley or pantry of a small ship,"1942,2415"
118483,02531456,n,10,used as a weapon,
118484,02531561,n,10,tapering rod used to strike a cue ball in pool or billiards,2638
118485,02531725,n,10,the ball that the player strikes with his cue,2633
118486,02531825,n,10,the turned-back hem encircling the end of the sleeve or leg,2875
118487,02532019,n,10,one of a pair of linked buttons used in the cuffs of a shirt,2474
118488,02532134,n,10,medieval body armor that covers the chest and back,"1781,2768"
118489,02532257,n,10,protects the thigh,"1781,2768"
118490,02532347,n,10,a passage with access only at one end,1946
118491,02532457,n,10,a corbel resembling the conical bottom of ancient lamps,2415
118493,02532698,n,10,a gutter in a roof,2415
118494,02532788,n,10,a divided skirt,2875
118496,02533070,n,10,a transverse and totally enclosed drain under a road or railway,"1946,2306"
118474,02530425,n,10,a broad medium-high heel on women's shoes,2875
146078,06938309,n,10,"(informal) a reference to yourself or myself etc; ""take care of number one"" means to put your own interests first",2516
118523,02537290,n,10,a man's coat cut diagonally from the waist to the back of the knees,2875
118514,02535919,n,10,a square comb with rows of small teeth; used to curry horses,2188
118497,02533187,n,10,a broad pleated sash worn as formal dress with a tuxedo,2875
118515,02536035,n,10,(computer science) a movable spot of light (an icon) on a visual display; moving the cursor allows the user to point to commands or screen positions,1355
118508,02534996,n,10,"the side of a sidewalk that is bordered by a curb: ""policemen stood at intervals along the curbside""",
118527,02537872,n,10,a short heavy curved one-edged sword; formerly used by sailors,1781
118535,02538948,n,10,"a low stool; formerly in Scotland, a seat in a church where an offender was publicly rebuked",2410
118538,02539381,n,10,"a shortened version of ""bicycle"" or ""tricycle"" or ""motorcycle""",1946
118548,02541032,n,10,(classical architecture) a molding for a cornice; in profile it is partly concave and partly convex,2446
118549,02541193,n,10,a percussion instrument consisting of a concave brass disk; makes a loud crashing sound when hit with a drumstick or when two are struck together,2536
118506,02534722,n,10,a horse's bit with an attached chain or strap to check the horse,2651
118501,02534044,n,10,a small room (or recess) or cabinet used for storage,2410
118502,02534232,n,10,classical double-curved bow with reversed curve ends,1781
118503,02534342,n,10,a roof in the form of a dome,2415
118504,02534423,n,10,a vertical cylindrical furnace for melting iron for casting,
118505,02534535,n,10,an edge between a sidewalk and a roadway consisting of a line of curbstones (usually forming part of a gutter),1946
118507,02534848,n,10,a roof with two or more slopes on each side of the ridge,2415
118509,02535151,n,10,a paving stone forming part of a curb,"1946,2415"
118510,02535275,n,10,a surgical instrument shaped like a scoop to remove tissue from a bodily cavity,2232
118511,02535416,n,10,something unusual -- perhaps worthy of collecting,
118513,02535788,n,10,a cylindrical metal appliance that heats a lock of hair curled around it,2353
118516,02536246,n,10,hanging cloth used as a blind,2410
118517,02536489,n,10,a circular ring for holding up a curtain,2875
118518,02536588,n,10,a soft bag filled with air or a mass of padding such as feathers or foam rubber etc,2410
118519,02536869,n,10,point formed by two intersecting arcs (as from the intrados of a Gothic arch),1422
118520,02536997,n,10,a decoration using cusps,
118521,02537079,n,10,a trench resembling a furrow that was made by erosion or excavation,1946
118522,02537203,n,10,a canal made by erosion or excavation,1946
118524,02537411,n,10,a drawing or model of something in which the outside is omitted to reveal the inner parts,2479
118525,02537588,n,10,glass decorated by facet-cutting or grinding,1957
118528,02537997,n,10,implements for cutting and eating food,1957
118529,02538162,n,10,a device that terminates the flow in a pipe,
118530,02538258,n,10,a part that is cut out or is intended to be cut out,
118531,02538362,n,10,a tool for cutting,2415
118532,02538566,n,10,a single-masted sailing vessel,1942
118533,02538649,n,10,a tool used for cutting or slicing,2415
118536,02539098,n,10,embroidery in which the design is outlined in a buttonhole stitch and the intervening material is cut away,"2425,2875"
118537,02539258,n,10,art that is produced with the help of computer hardware and software,2425
118539,02539603,n,10,a primitive style of masonry characterized by use of massive stones of irregular shape and size,
118540,02539762,n,10,a colorless flammable gas sometimes used as an anesthetic,2248
118541,02539878,n,10,an antibiotic that is especially active against the tubercle bacillus,2248
118542,02540005,n,10,a writing implement with a small toothed wheel that cuts small holes in a stencil,1422
118543,02540143,n,10,an accelerator that imparts energies of several million electron-volts to rapidly moving particles,2097
118544,02540351,n,10,a cylindrical container for oxygen or compressed air,
118545,02540477,n,10,within which piston moves,"1787,2098"
118546,02540668,n,10,a detachable plate that covers the closed end of a cylinder chamber in a reciprocating engine or pump,2098
118550,02541427,n,10,an antihistamine (trade name Periactin) used to treat some allergic reactions,2248
118552,02541776,n,10,Russian country house,2415
118553,02541849,n,10,a concentration camp created by the Nazis near Munich in S Germany,"1802,1820,2772"
118554,02541987,n,10,a polyester fabric,1787
118555,02542078,n,10,a rectangular groove cut into a board so that another piece can fit into it,
118500,02533850,n,10,"the hole (or metal container in the hole) on a golf green; ""he swore as the ball rimmed the cup and rolled away""; ""put the flag back in the cup""",2871
146164,06960074,n,10,a white native of Cape Province who is a descendant of Dutch settlers and who speaks Afrikaans,1675
118581,02545745,n,10,a mechanical damper; the vibrating part is attached to a piston that moves in a liquid-filled chamber,"2098,2306"
118590,02546958,n,10,an armless couch; a seat by day and a bed by night,2410
118604,02548608,n,10,any structure that is very unsafe; where people are likely to be killed,
118556,02542204,n,10,the part of a pedestal between the base and the surbase,2446
118609,02549426,n,10,a folding chair for use outdoors; a wooden frame supports a length of canvas,2410
169804,00073223,v,10,"fracture a bone of: ""I broke my foot while playing hockey""",2232
118597,02547809,n,10,a strong shutter over a ship's porthole that is closed in stormy weather,2415
118557,02542329,n,10,a plane for making a dado groove,"2415,2425"
118559,02542607,n,10,a removable board on a small sailboat that can be lowered into the water to serve as a keel,"1942,2651,2772"
118561,02542958,n,10,a farm where dairy products are produced,"2314,2876"
118562,02543063,n,10,a platform raised above the surrounding level to give prominence to the person on it,2446
118564,02543397,n,10,a wheel around which is a set of print characters that make a typing impression on paper,"1422,2098"
118565,02543582,n,10,a printer that uses a daisy print wheel,1422
118566,02543705,n,10,a barrier constructed to contain the flow or water or to keep out the sea,
118567,02543940,n,10,a design produced by inlaying gold or silver into steel,2425
118568,02544051,n,10,a fabric of linen or cotton or silk or wool with a reversible pattern woven into it,1787
118569,02544187,n,10,a table linen made from linen damask,2353
118570,02544276,n,10,"a device that decreases the amplitude of electronic, mechanical, acoustical, or aerodynamic oscillations",2279
118571,02544487,n,10,a movable iron plate that regulates the draft in a stove or chimney or furnace,2415
118572,02544637,n,10,a small felted block that drops onto a piano string to stop its vibration,2098
118573,02544803,n,10,a bare floor polished for dancing,2415
118574,02544894,n,10,a lantern with a sliding panel to conceal the light,
118575,02545004,n,10,a room in which photographs are developed,2415
118576,02545100,n,10,a long needle with an eye large enough for heavy darning or embroidery thread,
118577,02545258,n,10,a tapered tuck made in dressmaking,2875
118578,02545362,n,10,a small narrow pointed missile that is thrown or shot,1781
118579,02545484,n,10,a circular board of wood or cork used as the target in the game of darts,2633
118580,02545625,n,10,panel on an automobile or airplane containing dials and controls,2284
118582,02545901,n,10,a thin glass globe that is weighed in a gas to determine its density,1951
118583,02546025,n,10,device for changing information from one code to another,1355
118585,02546349,n,10,the network of all communication channels used within an organization,1355
118586,02546515,n,10,an unskillful painting,2511
118587,02546588,n,10,a large sofa usually convertible into a bed,2410
118588,02546705,n,10,a small decorative writing desk,2410
118589,02546792,n,10,a cranelike device (usually one of a pair) for suspending or lowering equipment (as a lifeboat),"1787,1942"
118592,02547209,n,10,a camp providing care and activities for children during the daytime,2600
118593,02547332,n,10,a nursery for the supervision of preschool children while the parents work,2415
118594,02547482,n,10,a school building without boarding facilities,"1919,2415"
118595,02547584,n,10,an axle that carries a wheel but without power to drive it,
118596,02547716,n,10,a train or bus or taxi traveling empty,"1707,1946"
118598,02547956,n,10,a constant load on a structure (e.g. a bridge) due to the weight of the supported structure itself,
118599,02548110,n,10,the official residence of a dean,2415
118600,02548196,n,10,the bed on which a person dies,2410
118601,02548281,n,10,the part of a prison where those condemned to death await execution,2415
118602,02548406,n,10,a bell rung to announce a death,2101
118603,02548508,n,10,a cast taken from the face of a dead person,
118605,02548735,n,10,a design fixed to some surface or a paper bearing the design to be transferred to the surface,2425
118606,02548913,n,10,any of various floor-like platforms built into a vessel,1942
118607,02549218,n,10,(slang) a packet of narcotics,2248
118608,02549316,n,10,a porch that resembles the deck on a ship,2415
118611,02549732,n,10,a superstructure on the upper deck of a ship,1942
118612,02549852,n,10,(paper making) a frame used to form paper pulp into sheets,1787
118613,02549963,n,10,rough edge left by a deckle on handmade paper or produced artificially on machine-made paper,
118563,02543251,n,10,a string of daisies linked by their stems; worn by students on class day at some schools,
146206,06966571,n,10,a member of the Turkic-speaking people living from the Volga to the Ural Mountains (the name has been attributed to many other groups),2772
174860,00874737,v,10,make gouges into a surface,
118632,02553394,n,10,(British colloquialism) an excavation; usually a quarry or mine,1787
118633,02553508,n,10,a style of glazed earthenware; usually white with blue decoration,2446
118639,02554304,n,10,small; for serving black coffee,1957
118648,02555378,n,10,a substance for cleaning the teeth; applied with a toothbrush,2371
118656,02556707,n,10,a bomb that explodes at a pre-set depth under water; anti-submarine device,2110
118662,02557662,n,10,"a preliminary sketch indicating the plan for something: ""the design of a building""",2479
118663,02557797,n,10,a drug deliberately synthesized to avoid anti-drug laws; mimics the effects of a banned drug; law was revised in 1986 to ban designer drugs,2248
118614,02550122,n,10,an instrument for measuring magnetic declination,1951
118661,02557306,n,10,"a decorative or artistic work: ""the coach had a design on the doors""",2425
118615,02550252,n,10,a machine that converts a coded text into ordinary language,"1969,2098"
118617,02550460,n,10,a drug that decreases pulmonary congestion,2248
118618,02550579,n,10,something used to beautify,
118619,02551265,n,10,(computer science) a file server that can be used only as a file server,1355
118620,02551422,n,10,a refrigerator in which food is frozen and stored for long periods of time,2353
118622,02551693,n,10,a trail worn by the passage of deer,1946
118623,02551785,n,10,the weaponry available for the defense of a region,1781
118626,02552436,n,10,the arrangement of defensive fortifications to protect against enemy fire,1781
118627,02552564,n,10,a device intended to turn aside the flow of something (water or air or smoke etc),2098
118628,02552701,n,10,removes ice or frost (as from a windshield or a refrigerator or the wings of an airplane),2410
118629,02552855,n,10,a suspension bridge across the Delaware River,"1946,2772"
118630,02552990,n,10,a mechanism that automatically delays the release of a camera shutter for a fixed period of time so that the photographer can appear in the picture,"2098,2527"
118631,02553217,n,10,a circuit designed to introduce a calculated delay into the transmission of a signal,2284
118634,02553625,n,10,a shop selling delicatessen (as salads or cooked meats),2872
118635,02553776,n,10,a drawing of the outlines of forms or objects,2479
118636,02553916,n,10,a van suitable for delivering goods or services to customers,1946
118638,02554208,n,10,removes mist from the windshield of a car,1948
118640,02554391,n,10,soothes inflamed mucous membrane,2248
118641,02554479,n,10,a room that is comfortable and secluded,2415
118642,02554587,n,10,a coarse durable twill-weave cotton fabric,1787
118643,02554699,n,10,an instrument for determining density or specific gravity,1951
118644,02554831,n,10,an instrument for determining optical or photographic density,1951
118645,02554969,n,10,a device to repair teeth or replace missing teeth,2265
118646,02555171,n,10,a soft thread for cleaning the spaces between the teeth,
118647,02555293,n,10,replaces a natural tooth,2265
118649,02555532,n,10,a high speed drill that dentists use to cut into teeth,2415
118650,02555680,n,10,a dental appliance that artificially replaces missing teeth,2265
118651,02555829,n,10,a toiletry applied to the skin in order to mask unpleasant odors,2371
118653,02556156,n,10,a cosmetic for temporary removal of undesired hair,2371
118654,02556263,n,10,a place where things can be deposited for safekeeping,
118655,02556577,n,10,a device used by physician to press a part down or aside,2232
118657,02556853,n,10,an instrument used to cut very thin slices of skin,2232
118658,02556959,n,10,a simple crane having lifting tackle slung from a boom,1787
118659,02557067,n,10,a framework erected over an oil well to allow drill tubes to be raised and lowered,
118660,02557203,n,10,a short-barreled pocket pistol of large caliber,1781
