 rueful manner: """"I made a big mistake,"" he said ruefully""",
202497,00456629,r,10,toward the south,
202502,00457253,r,10,in a specious manner,
202507,00457835,r,10,in an unsportsmanlike manner,2234
202444,00449842,r,10,"in a sketchy incomplete manner: ""he explained sketchily""; ""the dishes were only sketchily washed""",
202446,00450165,r,10,"in a skimpy manner: ""a skimpily dressed woman""","1951,2234"
202447,00450266,r,10,"in a skittish manner: ""the horse pranced around skittishly""",
202449,00450546,r,10,"in a lavish or enthusiastic manner: ""he extolled her virtues sky-high""",
202454,00451174,r,10,"at excessive speeds: ""yachts ran slap-bang into the convoy at 15 knots an hour""",
202459,00451768,r,10,"without sleep; in a sleepless manner: ""he was lying in bed sleeplessly""",
202453,00451069,r,10,at a slant; moving or directed in a slantwise position or direction,
202455,00451291,r,10,"in a slapdash manner: ""the shelves were put up slapdash""",
202457,00451511,r,10,"in a sleek glossy manner: ""the wet road was shining sleekly""",
202460,00451897,r,10,"in a slim or slender manner: ""a slenderly built woman""; ""slightly built""",2097
202467,00452838,r,10,"without smiling; in an unsmiling manner: ""unsmilingly, he greeted his in-laws""",
202462,00452237,r,10,"in a sloppy manner: ""this work was done rather sloppily""",
202463,00452348,r,10,"with a slouching gait or posture: ""he stood slouchingly at the garden gate""",2233
202464,00452481,r,10,"in a slouchy manner: ""slouchily dressed""",
202465,00452577,r,10,"with a loud crash: ""the car went smash through the fence""",
202480,00454780,r,10,"in a somber manner: """"That's sure bad news,"" said Dowd, somberly""",1502
202472,00453534,r,10,"with a sneer; in an uncomplimentary sneering manner: """"I don't believe in these customs,"" he said sneeringly""",
202474,00453968,r,10,"with sobs: ""sobbingly, the teenager admitted killing the baby""",
202475,00454068,r,10,"in a sociable manner: ""sociably, the new neighbors invited everyone on the block for coffee""",
202477,00454376,r,10,"with regard to sociology: ""sociologially speaking, this is an interesting phenomenon""",1675
202479,00454673,r,10,"in solitude: ""a hermit chooses to live solitarily""",
202486,00455458,r,10,"all at the same time: ""Let's say ""Yes!"" all at once""",
202481,00454911,r,10,"in a soothing manner: ""the mother talked soothingly to her child""",1718
202482,00455033,r,10,"extremely: ""dripping wet,"" ""soaking wet""",
202498,00456696,r,10,"in a spare manner: ""William held me longest with his recent bronzes sparely arranged at Waddington's galleries""","1951,2234"
202492,00456009,r,10,"in a soulless manner: ""they were soullessly grubbing for profit""",1502
202494,00456328,r,10,"in a sour manner: ""he complained sourly that the new rules only benefitted the managers""",
202495,00456469,r,10,"from the south: ""a wind blew southerly""",
202500,00456956,r,10,"in spurts and fits: ""I began to write intermittently and spasmodically""",
202443,00449748,r,10,"in the sixth place: ""sixthly, we cannot afford a vacation""",
202503,00457330,r,10,"by spectrographic means: ""the speech spectrum was displayed spectrographically""",2102
202505,00457624,r,10,"with spirals: ""spirally fluted handles""",
202508,00457940,r,10,"without suspicions: ""he was sitting unsuspectingly beyond that wall only a few yards from the burglar""",
202506,00457718,r,10,so as to be sporting; in a sporting manner,2234
202509,00458103,r,10,"in a spotless manner: ""spotlessly clean""",2232
202511,00458294,r,10,"in a false and spurious manner: ""the lawyer argued spuriously that his client knew nothing of the burglary""",
202513,00458588,r,10,"in a stagy and theatrical manner: """"I cannot show my face at her house,"" he declared theatrically""",
202514,00458773,r,10,"with a stammer: """"Will you marry me?"" he asked stammeringly""",
202516,00459073,r,10,"with a stare: """"quoi?"" asked Blanchard, staring""",
202517,00459169,r,10,"completely: ""stark mad""; ""mouth stark open""",
202518,00459246,r,10,"in a blunt manner: ""in starkly realistic terms""",
202451,00450852,r,10,"with slang; in a slangy manner: ""he expresses himself slangily""",
202538,00461770,r,10,"in the following part of a given matter, as in a document or speech",
202565,00465304,r,10,to a superlative degree,"1951,2234"
202571,00466103,r,10,in the manner of one who is surprised,
202522,00459705,r,10,"in a startling manner: ""a startlingly modern voice""",
202525,00460072,r,10,"in a steep manner: ""the street rose steeply up to the castle""",
202521,00459592,r,10,"in a static manner: ""a statically determinate connexion""",1753
202527,00460311,r,10,"in a sticky viscid manner: ""he felt the blood move stickily from his split scalp and trickle down his forehead""",
202528,00460506,r,10,"extremely: ""bored stiff""; ""frightened stiff""",
202530,00460689,r,10,"in a stingy manner: ""their rich uncle treated them rather chintzily""",2234
202531,00460870,r,10,"in a stirring manner: ""he talked stirringly about his days during the war""",
202534,00461350,r,10,"in a direct course: ""plunged straightway to the rocks below""",
202535,00461450,r,10,"at once: ""straightway the clouds began to scatter""",
202536,00461540,r,10,"near that place: ""he stayed in London or thereabouts for several weeks""",
202537,00461664,r,10,"near that time or date: ""come at noon or thereabouts""",
202540,00461981,r,10,"on that: ""text and commentary thereon""",
202541,00462073,r,10,"to that: ""with all the appurtenances fitting thereto""",
202542,00462180,r,10,"under that: ""the headings and the items listed thereunder""",
202546,00462787,r,10,"in a stocky manner: ""he was stockily built""",2097
202549,00463118,r,10,"with regard to strategy: ""strategically important decisions""",1794
202550,00463238,r,10,"in a strident manner: ""the cheap clock ticked stridently""",
202557,00464099,r,10,"with suavity; in a suave manner: ""he is suavely charming and all the ladies love him""",
202552,00463523,r,10,"in a stuffy manner: """"Come in please,"" he said stuffily""",2234
202553,00463663,r,10,"to a stupendous degree: ""stupendously ignorant people""","1951,2234"
202554,00463776,r,10,"in a sturdy manner: ""feet sturdily apart""",
202555,00463872,r,10,"in a stylish manner: ""she was dressed very stylishly""",
202559,00464407,r,10,"in a subtle manner: ""late nineteenth-century French opera at its most beautiful, subtly romantic with a twilight melancholy""",
202561,00464745,r,10,"in an unromantic manner: ""we got married, rather unromatically, in a dingy office in the town hall""",2234
202563,00465023,r,10,"without delay; in a summary manner: ""the suspected spy was summarily executed""",
202566,00465387,r,10,"in a superstitious manner: ""superstitiously he refused to travel on Friday the 13th""",
202567,00465533,r,10,"in an indifferently supine manner: ""he called the tune to me and I supinely took it up""",
202575,00466795,r,10,"in synchrony; in a synchronous manner: ""in four-chambered hearts, the two auricles move synchronously""",
202569,00465792,r,10,"in a surreptitious manner: ""he was watching her surreptitiously as she waited in the hotel lobby""",
202570,00465980,r,10,"to a surpassing degree: ""she was a surpassingly beautiful woman""",2234
202574,00466662,r,10,"with great ease and success: ""in spite of some mishaps, everything went swimmingly""",
202580,00467675,r,10,"with regard to tactics: ""the tactically useful province is still firmly in the rebels"" hands""",1794
202582,00467962,r,10,"in a tangible manner: ""virtue is tangibly rewarded""",1753
202577,00467148,r,10,"in a tacit manner; by unexpressed agreement: ""they are tactily expected to work 10 hours a day""",2234
202578,00467297,r,10,"showing tact or tactfulness; in a tactful manner: ""he stepped tactfully in to prevent trouble""",
202585,00468344,r,10,"without taste or in poor taste; in a tasteless manner: ""the house was tastelessly decorated""",
202583,00468068,r,10,"in a tart manner: """"Never mind your immortal soul,"" she said tartly""",2234
202586,00468512,r,10,"in a tasty manner: ""the meal was tastily cooked""",1957
202588,00468783,r,10,"in a taut manner: ""the rope was tautly stretched""",
202589,00468885,r,10,"with tears; in a tearful manner: ""the man confessed tearfully to having beaten his wife""",
202592,00469432,r,10,"in a telling manner: ""the plain manner of its style all the more tellingly points up the horror of the case""",
202593,00469596,r,10,"without extravagance: ""these preferences are temperately stated""",
202596,00469972,r,10,"with tenderness; in a tender manner: ""tenderly she placed her arms round him""",
202594,00469718,r,10,"with restraint: ""he used the privileges of his office temperately""",
202523,00459814,r,10,"according to statute: ""placed statutorily under the council's supervision""",1802
202547,00462885,r,10,"without emotion; in a stoic manner: ""he stoically accepted all sufferiang""",
202597,00470104,r,10,"(in enumerating something, such as topics or points of discussion) in the tenth place",
202623,00473486,r,10,"the next day, the day after, following the present day",
202629,00474230,r,10,in a transcendental way or to a transcendental extent,
202631,00474544,r,10,as a transitional step or in a transitional manner,
202632,00474655,r,10,for a very brief time,1463
202647,00476667,r,10,in a typographic way,
202648,00476749,r,10,beyond the scope or in excess of legal power or authority,
202663,00479127,r,10,in an uncompromising manner,
202664,00479217,r,10,in an undesirable manner,
202666,00479439,r,10,in an unusual manner,2234
202605,00471169,r,10,"in a widely distributed manner: ""thinly overgrown mountainside""",
202603,00470916,r,10,"according to tradition; in a traditional manner: ""traditionally, we eat fried foods on Hanukah""",
202607,00471468,r,10,"with thickness; in a thick manner: ""spread 1/4 lb softened margarine or cooking fat fairly thickly all over the surface""; ""we were visiting a small, thickly walled and lovely town with straggling outskirt""","1951,2234"
202609,00471923,r,10,"without viscosity: ""the blood was flowing thin""","2111,2234"
202645,00476422,r,10,"by tutorials; in a tutorial manner: ""undergraduates are better taught tutorially""",1898
202610,00472048,r,10,"without force or sincere effort: ""smiled thinly""",
202611,00472149,r,10,"with a thick consistency: ""the blood was flowing thick""",2111
202615,00472743,r,10,"from one end or side to the other: ""jealousy pierced her through""",
202616,00472844,r,10,"over the whole distance: ""this bus goes through to New York""",
202618,00473031,r,10,"from beginning to end: ""read this book through""",
202619,00473114,r,10,"to completion: ""think this through very carefully!""",
202621,00473319,r,10,"to the highest extent: ""the shoes fit me tip-top""",
202624,00473577,r,10,"in a monotone: """"Come in,"" she said tonelessly""",
202620,00473201,r,10,"in a timorous and trepid manner""",1502
202626,00473904,r,10,"in a tortuous manner: ""tortuously haggling over the price""",
202627,00474001,r,10,"in a touchy manner: ""he touchily refused all offers to help""",1502
202628,00474116,r,10,"in a ruggedly tough manner: ""toughly vigorous story-telling""",
202633,00474735,r,10,"so as to allow the passage of light: ""the red brilliance of the claret shines transparently in our glasses""",2234
202635,00475080,r,10,"in a tremulous manner: ""the leaves rustled tremulously in the wind""",
202637,00475350,r,10,"in a trite manner: ""tritely expressed emotions""",2234
202639,00475570,r,10,"with little effort: ""we can prove trivially that this theorem is false""",
202657,00478266,r,10,"without someone's knowledge; ""unbeknownst to me, she made all the arrangements""",
202640,00475697,r,10,"in a tropical manner: ""it was tropically hot in the greenhouse""",2097
202642,00475954,r,10,"in an aggressively truculent manner: ""they strive for security by truculently asserting their own interests""",
202643,00476120,r,10,"in a tumultuous and riotous manner: ""the crowd was demonstrating tumultuously""",
202646,00476560,r,10,"by a factor of two: ""the price increased twofold last year""",
202650,00476997,r,10,"in an unalterable and unchangeable manner: ""his views were unchangeably fixed""",2234
202655,00478037,r,10,"without forethought or plan; inadvertently: ""came upon the diamond unawares""",
202652,00477517,r,10,"in an unassuming manner: ""she is unassumingly skeptical of her own work""",
202653,00477648,r,10,"in an unattainable manner or to an unattainable degree: ""this house is unattainably expensive""",
202656,00478150,r,10,"to an unbearable degree: ""it was unbearably hot in theroom""",
202659,00478565,r,10,"in an uncanny manner: ""uncannily human robots""",
202660,00478667,r,10,"showing lack of certainty: ""he paused uncertainly""",1502
202600,00470511,r,10,"as regards theology: ""the candidate was found theologically sound""",1608
202662,00479006,r,10,"exceptionally: ""a common remedy is uncommonly difficult to find""",2234
202665,00479299,r,10,"in an unwanted manner: ""he was unwantedly friendly""",
202667,00479516,r,10,"in an unconcerned manner: ""war was breaking out in Europe, but she unconcernedly planned for a holiday""",
202668,00479679,r,10,"in an uncontrolled manner: ""she laughed uncontrollably""",
202636,00475205,r,10,"in a vigorous and effective manner: ""he defended his client's civil rights trenchantly""",2234
202601,00470637,r,10,"by thermostat; in a thermostatic manner: ""the temperature is thermostatically controlled""",2098
203195,N0000717,n,11,,
202670,00479940,r,10,in an unctuous manner,2234
202692,00482538,r,10,to an unimaginable extent,
202696,00483139,r,10,with precedent,
202697,00483231,r,10,in an unprecedented manner,
202699,00483446,r,10,in an unrestrained manner,
202701,00483676,r,10,in an unstinting manner,2234
202706,00484478,r,10,in an unworthy manner,2234
202712,00485050,r,10,in an upright position,2234
202720,00486072,r,10,in a vacuous manner,
202730,00487357,r,10,in a watchful manner,
202738,00488292,r,10,in a vulnerable manner,
202739,00488371,r,10,in a waggish manner,
202743,00488773,r,10,with riches,1753
202673,00480332,r,10,"down below: ""get under quickly!""",
202675,00480471,r,10,"below some quantity or limit: ""fifty dollars or under""",
202678,00480779,r,10,"into unconsciousness: ""this will put the patient under""",
202702,00483758,r,10,"without swerving; in an direct and unswerving manner: ""the ship travelled unswervingly through the night""",2234
202679,00480868,r,10,"through a range downward: ""children six and under will be admitted free""",
202682,00481193,r,10,"in or into hiding or secret operation: ""the organization was driven underground""",
202680,00480974,r,10,"with the hand swung below shoulder level""; ""throwing a ball underarm""",
202684,00481565,r,10,"under or below an object or a surface: ""we could see the original painting underneath""",
202685,00481690,r,10,"beneath by way of support: ""a house with a good foundation underneath""",
202686,00481799,r,10,"lower down on the page: ""diagrams with figures underneath""",
202688,00482010,r,10,"to an undue degree: ""she was unduly pessimistic about her future""",
202689,00482128,r,10,"in an uneventful manner: ""the space shuttle landed uneventfully""",
202690,00482251,r,10,"in an ungrammatical manner: ""this child speaks ungrammatically""",
202693,00482654,r,10,"without interruption: ""this pleasant state of affairs had continued peacefully and uninterruptedly for many years""",
202695,00483024,r,10,"in a natural or normal manner: ""speak naturally and easily""",2234
202698,00483337,r,10,"without reservation: ""I can unreservedly recommend this restaurant!""",
202704,00484044,r,10,"in a untrue manner: ""he silenced the whisperings which connected her, untruly and unfairly, with his separation from his wife""",
202721,00486147,r,10,"with valor; in a valiant manner: ""he fought valiantly until the end""",
202707,00484556,r,10,"to or in the interior of a country or region: ""they live upcountry""",
202708,00484662,r,10,"upward on a hill or incline: ""this street lay uphill""",
202709,00484750,r,10,"against difficulties: ""she was talking uphill""",
202710,00484831,r,10,"in or into the highest position: ""the blade turned uppermost""",
202713,00485128,r,10,"in an honorable manner: ""he acted honorably""",2234
202714,00485276,r,10,"in a dishonorable manner: ""he acted dishonorably""",2234
202715,00485402,r,10,"in an urbane manner: """"I had tea occasionally with the Duke,"" said Mr. Eggers urbanely""",
202717,00485690,r,10,"in a useless manner: ""the furniture was sitting around uselessly""",2234
202718,00485829,r,10,"in a loving and uxorious manner: ""he kept deferring uxoriously to Mary""",
202722,00486302,r,10,"in a valid manner: ""this may not validly be done""",
202724,00486522,r,10,"with variation; in a variable manner or to a variable degree: ""it will be variably cloudy""",
202726,00486796,r,10,"in a verbose manner: ""she explained her ideas verbosely""",1969
202729,00487217,r,10,"indirectly, as, by, or through a substitute: ""she enjoyed the wedding vicariously""",
202731,00487465,r,10,"in a vile manner: ""his vilely spelt and illiterate letters""",2234
202672,00480242,r,10,"further down: ""see under for further discussion""",
202733,00487731,r,10,"lively, in music: ""play this section vivace!""",
202734,00487811,r,10,"with vivacity: ""he describes his adventures vivaciously""",
202735,00487925,r,10,"in a shapely and voluptuous manner: ""a voluptuously curved woman""",
202737,00488163,r,10,"like a voyeur: ""he sneaks voyeuristically around the swimming pool""","1703,2516"
202740,00488446,r,10,"up to the waist: ""the water rose waist-high""",
202741,00488542,r,10,"in a weak or pale or languid manner: ""she was smiling wanly""",
202744,00488840,r,10,"as something very heavy: ""she moved weightily""",
202745,00488942,r,10,"in a serious manner: ""the speech was weighty and it was weightily delivered""",2234
202677,00480684,r,10,"down to defeat, death, or ruin: ""the competitiors went under""",
202752,00489766,r,10,as a result of which,
202761,00490532,r,10,in any place whatever,
202762,00490593,r,10,"to what place, purpose, or end",
202764,00490760,r,10,to or unto which,
202768,00491243,r,10,in a whining manner,
202783,00493129,r,10,in a manner to cause worry,
202786,00493469,r,10,in a worthless manner,
202795,00494543,r,10,"in the space between decks, on a ship",
202800,00495183,r,10,in a bonny manner,2234
202805,00495697,r,10,in a clammy manner,
202806,00495770,r,10,in a conjugal manner,1675
202807,00495877,r,10,in a constrained manner,
202810,00496182,r,10,in a coordinated manner,2234
202811,00496264,r,10,in a corrupt manner,2234
202813,00496475,r,10,in a dingy manner,2232
202814,00496604,r,10,in a rambling manner,
202815,00496696,r,10,in a dissolute way,2234
202818,00497008,r,10,in an imminent manner,2234
202819,00497086,r,10,in an integral manner,
202820,00497164,r,10,in a martial manner,
202754,00489925,r,10,"in what: ""wherein consists this matter?""",
202757,00490196,r,10,"in regard to which: ""a case wherein he took an active part""",
202767,00491109,r,10,"out of, or by means of which: ""tools wherewith to scrape the windshield of my car""",
202758,00490291,r,10,"of what: ""he knows whereof he speaks""",
202760,00490459,r,10,"on which: ""land whereon to grow corn""",
202763,00490659,r,10,"to which: ""the species whereto this name might be better applied""",
202769,00491318,r,10,"to whatever place: ""whithersoever you go...""",
202770,00491414,r,10,"without reserve; without reservation: ""he adopted wholeheartedly some of the policies that he had previously criticized""",2234
202772,00491775,r,10,"extremely: ""they all were whopping drunk""",
202773,00491853,r,10,"to or over a great extent or range; far: ""wandered wide through many lands""; ""he traveled widely""",
202774,00491992,r,10,"to a great degree: ""her work is widely known""",
202789,00493810,r,10,"not only so, but: ""I therein do rejoice, yea, and will rejoice""",
202776,00492187,r,10,"far from the intended target: ""the arrow went wide of the mark""; ""a bullet went astray and killed a bystander""",
202778,00492456,r,10,"in a willful manner: ""she had willfully deceived me""",1502
202779,00492593,r,10,"in a wishful manner: ""he wishfully indulged in dreams of fame""",
202781,00492884,r,10,"in a withering manner: ""guns fired witheringly at the railroad cars""",
202782,00493010,r,10,"in a witty manner: ""he would wittily chime into our conversation""",
202787,00493548,r,10,"in a wrathful manner: ""he looked at her, not wrathfully now, but quizzically""",
202785,00493379,r,10,in a worthy manner; with worthiness,2234
202790,00493912,r,10,"in a youthful manner: ""he is still youthfully enthusiastic""",2234
202792,00494167,r,10,"with zest: ""she scrubbed the floors of the new apartment zestfully""",1502
202821,00497239,r,10,in a rugged manner,
202793,00494318,r,10,"in a zigzag course or on a zigzag path: ""birds flew zigzag across the blue sky""",
202796,00494637,r,10,"in the interval: ""dancing all the dances with little rest between""",
202797,00494749,r,10,"in the higher atmosphere above the earth: ""weather conditions aloft are fine""",
202799,00494997,r,10,"in an irreproachable and blameless manner: ""she had lived blamelessly until she met this man""",
202801,00495254,r,10,"upward: ""the good news sent her spirits aloft""",
202802,00495334,r,10,"at or on or to the masthead or upper rigging of a ship: ""climbed aloft to unfurl the sail""",
202804,00495589,r,10,"according to circumstances: ""he was convicted circumstantially""",
202808,00495960,r,10,"in a convex way: ""bulging out convexly""",
202809,00496072,r,10,"in a concave way: ""shaped concavely""",
202812,00496353,r,10,"in a defective manner: ""this machine functions only defectively""",
202817,00496907,r,10,"for half the price: ""she bought it half-price during the sale""",
202824,00497540,r,10,"per person: ""we are spending $5,000 per capita annually for education in this district""",
202825,00497701,r,10,"in an identifiably distinctive manner: ""the distinctively conservative district of the county""",
202755,00490001,r,10,"in which; where: ""the particular state wherein you reside""",
202822,00497312,r,10,in a shrewish manner,1502
202751,00489669,r,10,"by or through which: ""the means whereby we achieved our goal""",
202857,00501853,r,10,with reason or justice,
202858,00501924,r,10,toward the posterior end of the body,2188
202829,00498238,r,10,"in an unconcerned manner: ""she could leave the children alone at home without fear""",
202830,00498399,r,10,"to or toward the inside of: ""come in""; ""smash in the door""",
202832,00498637,r,10,"up to that time: ""they had not done any work theretofore""",
202833,00498734,r,10,"in an acute manner: ""she pitied her sister acutely""; ""acutely aware""",
202835,00498984,r,10,"in a manner designed for heavy duty: ""a heavily constructed car""; ""heavily armed""",
202836,00499119,r,10,"in a special manner: ""a specially arranged dinner""",2234
202838,00499396,r,10,"in a haggard manner: ""she looked haggardly out of her tent""",
202840,00499681,r,10,"in a desperate manner: ""she fought back madly""",
202854,00501502,r,10,"unable to act freely: ""he held the enemy's armies in check""",
202842,00499944,r,10,"in a dandy manner: ""she had shown her talents dandily""",2234
202844,00500220,r,10,"in a manner that is pleasing to the senses: ""she smiled softly""",
202845,00500318,r,10,"near or close by: ""he passed immediately behind her""",2234
202846,00500428,r,10,"bearing an immediate relation: ""this immediately concerns your future""",2234
202848,00500767,r,10,"from a source of previously owned goods: ""I prefer to buy second hand""",2234
202849,00500896,r,10,"referring to a quantity: ""the amount was paid in full""",
202850,00500994,r,10,"in an impressively expansive manner: ""she managed to live rather expansively on her modest income""",
202852,00501286,r,10,"flying through the air: ""we saw the ducks in flight""",
202853,00501390,r,10,"never except when: ""call me only if your cold gets worse""",
202869,00503218,r,10,"to an extreme degree: ""the house was super clean for Mother's visit""",
202856,00501755,r,10,"through inherent nature: ""he was naturally lazy""",
202859,00502042,r,10,"in a causal fashion: ""causally efficacious powers""",
202860,00502147,r,10,"in an alarming manner: ""they were fearfully attacked""",
202862,00502382,r,10,"in a calculating manner: ""he looked at her calculatingly""",
202863,00502499,r,10,"by the use of magnetism: ""magnetically contaminated material""",2097
202865,00502745,r,10,"in a prodigal manner: ""he spent prodigally""",2234
202866,00502845,r,10,"so as to leave much space or distance between: ""widely separated""",
202867,00502945,r,10,"in an insignificant manner: ""some people living insignificantly among us""","1946,2097"
202870,00503332,r,10,"to extremes: ""he went overboard to please his in-laws""",
202827,00497998,r,10,"so as to disappear or approach zero: ""errors are vanishingly rare""",
202871,00503424,r,10,"in intense despair: ""the child clung desperately to her mother""",
202873,00503670,r,10,"in an outstanding manner or to an outstanding degree: ""she was outstandingly successful in her profession""","1951,2234"
202874,00503836,r,10,"in a tuneless fashion: ""he whistled tunelessly""",
202877,00504226,r,10,"so as to mellow: ""the rays of the sun struck the earth mellowingly""",
202876,00504094,r,10,"in a heavy-footed manner; ""he walked heavily up the three flights to his room""",
