 rueful manner: """"I made a big mistake,"" he said ruefully""",
200809,00214479,r,10,"with the front foremost: ""the cars collided head-on""",
200811,00214669,r,10,"in an inexorable manner: ""time marches on inexorably""",
200812,00214779,r,10,"in a polite manner: ""the policeman answered politely, ""Now look here, lady...""""",
200813,00215040,r,10,"in an impolite manner: ""he treated her impolitely""",
200815,00215491,r,10,"in an enjoyable manner: ""we spent a pleasantly lazy afternoon""",2234
200839,00219412,r,10,"by right: ""baseball rightfully is the nation's pastime""",
200818,00216022,r,10,"in an inverted manner: ""the box was lying on the floor upside down""",
200819,00216129,r,10,"in a breathless manner: ""she spoke gaspingly""",
200821,00216442,r,10,"in an affable manner: """"Come and visit me,"" he said amiably""",
200823,00216731,r,10,"in an ambiguous manner: ""this letter is worded ambiguously""",
200830,00217841,r,10,"in a narrow manner; not allowing for exceptions: ""he interprets the law narrowly""",2234
200825,00217098,r,10,"in a ceremonial manner: ""he was ceremonially sworn in as President""",
200826,00217253,r,10,"in an unceremonious manner: ""he was dismissed unceremoniously""",
200828,00217560,r,10,"in a rakish manner: ""she wore her hat rakishly at an angle""",
200829,00217717,r,10,"in a carefree manner: ""she was rollickingly happy""",
200832,00218207,r,10,"in a wide fashion: ""he smiled broadly""","1951,2234"
200849,00221112,r,10,"in a secure manner; in a manner free from danger: ""she held the child securely""",
200833,00218299,r,10,"doing twirls: ""they had a most twirlingly magnificent time""",
200836,00218891,r,10,"in debt: ""he fell behind with his mortgage payments""; ""a month behind in the rent""; ""a company that has been run behindhand for years""; ""in arrears with their utility bills""",
200837,00219125,r,10,"in or into an inferior position: ""fell behind in his studies""; ""their business was lagging behind in the competition for customers""",
200841,00219807,r,10,"in a faithful manner: ""it always came on, faithfully, like the radio""",2234
200843,00220271,r,10,"in a violent manner: ""they attacked violently""",
200844,00220391,r,10,"without violence: ""the government was overthrown nonviolently, but the dictator was killed""",
200846,00220692,r,10,"in an impassioned or very angry manner: ""she screamed furiously at her tormentors""",
200848,00221014,r,10,"alternately upward and downward: ""he eyed him up and down""",
200850,00221255,r,10,"in a wry manner: """"I see,"" he commented wryly""",
200851,00221353,r,10,"continuing forever without end: ""there are infinitely many possibilities""",
200853,00221676,r,10,"without bounds: ""he is infinitely wealthy""","1951,2234"
200854,00221822,r,10,"in a rigorous manner: ""he had been trained rigorously by the monks""",
200855,00221975,r,10,"in a plastic manner: ""he used the clay plastically""",1753
200857,00222217,r,10,"in a major way: ""the play failed big at the box office""",
200858,00222304,r,10,"on a grand scale: ""think big""",
200793,00211845,r,10,"in a realistic manner: ""let's look at the situation realistically""",
200822,00216613,r,10,"with laughter; while laughing: ""he told the story laughingly""",
200862,00222669,r,10,without heed or caution,1502
200884,00225533,r,10,in bed,
200889,00226289,r,10,with agitation or turbulence,
200890,00226391,r,10,without qualification or limitation,
200937,00232939,r,10,in a charming manner,
200866,00223089,r,10,"throughout an area: ""he is known the world over""",
200867,00223170,r,10,"by means of an editorial: ""the paper commented editorially on the scandal""","1422,2425,2657"
200870,00223640,r,10,"with anger: ""he angrily denied the accusation""",
200872,00223875,r,10,"in a sedulous manner: ""this illusion has been sedulously fostered""",
200873,00223998,r,10,"in a tenuous manner: ""his works tenuously survive in the minds of a few scholars""",
200878,00224734,r,10,"in an infelicitous manner: ""this function is ineptly left to a small voice""",2234
200880,00225041,r,10,"in your mind: ""he suffered mentally""",
200864,00222870,r,10,"throughout a period of time: ""stay over the weekend""",
200895,00227009,r,10,"showing disapproval; in a disparaging way: ""he reviewed the play unfavorably""",
200881,00225132,r,10,"in a round manner: ""she was roundly slim""",
200882,00225227,r,10,"in a shy or timid or bashful manner: ""he smiled shyly""",1502
200885,00225572,r,10,"with much noise or loud and unpleasant sound: ""he blew his nose noisily""",
200886,00225716,r,10,"with little or no sound: ""the class was listening quietly and intently""; ""she was crying quietly""",
200891,00226486,r,10,"in outward appearance: ""outwardly, she appeared composed""",
200892,00226617,r,10,"with respect to private feelings: ""inwardly, she was raging""",1502
200893,00226759,r,10,"with respect to the outside: ""outwardly, the figure is smooth""",
200894,00226872,r,10,"showing approval: ""he reviewed the play favorably""",
200897,00227305,r,10,"in an unhappy manner: ""he cheerlessly set out to do the task""",
200898,00227424,r,10,"in an adroit manner: ""he bounced it cleanly off the wall""",
200916,00229840,r,10,"in reserve; not for immediate use: ""started setting aside money to buy a car""; ""put something by for her old age""; ""has a nestegg tucked away for a rainy day""",
200899,00227566,r,10,"with strength and soundness: ""a solidly built house""",
200901,00227764,r,10,"as an undiversified whole: ""the unions voted solidly for Roosevelt""",
200902,00227885,r,10,"in a dry laconic manner: ""I know that,"" he said dryly",1969
200903,00228022,r,10,"in accommodation: ""obligingly, he lowered his voice""",
200905,00228318,r,10,"against your will: ""he was involuntarily held against his will""",
200906,00228459,r,10,"without making errors: ""he unerringly fixed things for us""",
200908,00228716,r,10,"with gloom: ""such a change is gloomily foreseen by many""",
200909,00228827,r,10,"under cruel circumstances: ""a cruelly bitter winter""",
200911,00229039,r,10,"in a vague way: ""he looked vaguely familiar""; ""he explained it somewhat mistily""",2234
200912,00229183,r,10,"in a pompous manner: ""he pompously described his achievements""",
200923,00231103,r,10,"in a different direction: ""turn aside""; ""turn away one's face""; ""glanced away""",
200919,00230353,r,10,"placed or kept separate and distinct as for a purpose: ""had a feeling of being set apart""; ""quality sets it apart""; ""a day set aside for relaxing""",
200920,00230541,r,10,"away from another or others: ""they grew apart over the years""; ""kept apart from the group out of shyness""; ""decided to live apart""",
200875,00224285,r,10,"everlastingly; for all time: ""rays...streaming perpetually from the sun""-Stuart Chase",
200926,00231589,r,10,"so as to be removed or gotten rid of: ""cleared the mess away""; ""the rotted wood had to be cut away""",
200927,00231721,r,10,"freely or at will: ""fire away!",
200924,00231222,r,10,"in or into a proper place (especially for storage or safekeeping); ""put the toys away; ""her jewels are locked away in a safe""; ""filed the letter away""",
200929,00231851,r,10,"with obstinate determination: ""he pursued her doggedly""",
200930,00231993,r,10,"in an efficient manner: ""he functions efficiently""",
200928,00231784,r,10,in a series; one after another,
200932,00232315,r,10,"in a discordant manner: ""the piece ended discordantly""",
200933,00232445,r,10,"without liveliness: ""she nodded her head dully""",2234
200935,00232697,r,10,"without losing equilibrium: ""she took all his criticism in stride""",
200936,00232844,r,10,"without tonality: ""he composes atonally""",
200877,00224570,r,10,"with ineptitude; in an incompetent manner: ""he performed his functions ineptly""",
200915,00229722,r,10,"from one's possession; ""he gave out money to the poor""; ""gave away the tickets""",
200946,00234240,r,10,(law) deliberately or knowingly,1802
200967,00237275,r,10,in a lawless rebellious manner,
200973,00238150,r,10,lacking determination or decisiveness,
200983,00239630,r,10,in a commensal manner,2158
200992,00240894,r,10,without having a choice,
200941,00233454,r,10,"in a curvaceous way: ""his date was curvaceously beguiling""",
200942,00233599,r,10,"in an ominous manner: ""the sun darkened ominously""",
200943,00233705,r,10,"in a restive manner: ""he sat down again, restively""",
200945,00234009,r,10,"without knowledge or intention: ""he unwittingly deleted the references""","1502,1781"
200947,00234308,r,10,"with equanimity: """"I bought it,"" she said contentedly""",
200948,00234420,r,10,"in a compassionate manner: ""the nurse looked at him pityingly""",
200950,00234716,r,10,"in a callous way: ""he callously exploited their feelings""",1502
200951,00234861,r,10,"with good reason: ""he is justifiably bitter""",
200952,00234995,r,10,"without any excuse: ""he is unjustifiably harsh on her""",
200956,00235568,r,10,"in an immodest manner: ""the book was entitled, immodestly, ""All about Wisdom""""",
200969,00237503,r,10,"with sternness; in a severe manner: """"No,"" she said sternly""; ""peered severely over her glasses""",
200958,00235819,r,10,"incapable of being resisted: ""the candy looked overwhelmingly desirable to the dieting man""",
200960,00236213,r,10,"at or in or to the adjacent residence: ""the criminal had been living next door all this time""",
200961,00236396,r,10,"at the same pitch: ""they sang in unison""",
200963,00236664,r,10,"in complete agreement: ""my feelings about the matter are in unison with yours""",
200964,00236792,r,10,"after everything has been considered: ""in the final analysis, we are quite well off""",
200965,00236962,r,10,"by virtue of analysis: ""assuming that the distinction is maintained one may ask which is to be analytically prior?""","1451,2873"
200968,00237364,r,10,"in a crooked lopsided manner: ""he smiled lopsidedly""",2234
200971,00237793,r,10,"in an authoritative manner: ""she spoke authoritatively""",
200974,00238264,r,10,"in a speculative manner: ""he looked at her speculatively""",
200975,00238400,r,10,"in a beautiful manner: ""her face was beautifully made up""",2234
200976,00238566,r,10,"in an unattractive manner: ""she was unattractively dressed last night""",2234
200977,00238715,r,10,"in a sullen manner: ""he sat in his chair dourly""",1502
200979,00239058,r,10,"with awareness: ""she consciously played with the idea of inviting them""",
200980,00239205,r,10,"without awareness: ""she jumped up unconsciously when he entered the room""",
200982,00239481,r,10,"in an unconcerned manner: ""glanced casually at the headlines""",
200984,00239709,r,10,"in competition: ""the companies should bid competitively""",
200986,00240003,r,10,"in a compulsive manner: ""he cleaned his shoes compulsively after every walk""",
200987,00240204,r,10,"with respect to structure: ""structurally, the organization is healthy""",
200990,00240624,r,10,"without official authorization: ""he had made some money on the side""",
200940,00233328,r,10,"in a fascinating manner: ""her face became fascinatingly distorted""",2234
200993,00240957,r,10,"in a believable manner: ""he acted believably sincere""",2234
200994,00241103,r,10,"in an unbelievable manner: ""he was unbelievably angry""",2234
200995,00241234,r,10,"under the feet: ""trampled the beans underfoot""; ""green grass growing underfoot""",
200997,00241482,r,10,"together: ""hand in hand with hope went fear""; ""doctors and nurses work hand in hand to save lives""",
200999,00241807,r,10,"in an emotionally fierce manner: ""she was fiercely proud of her children""","1951,2234"
201000,00241935,r,10,"from the subconscious mind: ""the image came to him subsconsciously""",
201001,00242063,r,10,"in a vivid manner: ""he described his adventures vividly""",
201003,00242297,r,10,"in an expectant manner: ""she looked at him expectantly""",
201004,00242410,r,10,"in a healthy manner: ""the young plants grew lustily""",2232
201006,00242670,r,10,"by ten times as much: ""the population increased tenfold""",
201007,00242762,r,10,"in a quantitative manner: ""this can be expressed quantitatively""","1951,2234"
201009,00243017,r,10,"as written or printed: ""this is exactly what the composer had set down on paper""",
201010,00243147,r,10,"in an very impressive manner: ""your performance will improve dramatically""",
201012,00243464,r,10,"in an obscure manner: ""this work is obscurely written""",
200989,00240446,r,10,"in a northern direction: ""they earn more up North""; ""Let's go north!""",
200954,00235247,r,10,"on foot; walking: ""they went to the village afoot""; ""quail are hunted either afoot or on horseback""",
201019,00244349,r,10,in a contrary disobedient manner,
201032,00246250,r,10,"on a ship, train, plane or other vehicle",
201038,00246855,r,10,"alongside each other, facing on the same direction",
201047,00247758,r,10,derived form observed facts,
201048,00247844,r,10,"derived by logic, without observed facts",
201052,00248386,r,10,in respect to jurisprudence or the science or philosophy of law,"1451,1802"
201054,00248612,r,10,in ordinary language,
201063,00249650,r,10,in an overly sweet manner,
201072,00250780,r,10,all other things being equal,
201076,00251195,r,10,in the same place (used when citing a reference),
201083,00252003,r,10,with the necessary changes having been carried out,
201085,00252212,r,10,used in legal language,
201086,00252292,r,10,used to refer to cited works,
201017,00244092,r,10,"in uncharacteristic manner: ""he was uncharacteristically cool""",
201020,00244484,r,10,"in a dialectic manner: ""his religiousness is dialectically related to his sinfulness""",1451
201021,00244629,r,10,"in a prophetic manner: ""he prophetically anticipated the disaster""",
201025,00245423,r,10,"as a matter of instinct: ""he instinctively grabbed the knife""",
201026,00245544,r,10,"on or from the inside: ""an internally controlled environment""",2234
201033,00246335,r,10,"part of a group: ""Bill's been aboard for three years now""",
201040,00247068,r,10,"one every day: ""we'll save 100 man-hours per diem""",
201087,00252368,r,10,"for the time being; temporarily: ""accepting pro tem that hypothesis consistent with the facts""-J.W.Krutch",
201035,00246524,r,10,"in a uniform manner: ""a uniformly bright surface""",
201031,00246116,r,10,"(baseball) on first or second or third base; ""Their second homer with Bob Allison aboard""",2871
201036,00246629,r,10,"to a high degree: ""she is all too ready to accept the job""",
201039,00246941,r,10,"one every year: ""we issue six volumes per annum""",
201045,00247574,r,10,"before noon: ""let's meet at 11 A.M.""",
201041,00247168,r,10,"in between: ""two houses with a tree between""",
201043,00247343,r,10,"to a sickening extent: ""he played the song ad nauseam""",
201046,00247660,r,10,"between noon and midnight: ""let's meet at 8 P.M.""",
201049,00247939,r,10,"at all points from head to foot: ""he was armed cap-a-pie""",
201051,00248254,r,10,"not conforming to the law: ""they were unlawfully married""",1802
201050,00248053,r,10,"by law; conforming to the law: ""we are lawfully wedded now""",1802
201053,00248513,r,10,"quietly in concealment: ""he lay doggo""",
201056,00248777,r,10,"by virtue of position: ""the president sat on the committee ex officio""",
201057,00248907,r,10,"for the standard number of hours: ""she works full-time""",
201059,00249150,r,10,"in a bilateral manner: ""they worked out an agreement bilaterally""",
201060,00249291,r,10,"in a unilateral manner: ""they worked out an agreement unilaterally""",
201061,00249435,r,10,"in a blatant manner: ""they blatantly violated the laws""",
201064,00249731,r,10,"make a telephone call or mail a package so that the recipient pays: ""call collect""; ""send a package collect""",
201065,00249875,r,10,"collecting the charges upon delivery: ""mail a package C.O.D.""",
201067,00250213,r,10,"in the direction that the hands of a clock move: ""please move clockwise in a circle""",
201068,00250371,r,10,"in the manner of death: ""he was deathly pale""",
201069,00250452,r,10,"prominently forward: ""he put his best foot foremost""",
201070,00250549,r,10,"every two weeks: ""he visited his cousins fortnightly""",
201074,00250960,r,10,"in a hierarchical manner: ""hierarchically organized""",
201075,00251073,r,10,"in a disordered manner: ""they were piled up higgledy-piggledy""",
201073,00250852,r,10,"(formal) by means of this; ""I hereby declare you man and wife""",
201078,00251408,r,10,"in the original place or site: ""the archeologists left the pottery in situ""",
201079,00251530,r,10,"among other things: ""the committee recommended, inter alia, that he be promoted""",
201084,00252098,r,10,"to a degree of excellence: ""he is the honest politician par excellence""",
201028,00245827,r,10,"above the head; over the head: ""bring the legs together overhead""",
201081,00251751,r,10,"(used when listing or enumerating items) also; ""a length of chain, item a hook""-Philip Guedalla",
201016,00243947,r,10,"in characteristic manner: ""he arrived characteristically late""",
201088,00252524,r,10,without a date fixed (as of an adjournment),
201106,00254416,r,10,at the point of death,
201115,00255348,r,10,at first sight,
201117,00255606,r,10,in proportion,
201148,00259904,r,10,in an unfruitful manner,
201156,00260986,r,10,in an anterior direction,"2188,2234"
201161,00261800,r,10,with a feeling of shame,
201092,00252958,r,10,"three times: ""I called you thrice last night""",
201093,00253038,r,10,"using exactly the same words: ""he repeated her remarks verbatim""",
201095,00253262,r,10,"orally: ""I heard it viva voce""",
201108,00254657,r,10,"without preparation: ""I don't know the figures off-hand""",
201098,00253534,r,10,"towards or into the interior of a region: ""the town is five miles inland""",
201097,00253456,r,10,"(in writing) see below; ""vide infra""",
201099,00253642,r,10,"toward the shore: ""we swam two miles inshore""",
201101,00253851,r,10,"toward the outside: ""move the needle further outward!""",
201102,00253970,r,10,"up to the knees: ""we were standing knee-deep in the water""",
201103,00254078,r,10,"up to the breast: ""we were standing breast-high in the water""",
201109,00254763,r,10,"not in public: ""the deal was done offstage""",
201105,00254270,r,10,"comparatives of ""soon"" or ""early""; ""Come a little sooner, if you can""; ""came earlier than I expected""",
201122,00256072,r,10,"in a specified area or place: ""you shouldn't be up here""",
201112,00255068,r,10,"beyond the regular time: ""she often has to work overtime""",
201138,00258276,r,10,"off the subject; beyond the point at issue: ""such digressions can lead us too far afield""",
201116,00255402,r,10,"in a set manner without serious attention: ""they answered my letter pro forma""; ""he kissed her cheek perfunctorily""",
201113,00255162,r,10,by necessity; by force of circumstance,
201118,00255692,r,10,"without paying rent: ""I can live here rent-free""",
201120,00255909,r,10,"free from harm or penalty: ""he went scot-free""",
201121,00255993,r,10,"toward the sky: ""look skywards!""",
201124,00256305,r,10,"in a tasteful way: ""this building is aesthetically very pleasing""",
201090,00252708,r,10,"in secret or covertly: ""held a meeting sub rosa to avoid general criticism""",
201125,00256463,r,10,"in a very painful manner: ""the progress was agonizingly slow""",
201126,00256649,r,10,"to an appalling extent: ""the prisoners were appallingly thin""",
201128,00256899,r,10,"in an unappealing manner: ""the kitchen was unappealingly dirty""",
201129,00257040,r,10,"in an approving manner: ""she nodded approvingly""",
201130,00257180,r,10,"showing disapproval: ""he shook his head disapprovingly""",
201132,00257494,r,10,"in an unambitious manner: ""he does his job, but he works unambitiously""",1502
201133,00257643,r,10,"in an amicable manner: ""they separated amicably""",
201134,00257746,r,10,"without giving a name: ""she wrote these letters anonymously""",1975
201143,00259086,r,10,"without previous thought or preparation: ""couldn't give the figures offhand""; ""we decided offhand to go to Canada""; ""she had made these remarks offhandedly""",
201150,00260188,r,10,"in a manner difficult to understand: ""the professor's abstrusely reasoned theories were wasted on his students""",
201141,00258752,r,10,"in an animated manner: ""they talked animatedly""",
201144,00259322,r,10,"not methodically or according to plan: ""he dealt with his course work casually""",
201140,00258609,r,10,"far away from home or one's usual surroundings; ""looking afield for new lands to conquer""-R.A.Hall",
201147,00259750,r,10,"in a hopeless resigned manner: ""she shrugged her shoulders abjectly""",
201146,00259599,r,10,"(theater) at or toward the front of the stage; ""the actors moved further and further downstage""",2610
201154,00260705,r,10,"in an adorable manner: ""the toddler behaved adorably""",
201155,00260845,r,10,"in an antagonistic manner: ""he behaves antagonistically toward his colleagues""",
201151,00260356,r,10,"(music) with increasing speed; ""here you must play accelerando""",2536
201152,00260477,r,10,"(music) slowly; ""here you must play adagio""",2536
201159,00261423,r,10,"in an arrogant manner: ""in the old days she had been harsh and stiff ; afraid of her husband and yet arrogantly proud that she had a husband strong and fierce enough to make her afraid""",1502
201162,00261897,r,10,"in an assertive manner: """"I will take care of my own life,"" she said assertively""",
201096,00253349,r,10,"without payment: ""I'll give you this gratis""",1753
201110,00254843,r,10,"behind the scenes; not on stage: ""the actors were waiting offstage""",
201182,00264739,r,10,involving a great bloodshed,
201198,00266763,r,10,in an ungrateful manner,
201205,00267715,r,10,with perseverance,
201206,00267792,r,10,with persistence,
201213,00268605,r,10,at or near or toward the middle,
201221,00269606,r,10,with playful slyness or roguishness,
201227,00270390,r,10,over or across in a slanting direction,
201229,00270555,r,10,in the sleep of death,
201235,00271466,r,10,with the legs stretched far apart,
201236,00271535,r,10,at right angles to the center line of a ship,
201237,00271615,r,10,"on, to, or at the top",
201166,00262544,r,10,"in an avid manner: ""whatever the flavor or color of your local paper, do remember that these are read avidly for local information""",
201168,00262842,r,10,"as an adverb: ""the prepositional phrase here is used adverbially""",1974
201171,00263198,r,10,"in an amorous manner: ""he looked at her amorously""",
201170,00263072,r,10,"(music) at a moderately slow temp; ""this passage must be played andante""",2536
201172,00263316,r,10,"like an angel: ""the child was sleeping angelically""",2234
201174,00263571,r,10,"in an articulate manner: ""he argued articulately for his plan""",
201177,00264047,r,10,"in an audible manner: ""he spoke audibly""",2101
201176,00263910,r,10,"(grammar) in an attributive manner; ""the genitive noun is used attributively""",1974
201178,00264159,r,10,"in an inaudible manner: ""she spoke inaudibly low""",2101
201179,00264282,r,10,"in a beastly manner: ""she behaved beastly toward her mother-in-law""",2234
201183,00264839,r,10,"while blushing: ""she stated her name blushingly""",
201212,00268500,r,10,"at full speed; with great haste: ""the children ran down the hill amain""",
201185,00265064,r,10,"in a turgid manner: ""he lectured bombastically about his theories""",
201186,00265219,r,10,"like a boy: ""he smiled boyishly at his fiancee""",2234
201188,00265448,r,10,"with hands on hips and elbows extending outward: ""she stood there akimbo""",
201189,00265556,r,10,"on or toward the lee: ""put the helm alee""",
201191,00265761,r,10,"as known or named at another time or place: ""Mr. Smith, alias Mr. Lafayette""",
201195,00266267,r,10,"in an altruistic manner: ""he acted selflessly when he helped the old lady in distress""",
201192,00265896,r,10,"(music) in a moderately quick tempo; ""play this more allegretto""",2536
201193,00266017,r,10,"(music) in a quick and lively tempo; ""play this section allegro""",2536
201196,00266445,r,10,"in an anomalous manner: ""this man behaves anomalously""",
201199,00266918,r,10,"with respect to arithmetic: ""this problem is arithmetically easy""",2873
201200,00267044,r,10,"with a side or oblique glance: ""did not quite turn all the way back but looked askance at me with her dark eyes""",
201202,00267291,r,10,"away from the correct or expected course: ""something has gone awry in our plans""; ""something went badly amiss in the preparations""",
201204,00267585,r,10,"with care and persistence: ""she worked assiduously on the senior thesis""",
201207,00267867,r,10,"in a shrewd manner: ""he invested his fortune astutely""",
201209,00268174,r,10,"to the opposite side: ""the football field was 300 feet across""",
201210,00268271,r,10,"in such a manner as to be understood and accepted: ""she cannot get her ideas across""",
201217,00269117,r,10,"at an opportune time: ""your letter arrived apropos""",
201215,00268871,r,10,"wildly; without self-control; ""when the restaurant caught fire the patrons ran amuck blocking the exit",
201216,00269014,r,10,with antithesis; in an antithetical manner,2234
201219,00269369,r,10,"not in accordance with the season: ""it was unseasonably cold""",
201220,00269489,r,10,"by the way: ""apropos, can you lend me some money for the weekend?""",
201224,00269955,r,10,"in a crude and unskilled manner: ""an inexpertly constructed lean-to""",
201164,00262219,r,10,"without a doubt: ""the grammar schools were assuredly not intended for the gentry alone""",
